track_id,track_name,song_lyrics
0tUVnDB0pM7xYGGgIKnyVf,Super Bass,"180 ContributorsTranslationsPortuguêsSuper Bass Lyrics[Intro: Nicki Minaj]
Yeah, yeah, yeah, hey

[Verse 1: Nicki Minaj]
This one is for the boys with the boomin' system
Top down, AC with the cooler system
When he come up in the club, he be blazin' up
Got stacks on deck like he savin' up
And he ill, he real, he might gotta deal
He pop bottles and he got the right kind of build
He cold, he dope, he might sell coke
He always in the air, but he never fly coach
He a mothafuckin trip, trip, sailor of the ship, ship
When he make it drip, drip, kiss him on the lip, lip
That's the kinda dude I was lookin' for
And yes, you'll get slapped if you're lookin', ho

[Pre-Chorus: Nicki Minaj]
I said, excuse me, you're a hell of a guy
I mean, my, my, my, my, you're like pelican fly
I mean, you're so shy and I'm loving your tie
You're like slicker than the guy with the thing on his eye, oh
Yes, I did, yes, I did
Somebody please tell em who the F I is
I am Nicki Minaj, I mack them dudes up
Back coupes up and chuck the deuce up
You might also like[Chorus: Nicki Minaj & Ester Dean]
Boy, you got my heartbeat runnin' away
Beatin' like a drum and it's comin' your way
Can't you hear that
Boom, badoom, boom, boom, badoom, boom, bass?
He got that super bass
Boom, badoom, boom, boom, badoom, boom, bass
Yeah, that's that super bass
Boom, boom, boom, badoom (Bass, bass)
Boom, boom, boom (Bass, yeah)
Boom, boom, boom, badoom (Bass, bass)
Boom, boom, boom (Bass)
Boom, badoom, boom, boom, badoom, boom, bass
He got that super bass
Boom, badoom, boom, boom, badoom, boom, bass
Yeah, that's that super bass (Yo, yo)

[Verse 2: Nicki Minaj]
This one is for the boys in the polos
Entrepreneur niggas and the moguls
He could ball with the crew, he could solo
But I think I like him better when he dolo
And I think I like him better with the fitted cap on
He ain't even gotta try to put the mack on
He just gotta give me that look, when he give me that look
Then the panties comin' off, off, uh
[Pre-Chorus: Nicki Minaj]
Excuse me, you're a hell of a guy
You know, I really got a thing for American guys
I mean, sigh, sickenin' eyes
I can tell that you're in touch with your feminine side, uh
Yes, I did, yes, I did
Somebody please tell 'em who the F I is
I am Nicki Minaj, I mack them dudes up
Back coupes up and chuck the deuce up

[Chorus: Nicki Minaj & Ester Dean]
Boy, you got my heartbeat runnin' away
Beatin' like a drum and it's comin' your way
Can't you hear that
Boom, badoom, boom, boom, badoom, boom, bass?
He got that super bass
Boom, badoom, boom, boom, badoom, boom, bass
Yeah, that's that super bass
Boom, boom, boom, badoom (Bass, bass)
Boom, boom, boom (Bass, yeah)
Boom, boom, boom, badoom (Bass, bass)
Boom, boom, boom (Bass)
Boom, badoom, boom, boom, badoom, boom, bass
He got that super bass
Boom, badoom, boom, boom, badoom, boom, bass
Yeah, that's that super bass (Yo, yo)
[Bridge: Nicki Minaj]
See, I need you in my life for me to stay
Know, know, know, know, know, I know you'll stay
No, no, no, no, no, don't go away, hey
Boy, you got my heartbeat runnin' away
Don't you hear that heartbeat comin' your way?
Oh, it be like
Boom, badoom, boom, boom, badoom, boom, bass
Can't you hear that
Boom, badoom, boom, boom, badoom, boom, bass?

[Chorus: Nicki Minaj & Ester Dean]
Boy, you got my heartbeat runnin' away
Beatin' like a drum and it's comin' your way
Can't you hear that
Boom, badoom, boom, boom, badoom, boom, bass?
He got that super bass
Boom, badoom, boom, boom, badoom, boom, bass
Yeah, that's that super bass
Boom, boom, boom, badoom (Bass, bass)
Boom, boom, boom (Bass, yeah)
Boom, boom, boom, badoom (Bass, bass)
Boom, boom, boom (Bass)
Boom, badoom, boom, boom, badoom, boom, bass
He got that super bass
Boom, badoom, boom, boom, badoom, boom, bass
Yeah, that's that super bass (Yo, yo)137Embed"
1K4W608oGjTtJP4QNYK0rB,Blow Ya Mind,"36 ContributorsTranslationsPortuguêsBlow Ya Mind Lyrics[Chorus: Danny SchofIeld]
She said her name was Nicki
She came to play and her body was sick, yeah
She kill when she walks, so sexy when she talk
Aw, you know she gonna blow ya mind
Okay, Nicki

[Post-Chorus: Safaree & Nicki Minaj]
Somebody, somebody, some, some
Somebody, somebody, some (Get 'em)
Somebody, somebody, some, some
Somebody, somebody, some (Get 'em)
Somebody, somebody, some, some
Somebody, somebody, some (Get 'em, ayo)
Somebody, somebody, some, some (Get 'em, yo, yo, yo)
Somebody, somebody, some (Get 'em, yo, yo, ayo)

[Verse 1: Nicki Minaj]
Did these niggas fall and bump their little heads?
I got 'em like, ah, which one of them I'ma dead?
'Cause when they get sick, they start to cough bread
So (Eh, eh, eh) just cough up that bread
The body look right, plus we crop heads
The Rolls Royce phantom, yep, the Drophead
And that just goes to show I'm that bitch
I twenty-six inched the rims with black lips
You might also like[Pre-Chorus: Nicki Minaj]
Now this is the anthem, this, this is the anthem
Now this is the anthem, this, this is the anthem
I'm in there, I'm in there, all in your in-ear
Boy, I put this pussy on your chinny, chin, chin, yeah

[Chorus: Danny SchofIeld]
She said her name was Nicki
She came to play and her body was sick, yeah
She kill when she walks, so sexy when she talk
Aw, you know she gonna blow ya mind
Okay, Nicki

[Post-Chorus: Safaree & Nicki Minaj]
Somebody, somebody, some, some
Somebody, somebody, some (Get 'em)
Somebody, somebody, some, some
Somebody, somebody, some (Get 'em)
Somebody, somebody, some, some
Somebody, somebody, some (Get 'em, uh-huh)
Somebody, somebody, some, some (Get 'em, yo, yo, yo)
Somebody, somebody, some (Get 'em, yo, yo)

[Verse 2: Nicki Minaj]
Woah, woah, woah, woah, woah
Tell that nigga not to drink no mo'
Thinkin' that he hot, he really just so-so
That's just a ridiculous mofo
Fuck I look like? (All that) Pull up in the (All black)
Suede on my (Floor mat), bad bitch (Format)
Rosé (Pour that), don't expect a (Call back)
'Cause I'm international, tell him to call me Borat
[Pre-Chorus: Nicki Minaj]
Now this is the anthem, this, this is the anthem
Now this is the anthem, this, this is the anthem
In-ear, in-ear, in-ear, in-ear, all in your in-ear
Boy, I put this pussy on your chinny, chin, chin, yeah

[Chorus: Danny SchofIeld]
She said her name was Nicki
She came to play and her body was sick, yeah
She kill when she walks, so sexy when she talk
Aw, you know she gonna blow ya mind
Okay, Nicki

[Post-Chorus: Safaree & Nicki Minaj]
Somebody, somebody, some, some
Somebody, somebody, some (Get 'em)
Somebody, somebody, some, some
Somebody, somebody, some (Get 'em)
Somebody, somebody, some, some
Somebody, somebody, some (Get 'em)
Somebody, somebody, some, some (Get 'em)
Somebody, somebody, some (Get 'em)

[Bridge: Nicki Minaj]
Fuck I look like? What the fuck I look like?
I'm a bad motherfucker, what the fuck I look like?
Fu-fu-fuck I look like? What the fuck I look like?
I'm a bad motherfucker, what the fuck I look like?
Fu-fu-fuck I look like? What the fuck I look like?
I'm a bad motherfucker, what the fuck I look like?
Fu-fu-fuck I look like? What the fuck I look like?
I'm a bad motherfucker, what the fuck I look like?
[Chorus: Danny SchofIeld]
She said her name was Nicki
She came to play and her body was sick, yeah
She kill when she walks, so sexy when she talk
Aw, you know she gonna blow ya mind
Okay, Nicki

[Post-Chorus: Safaree]
Somebody, somebody, some, some
Somebody, somebody, some (Get 'em)
Somebody, somebody, some, some
Somebody, somebody, some (Get 'em)
Somebody, somebody, some, some
Somebody, somebody, some (Get 'em)
Somebody, somebody, some, some (Get 'em)
Somebody, somebody, some (Get 'em)7Embed"
26GiqYCDH0KpIXpXqeu2i0,Muny,"61 ContributorsTranslationsPortuguêsMuny Lyrics[Pre-Chorus]
Oh no, we don't play with silly girls
All I know is the material girls
Give me the muny, the cars, the caseloads
The mun-mun-muny, the yen and the pesos

[Chorus]
The mun-mun-muny, the mun-mun-muny
The mun-mun-muny, yen and the pesos
The mun-mun-muny, the mun-mun-muny
The mun-mun-muny, yen and the pesos
The mun-mun-muny, the mun-mun-muny
The mun-mun-muny, yen and the pesos
The mun-mun-muny, the mun-mun-muny
The mun-mun-mun-mun-muny, the mun-mun-mun-mun-muny

[Verse 1]
Told y'all on Drake's shit, told y'all to fixate
Bitches want my old shit, buy my old mixtape (Oh)
I ain't fuckin' with you bum bitches no more
Always in the club lookin' like a bozo
Talkin' 'bout money, we could have a conversation
Top five tax bracket in the population
Hatin' and I know they got a reason why
I ain't gotta wonder if I want to lease or buy
And I dictate how I'm gon' piece the pie
I ain't talkin' about no mothafuckin' pizza pie
'Cause I keep a bad bitch, booty big and the waist thin
Seen his little weiner, but we don't like Nathans
Nah, homie, you gon' need a bigger cock-pit
'Cause when I fly, I be right behind the cockpit
You might also like[Break]
Ayo, Captain, ayo, Cap
I-I don't wanna hear that navigation, big pa
I'm tryin', I'm tryin' to get some sleep, ya dig?

[Pre-Chorus]
Oh no, we don't play with silly girls
All I know is the material girls
Give me the muny, the cars, the caseloads
The mun-mun-muny, the yen and the pesos

[Chorus]
The mun-mun-muny, the mun-mun-muny
The mun-mun-muny, yen and the pesos
The mun-mun-muny, the mun-mun-muny
The mun-mun-muny, yen and the pesos
The mun-mun-muny, the mun-mun-muny
The mun-mun-muny, yen and the pesos
The mun-mun-muny, the mun-mun-muny
The mun-mun-mun-mun-muny, the mun-mun-mun-mun-muny

[Verse 2]
I'm in the UK, but just for one day
Who's to say I won't come back again?
Materialistic, I'm narcissistic
My shoe game is mean, it's so sadistic
I took the Learjet to cop some lipstick
Yeah, I'ma risk it, I'm optimistic
I sip on Rosé, you sip your Mystic
My flow's a biscuit short of a picnic
Okay, Versace Pythons, Louis aviators
Balenciagas and they gotta be the Gladiators
Chanel lambskin, vintage Vanson
I'm on the bike, doin' wheelies in a mansion
A lot of bad bitches on the pole dancin'
Gucci bag, just to put the coke cans in
[Break]
Hey, yo, Anna, hey, yo, Anna Wintour
I'ma need that cover, baby girl
It's Pink Friday, ya dig?

[Pre-Chorus]
Oh no, we don't play with silly girls
All I know is the material girls
Give me the muny, the cars, the caseloads
The mun-mun-muny, the yen and the pesos

[Chorus]
The mun-mun-muny, the mun-mun-muny
The mun-mun-muny, yen and the pesos
The mun-mun-muny, the mun-mun-muny
The mun-mun-muny, yen and the pesos
The mun-mun-muny, the mun-mun-muny
The mun-mun-muny, yen and the pesos
The mun-mun-muny, the mun-mun-muny
The mun-mun-mun-mun-muny, the mun-mun-mun-mun-muny

[Bridge]
Material, I’m always on that new shit
Material, this shit is exclusive
Material, material world for material girls (Girls, girls, girls)
Material, don't ever get the truth bent
Material, I could give you the blueprint
Material, material world for material girls (Girls, girls, girls)
[Outro]
Material, material, ma-ma-material
Material, material, ma-ma-material
Material, material, ma-ma-material girls (Girls, girls, girls)
Material, material, ma-ma-material
Material, material, ma-ma-material
Material, material, ma-ma-material girls12Embed"
6mQAD6YEsRzAIW9ZlKAYfS,Girls Fall Like Dominoes,"45 ContributorsTranslationsPortuguêsGirls Fall Like Dominoes Lyrics[Chorus: The Big Pink & Nicki Minaj]
These girls fall like dominoes, dominoes
These girls fall like dominoes, d-d-dominoes
These girls fall like dominoes, dominoes
These girls fall like dominoes, d-d-dominoes (Uh-huh)
Dominoes, d-d-dominoes (Yo, ayo, ayo)

[Verse 1: Nicki Minaj]
I'ma need sixty-nine real bad girls for my tour bus
Somebody get security to escort us
They go the long way, but we take the short cuts
Give me the blonde hair, long weave, short cuts
You know the flow sick, came in on the small bus
So give the D-cup, C-cup, small bust
They judge me like the girl's on trial
But every time that I come out, it's just girls gone wild
Got the domino effect, in the front row passing out
With little bikini tops, they got they asses hanging out
Say my shoe game nuts, so I call 'em cashews
Every other city, it's another Nicki tattoo
Steal Wayne girls, I steal Drake girls
You know the real bitches love me, fuck the fake girls
So if you pretty, I sign titties
I got the key to every muhfuckin' city (Kyuh)
[Chorus: The Big Pink, Nicki Minaj]
These girls fall like dominoes, dominoes
These girls fall like dominoes, d-d-dominoes
These girls fall like dominoes, dominoes
These girls fall like dominoes, d-d-dominoes (Yo, yo)
Dominoes, d-d-dominoes (Yo, yo)
You might also like[Verse 2: Nicki Minaj]
Okay, so when I'm in the hills, I hang with Kristin Cavallari
And when I'm in Miami, I'm with Kourtney, Kim, and Khloe
And when I'm in the A, I'm with Ciara or it's Keri
I'm feeling like a diva, then I hit Mariah Carey
I'm in the UK, I'ma see M.I.A
Superhero by night, r-r-rapper by day
And if I just wanna talk, I'ma hit up Monique
If I need a bad bitch, Angelina Jolie (Ooh)
Material girls like Madonna, model for Donatella
Ain't nothing you can tell her 'cause she get the mozzarella
She look just like Rihanna
She work with Wilhelmina, only rocking Galliano
She might be Filipino, be sipping Pellegrino
Be watching Al Pacino, she could probably sniff a kilo
Anyway, yo, hit up Grace Jones and tell her I said Strangé
I'm out in Paris, motherfucker, with Beyoncé
[Chorus: The Big Pink]
These girls fall like dominoes, dominoes
These girls fall like dominoes, d-d-dominoes
These girls fall like dominoes, dominoes
These girls fall like dominoes, d-d-dominoes
Dominoes, d-d-dominoes

[Bridge: Nicki Minaj]
Girls, girls, every day, from London, Canada, and the USA
Girls, girls, every day, from London, Canada, and the USA
Girls, girls, every day, from London, Canada, and the USA
Girls, girls, every day, from London, Canada, and the USA
Where my Westside girls at? (Girls at)
And where my Eastside girls at? (Girls at)
Yo, where my Northside girls at? (Girls at)
And where my down-south girls at? (Girls at)
Yo, where my Westside girls at? (Girls at)
Yo, where my Eastside girls at? (Girls at)
Where my up-north girls at? (Girls at)
Now where my down-south girls at?
[Chorus: The Big Pink]
These girls fall like dominoes, dominoes
These girls fall like dominoes, d-d-dominoes
These girls fall like dominoes, dominoes
These girls fall like dominoes, d-d-dominoes
Dominoes, d-d-dominoes13Embed"
4FlyYrqMInO5uWpCRlTBt8,Roman's Revenge,"226 ContributorsTranslationsPortuguêsRoman’s Revenge Lyrics[Verse 1: Nicki Minaj]
I am not Jasmine, I am Aladdin
So far ahead, these bums is laggin'
See me in that new thing, bums is gaggin'
I'm startin' to feel like a dungeon dragon
Rah, rah, like a dungeon dragon
I'm startin' to feel like a dungeon dragon
Look at my show footage, how these girls be spazzin'
So fuck I look like gettin' back to a has-been?
Yeah, I said it, has-been
Hang it up, flatscreen
Plasma
""Hey Nicki, hey Nicki,"" asthma
I got the pumps, it ain't got medicine
I got bars, sentencin'
I'm a bad bitch, I'm a cunt
And I'll kick that ho, punt
Forced trauma, blunt
You play the back, bitch, I'm in the front
You need a job, this ain't cuttin' it
Nicki Minaj is who you ain't fuckin' with
You lil' Fraggle Rock, beat you with a pad-a-lock
I am a movie, camera block
You outta work, I know it's tough
But enough is enough
You might also like[Chorus: Nicki Minaj]
Rah, rah, like a dungeon dragon
Rah, rah, rah, like a dungeon dragon
Rah, rah, rah, like a dungeon dragon
Like a dungeon dragon, like a dungeon dragon
Rah, rah, rah, like a dungeon dragon
Rah, rah, rah, like a dungeon dragon
Rah, rah, rah, like a dungeon dragon
Like a dungeon dragon, like a dungeon dragon
[Verse 2: Eminem]
I ain't into S&M, but my whip's off the chain
A little drop of candy paint drips off the frame
Twisted-ass mind, got a pretzel for a brain
An eraser for a head, fuckin' pencil for a frame
You don't like it, then peel off, bitch
Every last woman on Earth I'll kill off
And I still wouldn't fuck you, slut
So wipe the smile on your grill off
I swear to God I'll piss a Happy Meal off
Get the wheels turning, spin, and wheel off
Snap the axle in half, bust the tie-rod
Quit hollering, ""Why, God?""
He ain't got shit to do with it
Bygones'll never be bygones
The world ain't finished swallowing my wad
I ain't finished blowing it, nice bra
Hope it'll fit a tough titty, bitch, life's hard
I swear to God life is a dumb blonde white broad
With fake tits and a bad dye job
Who just spit in my fuckin' face and called me a fuckin' tightwad
So finally I broke down and bought her an iPod
And caught her stealing my music
So I tied her arms and legs to the bed
Set up the camera and pissed twice on her
Look, two pees and a tripod
The moral to the story is life's treating you like dry sod?
Kick it back in its face, my God
It's Shady and Nicki Minaj, you might find the sight quite odd
But don't ask why, bitch, ask why not?
The world-world is my punching bag and
If I'm garbage, you're a bunch of maggots
Make that face, go on, scrunch it up at me
Show me the target so I can lunge and attack it
Like a, rah, rah, like a dungeon dragon
You fell off, off, they must've bumped your wagon
You must've went off the back, I'm 'bout to go off the deep end
Told you to stay in your lane, you just jumped in traffic
[Verse 3: Nicki Minaj]
Is this the thanks that I get for puttin' you bitches on?
Is it my fault that all of you bitches gone?
Should've sent a thank-you note, you little ho
Now I'ma wrap your coffin with a bow
""Nicki, she's just mad 'cause you took the spot""
Word, that bitch mad 'cause I took the spot?
Well, bitch, if you ain't shittin', then get off the pot
Got some niggas out in Brooklyn that'll off your top
I hear the mumblin', I hear the cacklin'
I got 'em scared, shook, panickin'
Overseas, church, Vatican
You at a standstill, mannequin
You wanna sleep on me? Overnight?
I'm the motherfuckin' boss, overwrite
And when I pull up, vroom, motorbike
Now all my niggas gettin' buck, overbite
I see them dusty-ass Filas, Levis
Raggedy Anns, holes in your knee-highs
I call the play, now do you see why?
These bitches callin' me Manning, Eli
Manning, Eli, these bitches callin' me Manning, Eli

[Verse 4: Eminem]
All you lil' faggots can suck it
No homo, but I'ma stick it to 'em like refrigerator magnets
And I'm crooked enough to make straitjackets bend
Yeah, look who's back again, bitch, keep acting as if
You have the same passion I have, yeah, right
Still hungry, my ass, you ass-dicks had gastric bypass
Ain't hot enough to set fire to dry grass
And 'bout as violent as hair on eyelids, but eyelash
Go take a flying leap of faith off a fuckin' balcony
'Fore I shove a falcon wing up your fly ass
You know what time it is, so why ask?
When Shady and Nicki's worlds clash
It's high class meets white trash
[Chorus: Nicki Minaj]
Rah, rah, like a dungeon dragon
Rah, rah, rah, like a dungeon dragon
Rah, rah, rah, like a dungeon dragon
Like a dungeon dragon, like a dungeon dragon
Rah, rah, rah, like a dungeon dragon
Rah, rah, rah, like a dungeon dragon
Rah, rah, rah, like a dungeon dragon
Like a dungeon dragon, like a dungeon dragon
[Outro: Nicki Minaj]
Roman, Roman, stop it, stop it
You've gone mad, mad, I tell you, mad
You and this boy Slim Shady
What's going on? They'll lock you away
They'll put you in a jail cell, I promise
Take your mother's warning, Roman, please
Back to bed, run along, let's go, come on
Wash your mouth out with soap, boys77Embed"
0NmDkGHAm5iHcq7Kluz0f5,I’m The Best,"91 ContributorsTranslationsPortuguêsI’m The Best Lyrics[Intro]
Uh
Yo
Yo

[Verse 1]
It was back in '07, did a couple of tapes
Did a couple DVDs, made a couple mistakes
Didn't know what I was doing, but I put on a cape
Now it's, ""Which world tour should I go on today?""
See, you told me I would lose, but I won
I might cop a million Jimmy Choos just for fun
'Cause bitches couldn't take what was in me, Australia, Sydney
Might run up in Disney, out in LA with Lindsay
Got the eye of the tiger, the Lion of Judah
Now it's me and my time, it's just me in my prime
Everything I tried to teach 'em, they gon' see it in time
Tell 'em bitches get a stick, I'm done leadin' the blind
Got two shows tonight, that's Brooklyn and Dallas
Then a private party at the Buckingham Palace
Which means I gotta fly like a movie, no commercial
That's Young Money, Cash Money, yeah, I'm Universal

[Chorus]
I hear they comin' for me
Because the top is lonely
What the fuck they gon' say?
What the fuck they gon' say?
I'm the best bitch doing it, doing it
I'm the best bitch doing it, doing it
I'm the best, best, best, best
I'm the best, best, best, best
I'm the best
You might also like[Verse 2]
I remember when I couldn't buy my mother a couch
Now I'm sitting at the closing, bought my mother a house
You could never understand why I grind like I do
Micaiah and Jelani why I grind like I do
'Cause even when my daddy was on crack, I was crack
Now the whole album crack, you ain't gotta skip a track
I ain't gotta get a plaque, I ain't gotta get awards
I just walk up out the door, all the girls will applaud
All the girls will commend as long as they understand
That I'm fighting for the girls that never thought they could win
'Cause before they could begin, you told 'em it was the end
But I am here to reverse the curse that they live in
Got two bones to pick, I'ma only choose one
You might get addressed on the second album
Which means you can breathe 'til I motherfucking say so
To all my bad bitches, I could see your halo

[Chorus]
I hear they comin' for me
Because the top is lonely
What the fuck they gon' say?
What the fuck they gon' say?
I'm the best bitch doing it, doing it
I'm the best bitch doing it, doing it
I'm the best, best, best, best
I'm the best, best, best, best
I'm the best
[Bridge]
It's okay, it's okay
Long as you know, long as you know
Long as you motherfuckers know
I'm the best, best, best, best, best, best

[Chorus]
I hear they comin' for me (I hope they comin' for me)
Because the top is lonely ('Cause the top is lonely)
What the fuck they gon' say? (What they gon' say?)
What the fuck they gon' say? (What they gon' say?)
I'm the best bitch doing it, doing it
I'm the best bitch doing it, doing it
I'm the best, best, best, best (I'm the best)
I'm the best, best, best, best (I'm the best)
I'm the best28Embed"
