track_id,track_name,song_lyrics
78qHOMYr8nDUd4fIHS5J7k,Check It Out,"4 ContributorsNicki Minaj - Unreleased Songs [Discography List] LyricsBy Year:20032004200620072008200920102011201220142016201720182019202020212022?Or Alphabetical Order:#ABCDEFGHIJKLMNOPQRSTUVWXYZBy Year:2003Batman (with The Hood$tars)
It’s My Party (with The Hood$tars)
Throw Your Hands Up In The Air (HOT 97 Freestyle) (with The Hood$tars)2004Don't Mess With (Jim Johnston & The Hood$tars)
I Might (Angel De-mar)
La-Dee-Da-Dee (We Like To Party) (with Park Slope & The Hood$tars)
Who Run This? (Angel De-mar)
Who Run This? (Studio Acapella) (Angel De-mar)
Who Run This Motherfucker? (The Hood$tars)2006Affirmative Action (Gravy)
Not at All (Ru Spits)
Watch What You Say (Ru Spits)2007Dedicated 2 The Streets (DJ Whiteowl)
Do You Like It Like That? (Ransom)
Freestyle (DJ Whiteowl)
Freestyle (feat. Lil Wayne) (DJ Whiteowl)
Intro (Dirty Money What) (DJ Whiteowl)
It’s Going Down (DJ Whiteowl)
Money Ain’t A Thing (Stack Bundlеs)
Monstars Biz (Gravy)
The Hottest Out (DJ Whiteowl)
Thе Tape Is Crazy (Interlude) (DJ Whiteowl)2008Beef Stew
Big Bidness (Ransom)
Big Bidness (Solo Mix)
I Get Money (Remix)
I’m Back
Make It Last Forever (Remix) (Ciara)
Miss Independent (Remix) (Ne-Yo)
One Night Only (Jason Kay)
Pamper Me (Angel De-mar)
Single Ladies (Remix) (Beyoncé)2009A Failure (Pussy Nigga) [Demo] (Gucci Mane)
Always Love You (Gudda Gudda)
Break Up (Remix) (Mario)
Chocolate Legs (Remix) (Eric Benét)
Cypher ‘09 / BET Cypher 2009
Diamonds on My Neck (Supplya)
Fuck U Silly (Cassie)
Get wit It (DJ Esudd)
Girl You Know (BedRock) [Demo] (Young Money)
I Get Crazy (Original Mix) (feat. Lil Wayne)
Lemonade (Remix) (Gucci Mane)
Old Enough (Remix) (Lil Twist)
Strippin' in the Club (DJ Diamonds Kuts)
Sweet Dreams (Remix) (Beyoncé, Lil Wayne)
TEMPO (Ashley)
Tempo (Cymphonique)
Thinking to Myself (Hey Eyes) (Lil Wayne)2010Blazin’ (Demo)
Blow Ya Mind (Demo)
Check It Out (Special Mix) (with will.i.am)
Cupid’s Got A Gun (Shanell)
Everywhere We Go (feat. Lil Kim)
Gettin’ Paid
Girlfriend
Harajuku Forecast (Jae Millz)
I Feel Pretty (Roman’s Revenge) [Demo] (feat. Eminem)
Kiss My Ass (Bow Wow)
Mean Walk (Miss Daja)
Monster (Demo) (Kanye West)
New York Minute (Remix) (French Montana)
Nicki Minaj Speaks (Jae Millz)
Roman’s Revenge (Busta Rhymes Remix) (feat. Busta Rhymes)
Saxon
Stilettos and T-Shirt (Remix) (Bobby V)
That's What's Up (Ice Mike)
We Miss You
Your Love (Demo)
Your Love (Remix) [feat. Jay Sean]
Your Love (Remix) [feat. Sean Paul]
Your Love (Remix) [feat. Gyptian]2011Bought the Bar (DJ Webstar)
Feel Inside (Remix) (Mary J. Blige)
Next Round (Natasha Bedingfield)2012Bring It Back (Leaked w/ “Pink Friday: The Lost Tapes”)
Here and There (Girl You Bad) (Leaked w/ “Pink Friday: The Lost Tapes”)
I Got Next (Leaked w/ “Pink Friday: The Lost Tapes”)
I Love My Range Rover (Leaked w/ “Pink Friday: The Lost Tapes”)
Letter to Lil’ Wayne (Leaked w/ “Pink Friday: The Lost Tapes”)
Love Me (Leaked w/ “Pink Friday: The Lost Tapes”)
Make a Baby (Leaked w/ “Pink Friday: The Lost Tapes”)
Put It On Ya (Leaked w/ “Pink Friday: The Lost Tapes”)
Zonin’ (Leaked w/ “Pink Friday: The Lost Tapes”)2014Anaconda (Demo)
Murda Murda
Rock Star (Future)2016Ain't Gone Do It
Like a Star (Demo) (Fetty Wap)
Make Me Feel (Akon)
Remember Me (Parker Ighile)
The Pinkprint Freestyle2017MotorSport (Demo) (Migos & Cardi B)
Run Up (Demo) (Major Lazer)
You Already Know (Demo) (Fergie)2018Anybody (Demo) (Young Thug)
Arctic Tundra (The Girl With the Blonde Hair)* (Juice WRLD)
Ball For Me (Demo) (Post Malone)
Friendship Song (Saturday Night Live)
the light is coming (Demo) (Ariana Grande)
Never Really Mattered* (Lil Wayne)
Poke It Out (Demo) (Playboi Carti)
Shooters (Remix) (Tony Lanez)
Sorry (feat. Nas)
Unknown* (feat. Madonna)2019Bad Like We (Demo) (Wiley)
Barbie Drip
Barbie Goin Bad
Bust Down Barbiana
Cap Backwards (Swae Lee)
Miss Me / Okay*
New Body (Kanye West & Ty Dolla $ign)
Suge (Remix) (DaBaby)
Tusa (English Version) (with KAROL G)
Unknown* (feat. Ms. Banks)2020Blue Cash (Remix)* (Young Thug & Juice WRLD)
Good Luck2021Big Barbie
Oh My*
She Make It Clap (Remix)* (Soulja Boy)UnknownAre U Ready? (with The Hood$tars)
Danger Zone (Alex Charm)
Gimme Money (Ester Dean)
Get ‘Em Girls (Remix) (Jessica Mauboy)
Goody Gyal*
Hands Up* (with The Hood$tars)
Ice Cream Man
I Just Borrow (Ru Spits)
La La Means I Love You (with The Hood$tars)
London Bridge (Hot 97 Freestyle)
Monsé*
Nicki’s First Rap
Nigga Please (with The Hood$tars)
Real Pimpin’
So Special
Take That (Lean Back Freestyle) (with The Hood$tars)
Top Of The World
Tragedy
Won’t Grow Up* (The Band Perry)
You, Me, Him & Her (with The Hood$tars)Alphabetical Order:AAin't Gone Do It
A Failure (Pussy Nigga) [Demo] (Gucci Mane)
Affirmative Action (Gravy)
Always Love You (Gudda Gudda)
Anaconda (Demo)
Anybody (Demo) (Young Thug)
Arctic Tundra (The Girl With the Blonde Hair)* (Juice WRLD)
Are U Ready? (with The Hood$tars)BBad Like We (Demo)* (Wiley)
Ball For Me (Demo) (Post Malone)
Barbie Drip
Barbie Goin Bad
Batman (with The Hood$tars)
Beef Stew
Big Barbie
Big Bidness (Ransom)
Big Bidness (Solo Mix)
Blazin’ (Demo)
Blow Ya Mind (Demo)
Blue Cash (Remix)* (Young Thug & Juice WRLD)
Bought the Bar (DJ Webstar)
Break Up (Remix) (Mario)
Bring It Back (Leaked w/ “Pink Friday: The Lost Tapes”, 2012)
Bust Down BarbianaCCap Backwards (Swae Lee)
Check It Out (Special Mix) (with will.i.am)
Chocolate Legs (Remix) (Eric Benét)
Cupid’s Got A Gun (Shanell)
Cypher ‘09 / BET Cypher 2009DDanger Zone (Alex Charm)
Dedicated 2 The Streets (DJ Whiteowl)
Diamonds on My Neck (Supplya)
Don't Mess With (Jim Johnston & The Hood$tars)
Do You Like It Like That? (Ransom)EEverywhere We Go (feat. Lil Kim)FFeel Inside (Remix) (Mary J. Blige)
Freestyle (DJ Whiteowl)
Freestyle (feat. Lil Wayne) (DJ Whiteowl)
Friendship Song (Saturday Night Live)
Fuck U Silly (Cassie)GGettin’ Paid
Get wit It (DJ Esudd)
Gimme Money
Girlfriend
Girl You Know (BedRock) [Demo] (Young Money)
Get ‘Em Girls (Remix)* (Jessica Mauboy)
Good Luck
Goody Gyal*HHands Up* (with The Hood$tars)
Harajuku Forecast (Jae Millz)
Here and There (Girl You Bad) (Leaked w/ “Pink Friday: The Lost Tapes”, 2012)IIce Cream Man
I Feel Pretty (Roman’s Revenge) [Demo] (feat. Eminem)
I Get Crazy (Original Mix) (feat. Lil Wayne)
I Get Money (Remix)
I Got Next (Leaked w/ “Pink Friday: The Lost Tapes”, 2012)
I Just Borrow (Ru Spits)
I Love My Range Rover (Leaked w/ “Pink Friday: The Lost Tapes”, 2012)
I Might (Angel De-mar)
I’m Back
Intro (Dirty Money What) (DJ Whiteowl)
It’s Going Down (DJ Whiteowl)
It’s My Party (with The Hood$tars)KKiss My Ass (Bow Wow)LLa-Dee-Da-Dee (We Like To Party) (with Park Slope & The Hood$tars)
La La Means I Love You (with The Hood$tars)
Lemonade (Remix) (Gucci Mane)
Letter to Lil’ Wayne (Leaked w/ “Pink Friday: The Lost Tapes”, 2012)
Like a Star (Demo) (Fetty Wap)
London Bridge (Hot 97 Freestyle)
Love Me (Leaked w/ “Pink Friday: The Lost Tapes”, 2012)MMake a Baby (Leaked w/ “Pink Friday: The Lost Tapes”, 2012)
Make It Last Forever (Remix) (Ciara)
Make Me Feel (Akon)
Mean Walk (Miss Daja)
Miss Me / Okay*
Miss Independent (Remix) (Ne-Yo)
Money Ain’t A Thing (Stack Bundles)
Monsé*
Monstars Biz (Gravy)
Monster (Demo) (Kanye West)
MotorSport (Demo) (Migos & Cardi B)
Murda MurdaNNever Really Mattered* (Lil Wayne)
New Body (Kanye West & Ty Dolla $ign)
New York Minute (Remix) (French Montana)
Next Round (Natasha Bedingfield)
Nicki’s First Rap*
Nicki Minaj Speaks (Jae Millz)
Nigga Please (with The Hood$tars)
Not at All (Ru Spits)OOh My*
Old Enough (Remix) (Lil Twist)
One Night Only (Jason Kay)PPamper Me (Angel De-mar)
Poke It Out (Demo) (Playboi Carti)
Put It On Ya (Leaked w/ “Pink Friday: The Lost Tapes”, 2012)RReal Pimpin’
Remember Me (Parker Ighile)
Rock Star (Future)
Roman’s Revenge (Busta Rhymes Remix) (feat. Busta Rhymes)
Run Up (Demo) (Major Lazer)SSaxon
She Make It Clap (Remix)* (Soulja Boy)
Shooters (Remix) (Tony Lanez)
Single Ladies (Remix) (Beyoncé)
Sorry* (feat. Nas)
So Special
Stilettos and T-Shirt (Remix) (Bobby V)
Strippin' in the Club (DJ Diamonds Kuts)
Suge (Remix) (DaBaby)
Sweet Dreams (Remix) (Beyoncé, Lil Wayne)TTake That (Lean Back Freestyle) (with The Hood$tars)
TEMPO (Ashley)
Tempo (Cymphonique)
That's What's Up (Ice Mike)
The Hottest Out (DJ Whiteowl)
the light is coming (Demo) (Ariana Grande)
The Pinkprint Freestyle
The Tape Is Crazy (Interlude) (DJ Whiteowl)
Thinking to Myself (Hey Eyes) (Lil Wayne)
Throw Your Hands Up In The Air (HOT 97 Freestyle) (with The Hood$tars)
Top Of The World
Tragedy
Tusa (English Version) (with KAROL G)UUnknown* (feat. Madonna)
Unknown* (feat. Ms. Banks)WWatch What You Say (Ru Spits)
We Miss You
Who Run This? (Angel De-mar)
Who Run This? (Studio Acapella) (Angel De-mar)
Who Run This Motherfucker? (The Hood$tars)
Won’t Grow Up* (The Band Perry)XXcellent (Pritty Boy)YYasss Bish (feat. Soulja Boy)
You Already Know (Demo) (Fergie)
You, Me, Him & Her (with The Hood$tars)
Your Love (Demo)
Your Love (Remix) (feat. Jay Sean)
Your Love (Remix) (feat. Sean Paul)
Your Love (Remix) (feat. Gyptian)ZZonin’ (Leaked w/ “Pink Friday: The Lost Tapes”, 2012)Embed"
3g8IZkTL7EYqtmKCfxvHq3,Blazin,"109 ContributorsBlazin Lyrics[Intro: Nicki Minaj]
Hey, hey, yeah
Oh, oh (Hey, hey, hey, hey)
Oh (Ooh)

[Chorus: Nicki Minaj]
I fly, I fly high, I'm blazin'
I'm blazin', feels like I'm blazin'
I fly, I fly high, I'm blazin'
I'm blazin', feels like I'm blazin', feels like I'm–

[Verse 1: Nicki Minaj]
How could it be, little me
Had the power to be the best B in the league
Yeah, inevitably, but could it be little me?
You was heckling me, now it's monotony winning regularly, yo
I catch rec on recreation, so I exceed all your expectations
Bitches ain't got it in 'em, I kill 'em and then I skin 'em
The contract was signed, but I am the addendum
So-so where my dawgs at, Randy
Ma-ma-matter fact, get off my dick, bitch, Andy
'Ca-'ca-'ca-'ca-'ca-'cause everything is fine and dandy
Go against me now, I dare you, Bambi
Half a million dollars just to upgrade the car show
I ain't even detonate the bombs in the arsenal
Before the storm comes the calm
Hope you can take the heat like LeBron
Ah, ah-ah-ah-ah-ah, ah-ah-ah
I'm the best now
Anybody with some money should invest now
Soccer moms need to organize a pep rall'
Your game over, bitch, Gatorade, wet towel
Mothafuckers ain't ready, they never been
As long as I am in the game, you'll never win
I'm on that different type of high, heroin
Put on my cape and hit the sky, heroine
You might also like[Chorus: Nicki Minaj & Kanye West]
I fly, I fly high, I'm blazin'
I'm blazin', feels like I'm blazin'
I fly, I fly high, I'm blazin'
I'm blazin', feels like I'm blazin' (Feels like I'm blazin')
I fly, I fly high, I'm blazin'
I'm blazin', feels like I'm blazin'
I fly, I fly high, I'm blazin' (Uh)
I'm blazin', feels like I'm blazin' (Yeah, uh)

[Verse 2: Kanye West]
This is the moment, grab your Kodak
While I'm flying with a flow that is
The greatest throwback since that Nolan Ryan
And the days been crazy and the nights even wilder
And the lights even brighter, baby, stand next to my fire
Only higher is Messiah or notes from Mariah
'Rari six hundred horses, that's my chariot of fire
Where we flyin', they can't find us, all them broke days behind us
I just took your whole life and redesigned it, uh
I think I'm Marc Jacobs, I think I'm Lagerfeld
I think without makeup, you still bad as hell
I'ma grab your waist, then I'ma grab your face and
Then I'ma taste it, then I'ma blaze it
Hello all my bad girls, this just in
Yeezy hurt the beat like he fucked her best friend
And she let him back in, and he just did it again
He crazy, he blazin', he off the deep end
I'm blazin', I'm flagrant, I'm crazy, I'm sayin'
Too much for the world so they abbreviate him
His past is her fave, his stats is amaze
Her dress is just perf, uh, Prada colored beige
It's obvi we the ish and I'm rolling with my Brits
So real, you so trill, baby, everything legit
How you feel? They say we crazed 'cause our styles so diff'
They'll be jeal' when we in the mag lookin' magnif'
As if I ain't used Magnums on your favorite bad bitch
Fuck these background niggas, I was tryna ad-lib
Add this, we blazin', Nicki, what you think?
I got two White Russians, but we also need some drinks
[Chorus: Nicki Minaj]
I fly, I fly high, I'm blazin'
I'm blazin', feels like I'm blazin'
I fly, I fly high, I'm blazin'
I'm blazin', feels like I'm blazin' (Feels like I'm blazin')
I fly, I fly high, I'm blazin'
I'm blazin', feels like I'm blazin'
I fly, I fly high, I'm blazin'
I'm blazin', feels like I'm blazin'

[Bridge]
It feels like I'm blazin', blazin', blazin', blazin'
It feels like I'm blazin', blazin', blazin', blazin'
It feels like I'm blazin', blazin', blazin', blazin'
It feels like I'm blazin', blazin', blazin', blazin'
It feels like I'm blazin', blazin', blazin'
It feels like I'm blazin', blazin', blazin'
It feels like I'm blazin', blazin', blazin'
It feels like I'm blazin', blazin', blazin'

[Chorus: Nicki Minaj]
I fly, I fly high, I'm blazin'
I'm blazin', feels like I'm blazin'
I fly, I fly high, I'm blazin'
I'm blazin', feels like I'm blazin' (Feels like I'm blazin')
I fly, I fly high, I'm blazin'
I'm blazin', feels like I'm blazin'
I fly, I fly high, I'm blazin'
I'm blazin', feels like I'm blazin'24Embed"
0EcIxMIRQyOBTXsANsJwOp,Here I Am,"43 ContributorsTranslationsPortuguêsHere I Am Lyrics[Verse 1]
Why is it that you could only see the worst in me?
I swear, sometimes, it feel like it nurtures me
But to keep it all real, it's kinda hurtin' me
I could say I'm done with it, but it lurks in me
So I'ma just tell myself that it works for me
Take a real long drive in the Mercedes
And I might pop a couple of them Percoce's
Yeah, that'll make me transform to Hercules

[Pre-Chorus]
I am who I am
Ah

[Chorus]
Here I am, here I am
So take me as I am
Here I am, here I am
So take me as I am
Here I am, here I am
So take me as I am

[Post-Chorus]
I am who I am
Ah
You might also like[Verse 2]
I swear to God, man, everything in life is old
And the only thing that changed is the price of gold
Even in the afterlife, I'ma fight your soul
'Cause the second time around, I'll be twice as bold
So do you take me to be who I am?
To have and to hold 'til death do us part?
'Cause if not, it's just best we both part
'Cause how am I supposed to finish what you start?
You got me thinkin' twice to just breathe (I am)
Then you say I won't survive if I leave (Who I am)
But I got a couple of tricks up my sleeve (Ah)
I no longer need your attention, at ease

[Bridge]
It's a joke, it's a game
Why am I still keeping score?
I'm in pain, I'm ashamed
I'm a woman, hear me roar
It's a joke, it's a game
Why am I still keeping score?
I'm in pain, I'm ashamed
I'm a woman, hear me roar
Now it's a joke, it's a game
Why am I still keeping score?
I'm in pain, I'm ashamed
I'm a woman, hear me roar
It's a joke, it's a game
Why am I still keeping score?
I'm in pain, I'm ashamed
I'm a woman, hear me roar (Here I am)
[Outro]
Here I am, here I am
So take me as I am17Embed"
2AS0xaRoyo4WiYehA5DaxN,Dear Old Nicki,"65 ContributorsTranslationsPortuguêsDear Old Nicki Lyrics[Intro]
Mmm, oh
Mmm
Yo

[Verse 1]
Maybe you died 'cause everybody ask me where you at
I tried to channel you in hopes that I could steer you back
But it's like every intersection we just missed each other
You got your fans waitin', tell me you ain't six feet under
And tell me that you comin' back and you just took a break
Maybe I blamed you for everything, that was my mistake
In hindsight, I loved your rawness and I loved your edge
'Cause it was you who talked me down from jumpin' off the ledge
Your earings bamboo, your long nails too
Your BMW every time you came through
You was the brave heart, you stole Wayne heart
You never switched it up, you played the same part
But I needed to grow, and I needed to know
Were there some things inside of me that I needed to show?
So I just deaded you, left you in all black
But dear old Nicki, please call back

[Chorus]
You told me you'd come when I needed you
And you said it so sweetly, I believed you
But I'm standing here calling, I can't see you
But I am holdin' you, holdin' you, holdin' you
To that
You might also like[Verse 2]
Yo, did I chase the glitz and glamour, money, fame, and power?
'Cause if so, that will forever go down my lamest hour
I shoulda kept you with me, gettin' at them nameless cowards
They was no match for you, couldn't defeat your prowess
I had to make them changes, I hope you understood
You see, for every bad, I did a ton of good
But you was underground and I was mainstream
I live the life now that we would daydream
My only wish is you come enjoy it with me
Get on them conference calls, go meet the lawyers with me
The money came, yeah, I tripled and quadrupled it
But I still miss us when we was just on some stupid shit
And it's still fuck the media
They ridiculed you, never believed in ya
They just deaded you, left you in all black
But dear old Nicki, please call back

[Chorus]
You told me you'd come when I needed you
And you said it so sweetly, I believed you
But I'm standing here calling, I can't see you
But I am holdin' you, holdin' you, holdin' you
To that

[Outro]
And yes, I'm holdin' you, holdin' you, holdin' you
And yes, I'm holdin' you, holdin' you, holdin' you
And yes, I'm holdin' you, holdin' you, holdin' you
To that
And yes, I'm holdin' you, holdin' you, holdin' you
And yes, I'm holdin' you, holdin' you, holdin' you
And yes, I'm holdin' you, holdin' you, holdin' you
To that31Embed"
5ezdlC7WVACAC0pGvdmT2M,Your Love,"94 ContributorsTranslationsPortuguêsYour Love Lyrics[Chorus]
Shorty, I'ma only tell you this once, you the illest
(Ba, ba-da, da, doh)
And for your loving, I'ma die hard like Bruce Willis
(Ba, ba-da, da, doh)
You got spark, you, you got spunk
You, you got something all the girls want
You're like a candy store (Ah) and I'm a toddler (Ah)
You got me wanting more and m-m-more of
Your love, your love (Yeah)
Your love, your love (Yeah)
Your love, your love (Yeah)
Your love, your love (Yeah)
Your love, your love
Your love, your love
Your love, your love (Uh)
Your love, your love (Uh, yo)

[Verse 1]
He the type to pop tags and be cockin' the brim
Might breeze through The Ave, might stop at the gym
And he keep a do-rag, keep the wave on swim
W-w-waves on swim so they hate on him
Anyway, I think I met him sometime before
In a different life or where I record
I mean he was Adam, I think I was Eve
But my vision ends with the apple on the tree
""S"" on my chest 'cause I'm ready to save him
Ready to get buck on anybody that plays him
And I think I love him, I love him just like I raised him
When he call me ""mama, lil' mama,"" I call him ""baby""
You might also like[Chorus]
Shorty, I'ma only tell you this once, you the illest
(Ba, ba-da, da, doh)
And for your loving, I'ma die hard like Bruce Willis
(Ba, ba-da, da, doh)
You got spark, you, you got spunk
You, you got something all the girls want
You're like a candy store (Ah) and I'm a toddler (Ah)
You got me wanting more and m-m-more of
Your love, your love (Yeah)
Your love, your love (Yeah)
Your love, your love (Yeah)
Your love, your love (Yeah)
Your love, your love
Your love, your love
Your love, your love (Mmhmm)
Your love, your love (Yo, yo)

[Verse 2]
He the type to keep a couple hundred grand in a rubber band
Just left Money Gram in the lemon Lamb'
Hot damn, make me scream like Summer Jam
I mean that nigga must be from the motherland
Anyway, I think I met him in the sky
When I was a Geisha, he was a Samurai
Somehow, I understood him when he spoke Thai
Never spoke lies and he never broke fly
""S"" on my chest, let me get my cape on
He's so thugged out, Ghostface and Raekwon
Convict just like Akon
'Cause you know the snitches be putting the jake on
[Chorus]
Shorty, I'ma only tell you this once, you the illest
(Ba, ba-da, da, doh)
And for your loving, I'ma die hard like Bruce Willis
(Ba, ba-da, da, doh)
You got spark, you, you got spunk
You, you got something all the girls want
You're like a candy store (Ah) and I'm a toddler (Ah)
You got me wanting more and m-m-more of
Your love, your love (Yeah)
Your love, your love (Yeah)
Your love, your love (Yeah)
Your love, your love (Yeah)
Your love, your love
Your love, your love
Your love, your love
Your love, your love

[Outro]
Find me in the dark
I'll be in the stars
Find me in your heart
I'm in need of your love
Your love, your love
Your love
Baby, you're the illest
Your love
Your love64Embed"
44nucsmobhGoNDgQFTI0Ok,Last Chance,"42 ContributorsTranslationsPortuguêsLast Chance Lyrics[Intro: Natasha Bedingfield]
Yeah, yeah
Ooh, yeah

[Verse 1: Nicki Minaj]
Yo
I could've been had fame
Jump shot with a stupid-ass aim
'Cause you couldn't get around the last name
So my cross-over wins the last game
And it's ill, right?
Switched up the flow, but it's still right
Go back to that, yeah, I still might
I'ma just do me when it feel right
Uh, you could bring it any day
Natural bad-ass, NBA
That's my initials, that's why officials
Don't blow the whistle, bang-bang the pistol
A-a-and I'm bossy
Can't keep these hoes up off me
Damn, the flow nasty, coffee
Don't you do like the Pope and cross me

[Chorus: Both, Nicki Minaj & Natasha Bedingfield]
Yeah, this is my last chance (Oh)
Last chance (Oh)
Yeah, this is my last chance
Then shoot, I'm ready to shoot (Oh yeah, oh yeah)
I'm ready to shoot (Ready to shoot)
I'm ready to shoot (Ready to shoot)
I'm ready, I'm ready to shoot (Ready to shoot)
I'm ready, I'm ready to shoot (Uh huh)
I'm ready to shoot (Uh, uh)
You might also like[Verse 2: Nicki Minaj]
I get it in though
No sexual innuendo
Nobody that I could just depend on
Until I touch down in the end zone
And then they come out like roaches
P-p-pecking away like vultures
But little did they know, distribute the payroll
Pick out the outfit, pick out the single
Sadly, I'm so business savvy
Similar protocol, but the tidbits vary
Never been like me, ain't never been like this
My flow's a crisis, they screamin' high pitch
Uh, gun cock, pause
And I'm well aware of the gun laws
Tell 'em that I'm gunnin' for the top, Forbes
Headed to the top, dot org

[Chorus: Both, Nicki Minaj & Natasha Bedingfield]
Yeah, this is my last chance (This is my last chance)
Last chance (Oh yeah, yeah)
Yeah, this is my last chance (My last chance)
Then shoot, I'm ready to shoot (Eh, eh, eh, eh)
I'm ready to shoot (Ready to shoot)
I'm ready to shoot (Ready to shoot)
I'm ready to shoot (Ready to shoot)
I'm ready to shoot
I'm ready to shoot
[Bridge: Nicki Minaj, Natasha Bedingfield & Both]
All the days of my life, I have been waiting for this time (Oh)
Could you believe now it's right before my eyes?
Anybody tryna stop me better not fuck with me this time (Oh)
Shoot, I am ready to shoot into the sky

[Chorus: Both, Nicki Minaj & Natasha Bedingfield]
Yeah, this is my last chance (This is your last chance)
Last chance (Oh)
Yeah, this is my last chance
Then shoot, I'm ready to shoot (Eh, eh, eh, eh)
I'm ready to shoot

[Outro: Natasha Bedingfield & Nicki Minaj]
Only one chance, one bullet in the gun (I'm ready to shoot)
This is my life and I only got one, yeah (I'm ready to shoot)
Running through there and I put on the stars (I'm ready to shoot)
Oh, stick 'em up, stick 'em up now, yeah (I'm ready to shoot)
Only one chance, one bullet in the gun
This is my life and I only got one, yeah
The safety's off and I put it on the stars
Oh, stick 'em up, stick 'em up, uh
I'm ready to shoot
Yeah, yeah, I'm ready to shoot
This is my life and I only got one, yeah
The safety's off and I put it on the stars
Get ready, ha
I'm ready to shoot9Embed"
