track_id,track_name,album_id,album_name,artist_id,artist_name,duration_ms,preview_url,release_year,lyrics
5gOfC9UzZQzTyShqPMrpjT,wacced out murals,0hvT3yIEysuuvkK73vgdcW,GNX,2YZyLoL8N0Wb9xBt1NhZWg,Kendrick Lamar,317092,,2024,"Siento aquí tu presencia
La noche de anoche
Y nos ponemos a llorar
Yesterday, somebody whacked out my mural
That energy'll make you niggas move to Europe

But it's regular for me, yeah, that's for sure

The love and hate is definite without a cure

All this talk is bitch-made, that's on my Lord

I'll kill 'em all before I let 'em kill my joy

I done been through it all, what you endure?

It used to be fuck that nigga, but now it's plural

Fuck everybody, that's on my body

My blick first, then God got me

I watch 'em pandеr with them back-handed compliments

Put thеy head on a Cuban link as a monument

I paid homage and I always mind my business

I made the—

I never lost who I am for a rap image

It's motivation if you wonder how I did it



Yeah, nigga, go and up your rank

Know you a god even when they say you ain't

Yeah, nigga, keep your feelings out the way

Never let no one put smut up on your name

Yeah, nigga, keep your head down and work like I do

But understand everybody ain't gon' like you

Yeah, nigga, if they say it's love, you've been lied to

A couple rules of engagements, I'ma guide you



Que refleja en tu mirada

La noche, tú y yo



Ridin' in my GNX with Anita Baker in the tape deck, it's gon' be a sweet love

Fuck apologies, I wanna see y'all geeked up

Don't acknowledge me, then maybe we can say it's fair

Take it to the internet and I'ma take it there

Miss my uncle Lil' Mane, he said that he would kill me if I didn't make it

Now I'm possessed by a spirit and they can't take it

Used to bump Tha Carter III, I held my Rollie chain proud

Irony, I think my hard work let Lil Wayne down

Whatever, though, call me crazy, everybody questionable

Turn me to an eskimo, I drew the line and decimals

Snoop posted ""Taylor Made,"" I prayed it was the edibles

I couldn't believe it, it was only right for me to let it go

Won the Super Bowl and Nas the only one congratulate me

All these niggas agitated, I'm just glad they showin' they faces

Quite frankly, plenty artists, but they outdated

Old-ass flows, tryna convince me that you they favorite

This is not for lyricists, I swear it's not the sentiments

Fuck a double entendre, I want y'all to feel this shit

Old soul, bitch, I probably built them pyramids

Ducking strays when I rap battled in the Nickersons

Where you from? Not where I'm from, we all indigenous

Against all odds, I squabbled up for them dividends

Against all odds, I showed up as a gentleman

I done lost plenty friends, sixteen to be specific

Put that on my kids' children, we gon' see the future first

They like, ""Dot big trippin,"" I just want what I deserve

What bridge they done burnt? All of them, it's over with

I'm doin' what COVID did, they'll never get over it



Yeah, nigga, go and up your rank

Know you a god even when they say you ain't

Yeah, nigga, keep your feelings out the way

Never let no one put smut up on your name

Yeah, nigga, keep your head down and work like I do

But understand everybody ain't gon' like you

Yeah, nigga, if they say it's love, you've been lied to

A couple rules of engagements, here to guide you



Niggas from my city couldn't entertain old boy

Promisin' bank transactions and even bitcoin

I never peaced it up, that shit don't sit well with me

Before I take a truce, I'll take 'em to Hell with me

If that money got in the hands of a crash dummy

Could jeopardize my family and burden the ones who love me

Niggas mad 'cause I decided not to pretend

Y'all stay politically correct, I'ma do what I did

Ain't no sympathy here, this shit's hilarious

It's a lot of opinions, but no power to carry it

2025, they still movin' on some scary shit

Tell 'em quit they job and pay the real niggas they severance

Don't insult my intelligence, I'm not just for the television

Teleport to Bullets Road and dig up all my relatives

Okay, nigga, let's settle it, these niggas been fake loyal

Since y'all pandering to choose a side, let me do it for you

Okay, fuck your hip-hop, I watched the party just die

Niggas cackling about— while all of y'all is on trial

Niggas thought that I was antisocial when I stayed inside of my house

You better off to have one woman, everything tricky right now

You niggas live in denial

Ayy, fuck anybody empathetic to the other side, I vow

A bitch nigga love bitch niggas, they exist with 'em in style

Exterminate 'em right now

Make Katt Williams and them proud, the truth 'bout to get loud

No juice iniside of my cup, I sober up and knock 'em all off

Don't let no white comedian talk about no Black woman, that's law

I know propaganda work for them, and fuck whoever that's close to them

The niggas that coon, the niggas that bein' groomed, slide on both of them

You ever ate Cap'n Crunch and proceeded to pour water in it?

Pulled over by the law, you ridin' dirty, so you can't argue with 'em?

Then make it to be a star, bare your soul and put your heart up in it?

Well, I did

Whacked the murals out, but it ain't no legends if my legend ends"
0nj9Bq5sHDiTxSHunhgkFb,squabble up,0hvT3yIEysuuvkK73vgdcW,GNX,2YZyLoL8N0Wb9xBt1NhZWg,Kendrick Lamar,157992,,2024,"God knows
I am reincarnated
I was stargazin'
Life goes on, I need all my babies (Gyah, gyah)
Woke up lookin' for the broccoli

High-key, keep a horn on me, that Kamasi

IP, ownership, the blueprint is by me

Mr. Get Off, I get off at my feet

When I hear music, it makes me dance

You got the music, now is your chance

A yee nigga couldn't try me in the tri-state

Buddy pass, bet I get him splashed 'til he hydrated

Bounce out, know he spook town, eyes dilated

I got the money and the power both gyratin'



I feel good, get the fuck out my face

Look good, but shе don't got no taste

I walk in, walked out with the safе

Mando, let me know what the play



What the fuck?

I got hits, I got bucks, I got new paper cuts

I got friends, I got foes, but they all sitting ducks

Hit his turf and get crackin', double back like a deluxe

Fifty deep, but it ain't deep enough

Fuck a plea, there he go, beat him up

Fallin' from my money tree and it grow throughout the months

Spit a loogie at the camera, speed off, yeah, it's us



I feel good, get the fuck out my face

Look good, but she don't got no taste

I walk in, walked out with the safe

Mando, let me know what the play



Squabble up, squabble up

Squabble up, squabble up

Squabble up (Mm, mm), squabble up (Mm, mm)

Squabble up (Mm, mm), squabble up



Hol' up (Hol' up)

Where you from? (Where you from?)

My bitch (My bitch)

I'm finna go dumb (Finna go dumb)

Sideways (Sideways)

Bunk skunk (Bunk skunk)

Fever (Fever)

I'm on one (I'm on one)



Thunk, thunk, thunk, thunk, thunk, baby rockin' it

Quid pro quo, what you want? 'Cause I'm watchin' it

Work on the floor, let me know if you clockin' it

Brodie won't go, but I know that he poppin' it

It was woof tickets on sale 'til I silenced it

Pipe down, young, these some whole other politics

Bitch with him and some bitch in him, that's a lot of bitch

Don't hit him, he got kids with him, my apologies

Ghetto child, it was Black & Milds with the Smirnoff

Yeehaw, we outside, whoadie 'bout to kill him off

Blaps on blaps, it's a fact, this a brick of raw

Tell me why the fuck you niggas rap if it's fictional?

Tell me why the fuck you niggas fed if you criminal?

""Ayy, Dot, can I get a drop?"" I'm like, ""Nigga, nah""

Ace boon coon from the Westside to Senegal

It's a full moon, let the wolves out, I been a dog (Ah)



I feel good, get the fuck out my face

Look good, but she don't got no taste

I walk in, walked out with the safe

Mando, let me know what the play



Squabble up, squabble up

Squabble up, squabble up

Squabble up (Mm, mm), squabble up (Mm, mm)

Squabble up (Mm, mm), squabble up"
45J4avUb9Ni0bnETYaYFVJ,luther (with sza),0hvT3yIEysuuvkK73vgdcW,GNX,2YZyLoL8N0Wb9xBt1NhZWg,"Kendrick Lamar, SZA",177598,,2024,"If this world were mine
Hey, Roman numeral seven, bae, drop it like it's hot
If this world was mine, I'd take your dreams and make 'em multiply
If this world was mine, I'd take your enemies in front of God
Introduce 'em to that light, hit them strictly with that fire

Fah-fah, fah-fah-fah, fah-fah, fah

Hey, Roman numeral seven, bae, drop it like it's hot

If this world was mine, I'd take your dreams and make 'em multiply

If this world was mine, I'd take your enemies in front of God

Introduce 'em to that light, hit them strictly with that fire

It's a vibe, do your dance, let 'em watch

She a fan, he a flop, they just wanna kumbaya, nah



In this world, concrete flowers grow

Heartache, she only doin' what she know

Weekends, get it poppin' on the low

Better days comin' for sure

If this world were—

If it was up to me

I wouldn't give these nobodies no sympathy

I'd take away the pain, I'd give you everything

I just wanna see you win, wanna see

If this world were mine



It go in (When you), out (Ride it), do it real slow (Slide)

Baby, you a star, strike, pose

When I'm (When you), with you (With me), everything goes (Slow)

Come and (Put that), put that (On my), on my (Titi), soul (Soul)

'Rari (Red), crown (Stack), wrist (Stay), froze (Really)

Drip (Tell me), pound (If you), on the way home (Love me)



In this world, concrete flowers grow

Heartache, she only doin' what she know

Weekends, get it poppin' on the low

Better days comin' for sure

If this world were—

If it was up to me

I wouldn't give these nobodies no sympathy

I'd take away the pain, I'd give you everything

I just wanna see you win, wanna see

If this world were mine



I can't lie

I trust you, I love you, I won't waste your time

I turn it off just so I can turn you on

I'ma make you say it loud

I'm not even trippin', I won't stress you out

I might even settle down for you, I'ma show you I'm a pro

I'ma take my take my time and turn it off

Just so I can turn you on, baby

Weekends, get it poppin' on the low

Better days comin' for sure



I know you're comin' for

Better days

If this world were mine"
5ho7VSXSmI2KM2nDjcnLyz,man at the garden,0hvT3yIEysuuvkK73vgdcW,GNX,2YZyLoL8N0Wb9xBt1NhZWg,Kendrick Lamar,233173,,2024,"Twice emotional stability
Of sound body and tranquility
I deserve it all
Like minds and less enemies
Stock investments, more entities
I deserve it all

VVSs, white diamonds

GNX with the seat back, reclinin', bitch

I deserve it all

Put my homes on the beachfront

Flyin' private, what you eat for lunch?

I deserve it all

The respect and the accolades

Lampin' on the island, watchin' Cast Away

I deserve it all

For еvery good nigga that passed away

Sent two-point-fivе million on an average day

I deserve it all

Keep my name by the world leaders

Keep my crowds loud inside Ibiza

I deserve it all

More money, more power, more freedom

Everything Heaven allowed us, bitch

I deserve it all



Hmm, I deserve it all

Hmm, I deserve it all

All

All



'Cause my intentions was pure

Even when you wasn't sure

Even with every allure

How much temptation you endured?

You'd probably look for every cure

I said I deserve it all

I'm wakin' up at 6 a.m.

Six miles a day, conditionin' my wind

I said I deserve it all

I'm showin' up as your friend

Tellin' truths better than your next of kin

I said I deserve it all

I never ask for too much credit

Seekin' validation just for the aesthetics, bitch

I deserve it all

I see you as a human first

Even when you didn't understand your worth

Bitch, I deserve it all

It's innate to mind my business

Writin' words, tryna elevate these children

That's why I deserve it all

Pray for those who prayed against me

Every reason why my ancestors sent me

Bitch, I deserve it all



I deserve it all

I deserve it all

All

All



Put a smile on my mama

Good health and good karma

Yeah, she deserves it all

One hundred murals out in Compton

Remember me? I kept my promise

Yeah, we deserve it all

A better life for my daughter

Made my son take it further than his father

Yeah, he deserves it all

A close relationship with God

Whisper to me every time I close my eyes

He say, ""You deserve it all""

Keep these bitch niggas away from me

Keep all my blessings faithfully

Keep my essence contagious, that's okay with me

I burn this bitch down, don't you play with me or stay with me

I'm crashin' out right now, no one's safe with me

I did it with integrity and niggas still try hate on me, just wait and see

More blood be spillin', it's just paint to me

Dangerously, nothin' changed with me, still got pain in me

Flip a coin, want the shameless me or the famous me?

How annoying, does it angers me to know the lames can speak

On the origins of the game I breathe? That's insane to me

It's important, I deserve it all because it's mine

Tell me why you think you deserve the greatest of all time, motherfucker



I deserve it all

I deserve it all"
5S8VwnB4sLi6W0lYTWYylu,hey now (feat. dody6),0hvT3yIEysuuvkK73vgdcW,GNX,2YZyLoL8N0Wb9xBt1NhZWg,"Kendrick Lamar, Dody6",217478,,2024,"Damn, baby
I like it
Damn
Hmm
Hey now, say now, I'm all about my Yen

Big face Buddha, get my peace from within

Send the kites to all my dirties in the pen

Let the honorary walk for the win, for the win

You crash out, then you better break the backboard

I got friends, hopin' that they make the tabloids

You know the last one figured he was Magneto

You play God, you gon' get what you ask for

We got the same twenty-four, what you mad for?

I put a square on his back like I'm Jack Dorsey

It's high beams if I make a public appearance

Go back to hidin' 'cause I'm not too friendly with niggas

One one thousand, two one thousand, four

The Black know I just strangled me a goat

I walked in with a therapeutic flow

Put a few hundred up, let 'em go, let 'em go



Hey now, say now

Hey now, say now

Hey now, say now

Hmm, hey now, say now

Hey now, say now, I'm all about my Yen

Big face Buddha, get my peace from within

Send the kites to all my dirties in the pen

Let the honorary walk for the win, for the win

Hey now, say now

Hey now, say now

Hey now, say now

Hey now, say now



Hey now, say now, I done slid on they backstreet

Heavy on the Parmesan, every day tax season

What the fuck you wearin'? Bro, it's tacky

Niggas layin' on they death bed tryna match me

Oh my God, I'm 'bout to do the fool

They be screamin' out P, but they resume is boof

Switch both lanes, the engine sound like the zoo

Need a fee just to breathe, bitch, I can't talk to you

It's the Ben Frank murderer

Mister, I ain't heard of ya

Gulf streams, back to back, flyin' through the turbulence

Who is he? Free lunch, hmm, Kraft Services

Throw your ass out this rental if I smell nervousness

Hey now, say now, let me pop my shit

Water down my wrist, I'm around my bitch

It's a green light, don't get out of bounds, I'ma blitz

It's a bird, it's a plane, no, it's all blue strips

Nigga, what?



Hey now, say now

Hey now, say now

Hey now, say now

Hmm, hey now, say now

I'm way too important

I'm way too important

I'm way too important to ever let you slide on me again



Startin' to see spaceships on Rosecrans (Startin' to see spaceships on Rosecrans)

I seen the aliens hold hands (I seen the aliens hold hands)

They wanna see me do my dance (They wanna see me do my dance)

I let 'em watch me do my dance



Who the fuck I feel like? I feel like Joker

Harley Quinn, I'm in the cut with a blower

Ayy, shit get spooky, every day in October

My torpedo even jumped out on smokers, J-Cat

Ayy, we mean muggin' niggas, Dody too important

If they talkin' 'bout playin' ball, me and my team gon' get to scorin'

If they talkin' 'bout playin' ball, they can take it up with Jordan

It's bald heads and the heckling for all endorsements

Eenie, meenie, miny, moe, I'm tryna tag a nigga toe

I'm aggressive on the beat and real life, niggas know

Ayy, I tatted up my body, it depend, level four

Ayy, I sharpened up a knife and came home to a blow

My bitch gon' get to tweakin' like she playin' with her nose

Lil' brodie 'bout to crash, man, y'all niggas be on go

I'm a different type of trophy, baby girl, I'm rose gold

Me and Dot get to slidin', put 'em in a choke hold

Bitches actin' like some niggas, niggas actin' like some hoes

Ayy, I jumped out that pan, then I jumped up in a Ghost

I'm the hush type of nigga, see my face, then he froze

All that shit he was talkin', found out he not that bold

Okay, this shit like forty, that's a dub, okay, let's add it up

Baby ass fat, can you do it? Can you back it up?

Kickflip a nigga, I got Tech Decks

And it ain't shit for me to call and get your chin checked

Tell 'em, ""Dody did that"""
0RgjEkSbeuStKfT2Pa4Zai,reincarnated,0hvT3yIEysuuvkK73vgdcW,GNX,2YZyLoL8N0Wb9xBt1NhZWg,Kendrick Lamar,275740,,2024,"Que reflejan tu mirada
La noche, tú y yo
I got this fire burnin' in me from within
Concentrated thoughts on who I used to be, I'm sheddin' skin
Every day, a new version of me, a third of me demented, cemented in pain

Juggling opposing kinds of fame

I don't know how to make friends, I'm a lonely soul

I recollect this isolation, I was four years old

Truth be told, I've been battling my soul

Tryna navigate the real and fake

Cynical about the judgement day

I did bad, slight progression last year and it fucked me up

Reincarnated on this earth for a hundred plus

Body after body, lesson after lesson, let's take it back to Michigan in 1947

My father kicked me out the house 'cause I wouldn't listen to him

I didn't care about his influence, only loved what I was doing

Gifted as a musician, I played guitar on the grand level

The most talented where I'm from, but I had to rebel

And so I'm off in the sunset, searchin' for my place in the world

With my guitar up on my hip, that's the story unfurled

I found myself with a pocket full of money and a whole lot of respect

While the record business loved me

I was head of rhythm and blues

The women that fell to they feet, so many to choose

But I manipulated power as I lied to the masses

Died with my money, gluttony was too attractive, reincarnated



Another life had placed me as a Black woman in the Chitlin' Circuit

Seductive vocalist as the promoter hit the curtains

My voice was angelic, straight from heaven, the crowd sobbed

A musical genius what the articles emphasized

Had everything I wanted, but I couldn't escape addiction

Heroin needles had me in fetal position, restricted

Turned on my family, I went wherever cameras be

Cocaine, no private planes for my insanity

Self-indulged, discipline never been my sentiments

I needed drugs, to me, an 8-ball was like penicillin

Fuck love, my happiness was in that brown sugar

Sex and melodies gave me hope when nobody's lookin'

My first assistant was a small town scholar

Never did a Quaalude 'til I got myself around her

My daddy looked the other way, he saw sin in me

I died with syringes pinched in me, reincarnated



My present life is Kendrick Lamar

A rapper looking at the lyrics to keep you in awe

The only factor I respected was raisin' the bar

My instincts sent material straight to the charts, huh

My father kicked me out the house, I finally forgive him

I'm old enough to understand the way I was livin'

Ego and pride had me looking at him with resentment

I close my eyes, hoping that I don't come off contentious

I'm yelling, ""Father, did I finally get it right?"" Everything I did was selfless

I spoke freely, when the people needed me, I helped them

I didn't gloat, even told 'em, ""No,"" when the vultures came

Took control of my fleshly body when the money changed

Son, you do well, but your heart is closed

I can tell residue that linger from your past creates a cell

Father, I'm not perfect, I got urges, but I hold them down

But your pride has to die,"" okay, Father, show me how

Tell me every deed that you done and what you do it for

I kept one hundred institutions paid

Okay, tell me more

I put one hundred hoods on one stage

Okay, tell me more

I'm tryna push peace in L.A. 

But you love war

No, I don't

Oh, yes, you do

Okay, then tell me the truth

Every individual is only a version of you

How can they forgive when there's no forgiveness in your heart?

I could tell you where I'm going

I could tell you who you are

You fell out of Heaven 'cause you was anxious

Didn't like authority, only searched to be heinous

Isaiah fourteen was the only thing that was prevalent

My greatest music director was you

It was colors, it was pinks, it was reds, it was blues

It was harmony and motion

I sent you down to earth 'cause you was broken

Rehabilitation, not psychosis

But now we here now

Centuries you manipulated man with music

Embodied you as superstars to see how you moving

You came a long way from garnishing evilish views

And all I ever wanted from you was love and approval

I learned a lot, no more putting these people in fear

The more that word is diminished, the more it's not real

The more light that I can capture, the more I can feel

I'm using words for inspiration as an idea

So can you promise that you won't take your gifts for granted?

I promise that I'll use my gifts to bring understanding

For every man, woman and child, how much can you vow?

I vow my life just to live one in harmony now

You crushed a lot of people keeping their thoughts in captivity

And I'm ashamed that I ever created that enemy

Then let's rejoice where we at

I rewrote the devil's story just to take our power back, 'carnated"
