track_id,track_name,album_id,album_name,artist_id,artist_name,duration_ms,preview_url,release_year,lyrics
4odAJ4IxmYzy3co4TeYP24,DNA.,4alcGHjstaALJHHiljfy3H,DAMN. COLLECTORS EDITION.,2YZyLoL8N0Wb9xBt1NhZWg,Kendrick Lamar,185946,,2017,"I got, I got, I got, I got
Loyalty, got royalty inside my DNA
Cocaine quarter piece, got war and peace inside my DNA
I got power, poison, pain and joy inside my DNA
I got hustle though, ambition, flow, inside my DNA
I was born like this, since one like this

Immaculate conception

I transform like this, perform like this

Was Yeshua's new weapon

I don't contemplate, I meditate, then off your fucking head

This that put-the-kids-to-bed

This that I got, I got, I got, I got

Realness, I just kill shit 'cause it's in my DNA

I got millions, I got riches buildin' in my DNA

I got dark, I got evil, that rot inside my DNA

I got off, I got troublesome, heart inside my DNA

I just win again, then win again like Wimbledon, I serve

Yeah that's him again, the sound that engine in is like a bird

You see fireworks and Corvette tire skrrt the boulevard

I know how you work, I know just who you are

See you's a, you's a, you's a

Bitch, your hormones prolly switch inside your DNA

Problem is, all that sucker shit inside your DNA

Daddy prolly snitched, heritage inside your DNA

Backbone don't exist, born outside a jellyfish, I gauge

See my pedigree most definitely don't tolerate the front

Shit I've been through prolly offend you

This is Paula's oldest son

I know murder, conviction, burners

Boosters, burglars, ballers, dead, redemption

Scholars, fathers dead with kids

And I wish I was fed forgiveness

Yeah, yeah, yeah, yeah, soldier's DNA

Born inside the beast

My expertise checked out in second grade

When I was 9, on cell, motel, we didn't have nowhere to stay

At 29, I've done so well, hit cartwheel in my estate

And I'm gon' shine like I'm supposed to

Antisocial, extrovert

And excellent mean the extra work

And absentness what the fuck you heard

And pessimists never struck my nerve

And that's a riff, gonna plead this case

The reason my power's here on earth

Salute the truth, when the prophet say



I got loyalty, got royalty inside my DNA

This is why I say that hip hop has done more damage to young African Americans than racism in recent years

I got loyalty, got royalty inside my DNA

I live a better life, I'm rollin' several dice, fuck your life

I got loyalty, got royalty inside my DNA

I live a better, fuck your life

5, 4, 3, 2, 1

This is my heritage, all I'm inheritin'

Money and power, the makin' of marriages



Tell me somethin'

You mothafuckas can't tell me nothin'

I'd rather die than to listen to you

My DNA not for imitation

Your DNA an abomination

This how it is when you're in the Matrix

Dodgin' bullets, reapin' what you sow

And stackin' up the footage, livin' on the go

And sleepin' in a villa

Sippin' from a Grammy and walkin' in the buildin'

Diamond in the ceilin', marble on the floors

Beach inside the window, peekin' out the window

Baby in the pool, godfather goals

Only Lord knows, I've been goin' hammer

Dodgin' paparazzi, freakin' through the cameras

Eat at Four Daughters, Brock wearin' sandals

Yoga on a Monday, stretchin' to Nirvana

Watchin' all the snakes, curvin' all the fakes

Phone never on, I don't conversate

I don't compromise, I just penetrate

Sex, money, murder, these are the breaks

These are the times, level number 9

Look up in the sky, 10 is on the way

Sentence on the way, killings on the way

Motherfucker, I got winners on the way

You ain't shit without a body on your belt

You ain't shit without a ticket on your plate

You ain't sick enough to pull it on yourself

You ain't rich enough to hit the lot and skate

Tell me when destruction gonna be my fate

Gonna be your fate, gonna be our fate

Peace to the world, let it rotate

Sex, money, murder, our DNA"
1WonGCoO1sz7I4aD0HRbXy,BLOOD.,4alcGHjstaALJHHiljfy3H,DAMN. COLLECTORS EDITION.,2YZyLoL8N0Wb9xBt1NhZWg,Kendrick Lamar,118066,,2017,"Is it wickedness?
Is it weakness?
You decide
Are we gonna live or die?
So I was takin' a walk the other day, and I seen a womana blind womanpacin' up and down the sidewalk. She seemed to be a bit frustrated, as if she had dropped somethin' and havin' a hard time findin' it. So after watching her struggle for a while, I decide to go over and lend a helping hand, you know? ""Hello, ma'am, can I be of any assistance? It seems to me that you have lost something. I would like to help you find it."" She replied, ""Oh yes, you have lost something. You've lost your life""





Is it wickedness?



Lamar stated his views on police brutality with that line in the song quote, ""And we hate the popo, wanna kill us in the street fosho...""

Oh please, ugh, I don't like it"
1n4jwRVXdkK2U34nBDUKKT,BLOOD.,4eLPsYPBmXABThSJ821sqY,DAMN.,2YZyLoL8N0Wb9xBt1NhZWg,Kendrick Lamar,118066,,2017,"Is it wickedness?
Is it weakness?
You decide
Are we gonna live or die?
So I was takin' a walk the other day, and I seen a womana blind womanpacin' up and down the sidewalk. She seemed to be a bit frustrated, as if she had dropped somethin' and havin' a hard time findin' it. So after watching her struggle for a while, I decide to go over and lend a helping hand, you know? ""Hello, ma'am, can I be of any assistance? It seems to me that you have lost something. I would like to help you find it."" She replied, ""Oh yes, you have lost something. You've lost your life""





Is it wickedness?



Lamar stated his views on police brutality with that line in the song quote, ""And we hate the popo, wanna kill us in the street fosho...""

Oh please, ugh, I don't like it"
6HZILIRieu8S0iqY8kIKhj,DNA.,4eLPsYPBmXABThSJ821sqY,DAMN.,2YZyLoL8N0Wb9xBt1NhZWg,Kendrick Lamar,185946,,2017,"I got, I got, I got, I got
Loyalty, got royalty inside my DNA
Cocaine quarter piece, got war and peace inside my DNA
I got power, poison, pain and joy inside my DNA
I got hustle though, ambition, flow, inside my DNA
I was born like this, since one like this

Immaculate conception

I transform like this, perform like this

Was Yeshua's new weapon

I don't contemplate, I meditate, then off your fucking head

This that put-the-kids-to-bed

This that I got, I got, I got, I got

Realness, I just kill shit 'cause it's in my DNA

I got millions, I got riches buildin' in my DNA

I got dark, I got evil, that rot inside my DNA

I got off, I got troublesome, heart inside my DNA

I just win again, then win again like Wimbledon, I serve

Yeah that's him again, the sound that engine in is like a bird

You see fireworks and Corvette tire skrrt the boulevard

I know how you work, I know just who you are

See you's a, you's a, you's a

Bitch, your hormones prolly switch inside your DNA

Problem is, all that sucker shit inside your DNA

Daddy prolly snitched, heritage inside your DNA

Backbone don't exist, born outside a jellyfish, I gauge

See my pedigree most definitely don't tolerate the front

Shit I've been through prolly offend you

This is Paula's oldest son

I know murder, conviction, burners

Boosters, burglars, ballers, dead, redemption

Scholars, fathers dead with kids

And I wish I was fed forgiveness

Yeah, yeah, yeah, yeah, soldier's DNA

Born inside the beast

My expertise checked out in second grade

When I was 9, on cell, motel, we didn't have nowhere to stay

At 29, I've done so well, hit cartwheel in my estate

And I'm gon' shine like I'm supposed to

Antisocial, extrovert

And excellent mean the extra work

And absentness what the fuck you heard

And pessimists never struck my nerve

And that's a riff, gonna plead this case

The reason my power's here on earth

Salute the truth, when the prophet say



I got loyalty, got royalty inside my DNA

This is why I say that hip hop has done more damage to young African Americans than racism in recent years

I got loyalty, got royalty inside my DNA

I live a better life, I'm rollin' several dice, fuck your life

I got loyalty, got royalty inside my DNA

I live a better, fuck your life

5, 4, 3, 2, 1

This is my heritage, all I'm inheritin'

Money and power, the makin' of marriages



Tell me somethin'

You mothafuckas can't tell me nothin'

I'd rather die than to listen to you

My DNA not for imitation

Your DNA an abomination

This how it is when you're in the Matrix

Dodgin' bullets, reapin' what you sow

And stackin' up the footage, livin' on the go

And sleepin' in a villa

Sippin' from a Grammy and walkin' in the buildin'

Diamond in the ceilin', marble on the floors

Beach inside the window, peekin' out the window

Baby in the pool, godfather goals

Only Lord knows, I've been goin' hammer

Dodgin' paparazzi, freakin' through the cameras

Eat at Four Daughters, Brock wearin' sandals

Yoga on a Monday, stretchin' to Nirvana

Watchin' all the snakes, curvin' all the fakes

Phone never on, I don't conversate

I don't compromise, I just penetrate

Sex, money, murder, these are the breaks

These are the times, level number 9

Look up in the sky, 10 is on the way

Sentence on the way, killings on the way

Motherfucker, I got winners on the way

You ain't shit without a body on your belt

You ain't shit without a ticket on your plate

You ain't sick enough to pull it on yourself

You ain't rich enough to hit the lot and skate

Tell me when destruction gonna be my fate

Gonna be your fate, gonna be our fate

Peace to the world, let it rotate

Sex, money, murder, our DNA"
4BHSjbYylfOH5WAGusDyni,YAH.,4eLPsYPBmXABThSJ821sqY,DAMN.,2YZyLoL8N0Wb9xBt1NhZWg,Kendrick Lamar,160293,,2017,"New shit, new Kung Fu Kenny
I got so many theories and suspicions
I'm diagnosed with real nigga conditions
Today is the day I follow my intuition
Keep the family closeget money, fuck bitches

I double parked the Aston in the red

My mama told me that I'ma work myself to death

My girl told me don't let these hoes get in my head

My world been ecstatic, I checked the signal that read



Buzzin', radars is buzzin'

Yah, yah, yah, yah

Yah, yah, yah, yah, yah, yah

Buzzin', radars is buzzin'

Yah, yah, yah, yah

Yah, yah, yah, yah, yah, yah



Interviews wanna know my thoughts and opinions

Fox News wanna use my name for percentage

My latest muse is my niece, she's worth livin'

See me on the TV and scream, ""That's Uncle Kendrick""

Yeah, that's the business

Somebody tell Geraldo this nigga got some ambition

I'm not a politician, I'm not 'bout a religion

I'm a Israelite, don't call me Black no mo'

That word is only a color, it ain't facts no mo'

My cousin called, my cousin Carl Duckworth

Said, ""Know my worth""

And Deuteronomy say that we all been cursed

I know he walks the Earth

But it's money to get, bitches to hit, yah

Zeroes to flip, temptation is yah

First on my list, I can't resist, yah

Everyone together now, know that we forever



Buzzin', radars is buzzin'

Yah, yah, yah, yah

Yah, yah, yah, yah, yah, yah

Buzzin', radars is buzzin'

Yah, yah, yah, yah

Yah, yah, yah, yah"
1EaKU4dMbesXXd3BrLCtYG,ELEMENT.,4eLPsYPBmXABThSJ821sqY,DAMN.,2YZyLoL8N0Wb9xBt1NhZWg,Kendrick Lamar,208733,,2017,"New Kung Fu Kenny
Ain't nobody prayin' for me
Y'all know what happens on Earth stays on Earth
Here we go
I don't give a fuck, I don't give a fuck
I don't give a, I don't give a, I don't give a fuck



I'm willin' to die for this shit

I done cried for this shit, might take a life for this shit

Put the Bible down and go eye for an eye for this shit

D.O.T. my enemy, won't catch a vibe for this shit, ayy

I been stomped out in front of my mama

My daddy commissary made it to commas

Bitch, all my grandmas dead

So ain't nobody prayin' for me, I'm on your head, ayy

30 millions later, know the feds watchin'

Auntie on my telegram like, ""Be cautious""

I be hangin' out at Tam's, I be on Stockton

I don't do it for the 'Gram, I do it for Compton

I'm willin' to die for this shit, nigga

I'll take your fuckin' life for this shit, nigga

We ain't goin' back to broke, family sellin' dope

That's why you maney ass rap niggas better know



If I gotta slap a pussy ass nigga, I'ma make it look sexy

If I gotta go hard on a bitch, I'ma make it look sexy

I pull up, hop out, air out, made it look sexy

They won't take me out my element

Nah, take me out my element



I'm allergic to a bitch nigga, ayy

An imaginary rich nigga, ayy

Seven figures hold that slimmer than my bitch figure, ayy

Goin' digital and physical on all y'all, ayy

Bunch of criminals and money in my phone calls, ayy

We okay, we let the A1 fly

Relocate, jump on the same G5

Checkin' for me heavy 'cause I go yeah, I go yeah

They never been ready yeah, I know yeah, know yeah

100K spread 'cross the floor, 'cross floor yeah

None of y'all fuckin' with the flow yeah, the flow yeah

Years in the making, don't y'all mistake it

I got 'em by a landslide, we talkin' 'bout races

You know this'll never be a tie, just look at they laces

You know careers take off, just gotta be patient

Mr. One through Five, that's the only logic

Fake my death, go to Cuba, that's the only option



If I gotta slap a pussy ass nigga, I'ma make it look sexy

If I gotta go hard on a bitch, I'ma make it look sexy

I pull up, hop out, air out, made it look sexy

They won't take me out my element

Nah, take me out my element



Damned if I do, if I don't

Goddamn us all if you won't

Damn, damn, damn it's a goddamn shame

You ain't frontline, get out the goddamn way



Niggas thought they wasn't gonna see me, huh?

Niggas thought that K-Dot real life

Was the same life they see on TV, huh?

Niggas wanna flex on me and be in LA for free, huh?

Next time they hit the 10 freeway, we need receipt, huh?

'Cause most of y'all ain't real

Most of y'all gon' squeal

Most of y'all just envy, but jealousy get you killed

Most of y'all throw rocks and try to hide your hand

Just say his name and I promise that you'll see Candyman

Because it's all in your eyes

Most of y'all tell lies, most of y'all don't fade

Most of y'all been advised

Last LP I tried to lift the black artists

But it's a difference between black artists and wack artists



If I gotta slap a pussy ass nigga, I'ma make it look sexy

It's the one and only, the world's greatest, the Kid Capri

If I gotta go hard on a bitch, I'ma make it look sexy

I pull up, hop out, air out, made it look sexy

They won't take me out my element

Nah, take me out my element"
2LTlO3NuNVN70lp2ZbVswF,FEEL.,4eLPsYPBmXABThSJ821sqY,DAMN.,2YZyLoL8N0Wb9xBt1NhZWg,Kendrick Lamar,214826,,2017,"Ain't nobody prayin' for me
Ain't nobody prayin' for me
Ain't nobody prayin' for me
Ain't nobody prayin' for me
I feel like a chip on my shoulders

I feel like I'm losin' my focus

I feel like I'm losin' my patience

I feel like my thoughts in the basement

Feel like, I feel like you're miseducated

Feel like I don't wanna be bothered

I feel like you may be the problem

I feel like it ain't no tomorrow, fuck the world

The world is ending, I'm done pretendin'

And fuck you if you get offended

I feel like friends been overrated

I feel like the family been fakin'

I feel like the feelings are changin'

Feel like my daughter compromised and jaded

Feel like you wanna scrutinize how I made it

Feel like I ain't feelin' you all

Feel like removin' myself, no feelings involved

I feel for you, I've been in the field for you

It's real for you, right?

Shit, I feel like



Ain't nobody prayin' for me

Ain't nobody prayin' for me

Ain't nobody prayin' for me

Ain't nobody prayin'



I feel niggas been out of pocket

I feel niggas tappin' they pockets

I feel like debated on who the greatest can stop it

I am legend, I feel like all of y'all is peasants

I feel like all of y'all is desperate

I feel like all it take is a second to feel like

Mike Jordan whenever holdin' a real mic

I ain't feelin' your presence

Feel like I'ma learn you a lesson

Feel like only me and the music, though

I feel like your feelin' ain't mutual

I feel like the enemy you should know

Feel like the feelin' of no hope

The feelin' of bad dope

A quarter ounce manipulated from soap

The feelin', the feelin' of false freedom

I'll force feed 'em the poison that fill 'em up in the prison

I feel like it's just me

Look, I feel like I can't breathe

Look, I feel like I can't sleep

Look, I feel heartless, often off this

Feelin' of fallin', of fallin' apart with

Darkest hours, lost it

Fillin' the void of bein' employed with ballin'

Streets is talkin', fillin' the planks with coffins

Fill up the banks with dollars

Fill up the graves with fathers

Fill up the babies with bullshit

Internet blogs and pulpit, fill 'em with gossip

I feel like this gotta be the feelin' what Pac was

The feelin' of an apocalypse happenin'

But nothin' is awkward, the feelin' won't prosper

The feelin' is toxic, I feel like I'm boxin' demons, monsters

False prophets schemin', sponsors, industry promises

Niggas, bitches, honkies, crackers, Compton

Church, religion, token blacks, and bondage

Lawsuit visits, subpoena served in concert

Fuck your feelings, I mean this for imposters

I can feel it, the phoenix sure to watch us

I can feel it, the dream is more than process

I can put a regime that forms a likeness

I can feel it, the scream that haunts our logic

I feel like say some, I feel like take some

I feel like skatin' off, I feel like waitin' for 'em

Maybe it's too late for 'em

I feel like the whole world want me to pray for 'em

But who the fuck prayin' for me?



Ain't nobody prayin' for me

Who prayin' for me?

Ain't nobody prayin'"
6SwRhMLwNqEi6alNPVG00n,LOYALTY. FEAT. RIHANNA.,4eLPsYPBmXABThSJ821sqY,DAMN.,2YZyLoL8N0Wb9xBt1NhZWg,"Kendrick Lamar, Rihanna",227360,,2017,
6IZvVAP7VPPnsGX6bvgkqg,PRIDE.,4eLPsYPBmXABThSJ821sqY,DAMN.,2YZyLoL8N0Wb9xBt1NhZWg,Kendrick Lamar,275253,,2017,"Love's gonna get you killed
But pride's gonna be the death of you and you and me
And you and you and you and me
And you and you and you and me
And you and you and you and me
And you and you and you and me and



It wasn't all to share, but there

In another life, I surely was there

It wasn't all to share, but there

I care, I care



Hell-raising, wheel-chasing, new worldy possessions

Flesh-making, spirit-breaking, which one would you lessen?

The better part, the human heart

You love 'em or dissect 'em

Happiness or flashiness? How do you serve the question?

See, in the perfect world, I would be perfect, world

I don't trust people enough beyond they surface, world

I don't love people enough to put my faith in man

I put my faith in these lyrics hoping I make amend

I understand I ain't perfect

I probably won't come around

This time, I might put you down

Last time, I ain't give a fuck, I still feel the same now

My feelings might go numb, you're dealing with cold thumb

I'm willing to give up a leg and arm and show empathy from

Pity parties and functions and you and yours

A perfect world, you probably live another 24

I can't fake humble just 'cause your ass is insecure

I can't fake humble just 'cause your ass is insecure



It wasn't all to share, but there

In another life, I surely was there

It wasn't all to share, but there

I care, I care



Maybe I wasn't there

Maybe I wasn't there

Maybe I wasn't there

Maybe I wasn't there



Now, in a perfect world, I probably won't be insensitive

Cold as December, but never remember what winter did

I wouldn't blame you for mistakes I made or the bed I laid

Seems like I point the finger just to make a point, nowadays

Smiles and cold stares, the temperature goes there

Indigenous disposition, feel like we belong here

I know the walls, they can listen, I wish they could talk back

The hurt becomes repetition, the love almost lost that

Sick venom in men and women overcome with pride

A perfect world is never perfect, only filled with lies

Promises are broken and more resentment come alive

Race barriers make inferior of you and I

See, in a perfect world, I'll choose faith over riches

I'll choose work over bitches, I'll make schools out of prison

I'll take all the religions and put 'em all in one service

Just to tell 'em we ain't shit, but He's been perfect, world



It wasn't all to share, but there

In another life, I surely was there

It wasn't all to share, but there

I care, I care



Maybe I wasn't there

Maybe I wasn't there

Maybe I wasn't there

Maybe I wasn't there"
7KXjTSCq5nL1LoYtL7XAwS,HUMBLE.,4eLPsYPBmXABThSJ821sqY,DAMN.,2YZyLoL8N0Wb9xBt1NhZWg,Kendrick Lamar,177000,,2017,"nobody pray for me 
even a day for me
Waaaaay (yeah! yeah!)
Ay, I remember syrup sandwiches and crime allowances
Finesse a nigga with some counterfeits

But now I'm countin' this

Parmesan where my accountant lives

In fact, I'm downin' this

D'usse with my boo bae, tastes like Kool-Aid for the analysts

Girl, I can buy yo' ass the world with my paystub

Ooh, that pussy good, won't you sit it on my taste bloods?

I get way too petty once you let me do the extras

Pull up on your block, then break it down: we playin' Tetris

A.M. to the P.M., P.M. to the A.M., funk

Piss out your per diem, you just gotta hate 'em, funk

If I quit your BM, I still ride Mercedes, funk

If I quit this season, I still be the greatest, funk

My left stroke just went viral

Right stroke put lil' baby in a spiral

Soprano C, we like to keep it on a high note

It's levels to it, you and I know, bitch, be humble



(Hol' up, bitch) sit down

(Hol' up lil' bitch, hol' up lil' bitch) be humble

(Hol' up, bitch) sit down

(Sit down, hol' up, lil' bitch)

Be humble (bitch)

(Hol' up, hol' up, hol' up, hol' up) bitch, sit down

Lil' bitch (hol' up, lil' bitch) be humble

(Hol' up, bitch) sit down

(Hol' up, hol' up, hol' up, hol' up) be humble

(Hol' up, hol' up, hol' up, hol' up, lil' bitch) sit down

(Hol' up lil' bitch) be humble

(Hol' up, bitch) sit down

(Hol' up, sit down, lil' bitch)

(Sit down, lil' bitch, be humble)

(Hol' up, hol' up, hol' up, hol' up, lil' bitch) bitch, sit down

(Hol' up, bitch) be humble

(Hol' up, bitch) sit down

(Hol' up, hol' up, hol' up, hol' up)



Who dat nigga thinkin' that he frontin' on man, man? (Man, man)

Get the fuck off my stage, I'm the Sandman (Sandman)

Get the fuck off my dick, that ain't right

I make a play fuckin' up your whole life

I'm so fuckin' sick and tired of the Photoshop

Show me somethin' natural like afro on Richard Pryor

Show me somethin' natural like ass with some stretchmarks

Still will take you down right on your mama's couch in Polo socks, ayy

This shit way too crazy, ayy, you do not amaze me, ayy

I blew cool from AC, ayy, Obama just paged me, ayy

I don't fabricate it, ayy, most of y'all be fakin', ayy

I stay modest 'bout it, ayy, she elaborate it, ayy

This that Grey Poupon, that Evian, that TED Talk, ayy

Watch my soul speak, you let the meds talk, ayy

If I kill a nigga, it won't be the alcohol, ayy

I'm the realest nigga after all, bitch, be humble



(Hol' up, bitch) sit down

(Hol' up lil' bitch, hol' up lil' bitch) be humble

(Hol' up, bitch) sit down

(Sit down, hol' up, lil' bitch)

Be humble (bitch)

(Hol' up, hol' up, hol' up, hol' up) bitch, sit down

Lil' bitch (hol' up, lil' bitch) be humble

(Hol' up, bitch) sit down

(Hol' up, hol' up, hol' up, hol' up) be humble

(Hol' up, hol' up, hol' up, hol' up, lil' bitch) sit down

(Hol' up lil' bitch) be humble

(Hol' up, bitch) sit down

(Hol' up, sit down, lil' bitch)

(Sit down, lil' bitch, be humble)

(Hol' up, hol' up, hol' up, hol' up, lil' bitch) bitch, sit down

(Hol' up, bitch) be humble

(Hol' up, bitch) sit down

(Hol' up, hol' up, hol' up, hol' up)"
