track_id,track_name,album_id,album_name,artist_id,artist_name,duration_ms,preview_url,release_year,lyrics
1iQ5E4z6CJ38dIzvMI9Wdo,The Watcher,7q2B4M5EiBkqrlsNW8lB7N,2001,6DPYiyq5kWVQS4RGwxzPC7,"Dr. Dre, Eminem, Knoc-Turn'al",206546,,1999,"[Dr. Dre]
Things just ain't the same for gangsters
Times is changin, young niggaz is agin
Becomin O.G.'s in the game and changin
to make way for these new names and faces but
the strangest things can happen from rappin

when, niggaz get wrapped up in image and actin

Niggaz get capped up and wrapped in plastic

and zipped up in bags when it happens, that's it

I've seen em come, I've watched em go

Watched em rise, witnessed it and watched them blow

Watched em all blossom and watched em grow

Watched the lawsuits when they lost the dough

Best friends and money? I lost them both

Went and visisted niggaz in the hospital

and saw the same shit all across the globe

I just sit back and watch the show (the watcher)



Chorus: Dr. Dre



Cause everywhere that I go

ain't the same as befo' (the watcher)

People I used to know

just don't know me no mo' (the watcher)

But everywhere that I go

I got people I know (the watcher)

who got people they know

So I suggest you lay low (the watcher)



[Dr. Dre]

I moved out of the hood for good - you blame me?

Niggaz aim mainly at niggaz they can't be

But niggaz can't hit niggaz they can't see

I'm out of sight, now I'm out of they dang reach

How would you feel if niggaz wanted you killed?

You'd probably move to a new house on a new hill

and choose a new spot if niggaz wanted you shot

I ain't a thug - how much Tupac in you you got?

I ain't no bitch neither - it's either my life

or yo' life and I ain't leavin - I like breathin

Cause nigga we can go round for round

Clip for clip, shit fo'pound for pound

Nigga if you really wanna take it there we can

Just remember that you fuckin with a family man

I got a lot more to lose than you, remember that

when you wanna come and fill these shoes (the watcher)



Chorus



{*GUN SHOT*}



[Dr. Dre]

Things just ain't the same for gangstas

Cops is anxious to put niggaz in handcuffs

They wanna hang us, see us dead or enslave us

Keep us trapped in the same place we raised in

Then they wonder why we act so outrageous

Run around stressed out and pull out gauges

Cause everytime you let the animal out cages

It's dangerous, to people who look like strangers

But now we got a new era of gangsters

Hustlers and youngsters livin amongst us

Lookin at us, now callin us bustaz

Can't help but reminisce back when it was us

Nigga we started this gangsta shit!

And this the motherfuckin thanks I get?

It's funny how time fly

I'm just havin fun, just watchin it fly by (the watcher)



Chorus



(the watcher - 4X)"
4FI0rdztOAYJZMupujL5Gp,Fuck You,7q2B4M5EiBkqrlsNW8lB7N,2001,6DPYiyq5kWVQS4RGwxzPC7,"Dr. Dre, Devin The Dude, Snoop Dogg",205453,,1999,"[answering machine girl]
Hi baby
I know your under a lot of pressure at your work and all
And I do understand
You have no idea how much I understand
But you also don't have any idea how much I love you

I love you so much

I think about you I feel you in my arms

I miss you.. I miss you terribly

I've just always wanted someone like you in my life

I love you so much; that I'd do anything

I'd do anything

I'll be your perfect woman for you



[Dr. Dre]

I just wanna fuck bad bitches

All them nights I never had bitches

Now I'm all up in that ass bitches

Mad at 'cha boyfriend, aint 'cha?

You'se a bad girl, gotta spank ya

Gotta thank ya for that head clinic

Explicit, hella photogenic

And tell your friends where the dick's at

Where they can get hit and won't get back to they soulmate

Before you kiss 'em use Colgate

""She Swallowed It!"" Yeah the bitch took the whole eight

and ran with it, then let Mel-Man hit it

and Hit the Man hit it; damn bitches

Man, this is what I'm talkin about

Chicken-head, chicken-fed, with a dick in your mouth

Out and about with your nigga like it never took place

(Airtouched) Next time you need a taste



Chorus: 



I just wanna fuuuuuck you

No touchin and rubbin gul, you got a husband who

loves.. you..

Don't need you all in mine

I just wanna fuuuuuck you

We can't be kissin and huggin gul, you got a husband who

loves.. you..

You need to give him your quality time



[Devin the Dude]

You got the number, it's on you to make the call

You know I cum quick; help you re-decorate your walls

Cut your backyard, don't have to act hard to get the cock

And if I'm goin too far, I take it out and wipe it off

and put it back up, and keep going

You tryin to hide it from your husband but I know he be knowin

that your pussy's been tampered with

Did you show him the new trick of how you can make it smoke a cancer stick

You be workin it like a dancer bitch, it's hard on me

Not to give you all of my time, that you wanted

You can give me some head, but keep the breakfast in bed

I'd rather spend my mornin diggin through some records instead

But, tonight, I guess it'd be aight if we can touch bases

Hookup somewhere and exchange some ""Fuck Faces""

I know your man's lookin for ya, he's always tryin to run ya

Don't worry bout me handcuffin gul cause I just wanna fuck witchu



[Snoop Dogg]

.. fuck witchu

On the sneak tip, on some creep shit

So whatcha gon' do, ya freak bitch?

You, actin, like you, don't, do, dicks

That's the kinda bitch I hate fuckin wit

Baby was a virgin, that's what she said

So I gave her some Hennesey, she gave me some head

I fucked her on the flo', so I wouldn't mess up my bed

Then Lil' 1/2 Dead put his dick on her head

Take that bitch home, and give her a bone

And give her the number to my cellular phone

Man, she blowin up my pager, the shit's gettin major

A favor for a favor, this dick is what I gave her

Somethin to go by, and bitches know why

Stuff dick in they mouth, and then I'm out (see-ya!)

Twenty-fo' seven, Dre, Snoop, and Devin

We servin' these hoes, and never lovin these hoes, beotch!



Chorus"
503OTo2dSqe7qk76rgsbep,Still D.R.E.,7q2B4M5EiBkqrlsNW8lB7N,2001,6DPYiyq5kWVQS4RGwxzPC7,"Dr. Dre, Snoop Dogg",270586,,1999,
2BMRUAA1oTc7e9JPlr6xbZ,Big Ego's,7q2B4M5EiBkqrlsNW8lB7N,2001,6DPYiyq5kWVQS4RGwxzPC7,"Dr. Dre, Hittman",238306,,1999,"[Dr. Dre]
I got mo' class than most of em, ran wit the best of em
Forgave the less of em, and blazed at the rest of em
What can I say? Cal-i-for-ni-A
Where niggaz die everyday over some shit they say
Disconnected from the streets forever

As long as I got a baretta, nigga, I'm down for whateva

I roll wit my shit off safety - for niggaz that been hatin me lately 

and the bitches that wanna break me

If Cali blew up, I'd be in the Aftermath

Bumpin gangsta rap shit, down to blast for cash

Cause from Eazy-E, to D.O.C., to D.P.G.

started from that S.O.B., D.R.E.

Like Dub-C I'm rich rollin, pistol holdin

Pockets swoll nigga, that's how I'm rollin

Put the flame to the killer nigga

Worldwide homicide mob figure and a builder, for real

I'm hittin switches, makin bitches eat bitches

See me grab my dick everytime I pose for pictures

I own acres, floor seats watchin The Lakers

I'm cool with eses who got AK's in cases



Dedicated to all of those with big ego's

Never fakin, we get the dough and live legal

Haters hate this, we sip the Mo' and yank the heezos

1 -Niggaz play this in they Rovers Jeeps and Regals

2 -Bitches play this in they Benzes Jeeps and Geos

{repeat 2X}



[Hitman]

I bust a Mr. Toughy, slash a Smoothy Doobie

Crash and flex on Tuesday's, harassin hoes at movies

Passin by with uzis - and who you aimin at?

That shady bitch and that bitch nigga that was claimin that

Rat-ta-tat-tat {*automatic gunfire and screaming*}

{*more screaming as tires peel out*}

I don't sympathize for wack hoes and wimpy guys

You got to recognize Hitman is a enterprise

Cali pride, born to ride and South Centralized

The Henny got me energized - smoke the guys

tryin to focus on mines - poke they eyes out

I'm L.A.'s loc'est - hope they don't have to find out the hard way

like snitch niggaz in the pen that get

hit when the guards look the other way

We hittin HARD, Hitman and Dre

You playin games, I suggest you know the rules

We puttin guns to fools, make you run yo' jewels

Take yo' honey and cruise to the snootiest snooze, Cabos

Pop coochie til the nut oozes, you shouldn't fuck wit crews

that's sick, Aftermath cause we rule shit

I'm Big Hit, don't confuse me wit no other by the flow motherfucker



Dedicated to all of those with big ego's

Never fakin, we get the dough and live legal

Haters hate this, we sip the Mo' and yank the heezos

1 -Niggaz play this in they Rovers Jeeps and Regals

2 -Bitches play this in they Benzes Jeeps and Geos

{repeat 2X}"
0Ed7MeXx64f6OcIuoTRCg1,Xxplosive,7q2B4M5EiBkqrlsNW8lB7N,2001,6DPYiyq5kWVQS4RGwxzPC7,"Dr. Dre, Hittman, Six-Two, Nate Dogg, Kurupt",215200,,1999,"[Hittman]
Xxplosive, West coast shit
My nigguh-ish ways attract, girls that used to turn they back
Causin me to yank they arm and pose like I would do the harm
Now I'm sayin thank you cause they tell me, my shit's the bomb
Xxplosive.. ..for my niggaz drinkin Cognac, smokin weed, always pack

mo' than one, firearm, chrome rims, ridin on

Chronic in yo' system, let me know, my shit's the bomb - Xxplosive..



[Kurupt]

West coast shit nigga

Overdosage - imperial pistols ferocious

Fuck a bitch; don't tease bitch, strip tease bitch

Eat a bowl of these bitch, gobble the dick

Hoes forgot to eat a dick can shut the fuck up!

Gobble and swallow a nut up, shut up and get my cash

Backhanded, pimpslapped backwards and left stranded

Just pop ya collar, pimp convention hoes for a dollar

Six-Deuce in a plush, six-deuce impala

Pimpin hoes from Texas to Guatemala

Bitch niggaz paid for hoes, just to lay wit hoes

Relax one night, and paid to stay wit hoes

Captain Save'Em all day (bitch) well save this dick

Bitch nigga, you more of a bitch than a bitch

You ain't into hittin pussy, or hittin the switch

You into hittin bitches off of the grip, you punk bitch



[Nate Dogg]

All my real Doggs still kick it wit me

All my down hoes still trickin wit me

All the true gangstas know

Nate ain't never love no hoe

All the hoodrats still shake it for me

All my true fans still checkin for me

All the real smokers know

They ain't passin nuttin but dope indeed...

Real trees...

Chronic leaves...

No seeds...



When I had you last night, baby

Before - I blew yo' mind, (blew-blew-blew your mind)

I thought we had a chance, lady

No more - now that I'm sober you ain't that fine

Hmmm-hmmmhmmmm...

Don't wanna treat you wrong

Don't wanna lead you on

Here baby, hit the bong

while the west coast rolls along

While we - still makin gangsta hits

You'll be - still jockin gangsta dicks

Damn girl you think you slick

Somebody better get this biiitch, this biiiitch



[Six-Two]

I got these freaky hoes

Clappin they hands, stompin they feet

Every now and then they put they mouth on me

Nowadays a G like me can't even call it

A 23-year old pussy fiend and freakaholic

Pimpin bitches on the regular, I put that on the G

A hustler and a player, nowadays it pays to be

Lemme drop some shit about this bitch I used to know

She gave ya boy the head and said don't let nobody know

A bonafide pro, I had to grab the hoe

She got freaky in yo' sixty-fo', I skeeted in her throat

Been knowin the hoe for fo' days, pimpery pays

And I bet you didn't know that she go both ways

She ate her best friend, I left them hoes at the mote'

They be beepin me and shit, but we don't kick it no mo'

Them hot hoes is fiendin, they on the nuts

But beitch, I'm out ya pussy when I nut, f'real



{Exxplosive..}"
1SWVDBtw6h3tm9OehOkDhv,What's The Difference,7q2B4M5EiBkqrlsNW8lB7N,2001,6DPYiyq5kWVQS4RGwxzPC7,"Dr. Dre, Eminem, Xzibit",244200,,1999,"[Phish] What's the difference between me and you? (repeat 2X)
[Dr. Dre]
Back when Cube - was rollin wit Lorenzo in a Benzo
I was bangin wit a gang of instrumentals
Got the pens and pencils, got down to business; but sometimes

the business end of this shit can turn your friends against you

But you was a real nigga, I could sense it in you

I still remember the window of the car that you went through

That's fucked up, but I'll never forget the shit we been through

And I'ma do whatever it takes to convince you

Cuz you my nigga Doc, and Eazy I'm still wit you

Fuck the beef, nigga I miss you, and that's just bein real wit you

You see the truth is

Everybody wanna know how close me and Snoop is

And who I'm still cool wit

Then I got these fake-ass niggaz I first drew with

Claimin that they non-violent, talkin like they *voice sample*

Spit venom in interviews, speakin on reunions

Move units, then talk shit and we can do this

Until then - I ain't even speakin your name

Just keep my name outta yo' mouth and we can keep it the same

Nigga, it ain't that I'm too big to listen to the rumors

It's just that I'm too damn big to pay attention to 'em

That's the difference



Chorus: Phish (repeat 2X)



What's the difference between me and you?

You talk a good one - but you don't do what you supposed to do

I act on what I feel and never deal wit emotions

I'm used to livin big dog style and straight coastin



[Xzibit]

Yo I stay wit it

While you try to perpetrate, play wit it 

Never knew about the next level until Dre did it (YEAH)

I stay committed while you motherfuckers baby-sitted

I smash you critics like a overhand right from Riddick

(Yeah!) Come and get it, shitted on villians by the millions

I be catchin bitches while bitches be catchin feelings

So what the fuck am I supposed to do?

I pop bottles and hot hollow-points at each and all of you (Come on!)

A heartless bastard, high and plastered

My style is like the reaction from too much acid - never come down

Pass it around if you can't handle it

Hang Hollywood niggaz by they Soul Train laminates

What's the difference between me and you? (What?)

About five back accounts, three ounces and two vehicles

Until my death, I'm Bangladesh

I suggest you hold yo' breath til ain't none left

Yo that's the difference



Chorus



[Eminem]

Aight, hold up hold up!

STOP THE BEAT A MINUTE!! I got somethin to say

Dre; I wanna tell you this shit right now while this fuckin weed is in me

(The fuck?!) I don't know if I ever told you this, but I love you dawg

I got your motherfuckin back, just know this shit



[Dre]Riiight? .. Slim, I don't know if you noticed it

But I've had your back from day one, nigga let's blow this bitch

[Em]I mean it dawg, you ever need somebody offed - who's throat is it?

[Dre]Well if you ever kill that Kim bitch, I'll show you where the ocean is



[Eminem]

Well that's cool, and I appreciate the offer

But if I do decide to really murder my daughter's momma

I'ma sit her up in the front seat and put sunglasses on her

And cruise around wit her for seven hours through California

And have her wavin at people (Hi!) Then drop her off on the corner

at the police station and drive off honkin the horn for her

Raw dawg, get your arm gnawed off

Drop the sawed off and beat you wit the piece it was sawed off of

Fuck blood, I wanna see some lungs coughed up

Get shot up in the hot tub til the bubbles pop up

and they nose and cough snot up, mucus in hot water

That's for tryin to talk like The Chronic was lost product

That's for even THINKIN of havin them thoughts thought up!

You better show some respect whenever the Doc's brought up!!

So what's the difference between us? We can start at the penis

Or we can scream, ""I Just Don't Give a Fuck,"" and see who means it!



Chorus 1.25X"
0WWem437MQdylQuXxzE80H,Bar One,7q2B4M5EiBkqrlsNW8lB7N,2001,6DPYiyq5kWVQS4RGwxzPC7,"Dr. Dre, Traci Nelson, Ms. Roq, Eddie Griffin",50653,,1999,"Damn girl, it is hotter than a motherfucker up in here
You got that right
I need to go to the bar and get me a drink, please
Yes
Hello
Shit, what the fuck you want?

Hmm

Let me get a Cosmo



What the fuck you want?

Damn, I'll have an apple martini

This motherfucker drunk as a mother

Thirsty bitches

This a drunken-ass nigga



Oh, ooh, shit girl, those niggaz are lookin' over here!

Oh, shit, don't look, don't look

Damn, what's up, what they look like tho?

Shit, shit, damn, they look, they look aight

They fuckable? What's up, is they fuckable or what?

Shh, chill out, chill out

What?

Here they come

What?

Here they come! Chill out! Damn"
1WvuZsXHaH2qNAtvrQY6SX,Light Speed,7q2B4M5EiBkqrlsNW8lB7N,2001,6DPYiyq5kWVQS4RGwxzPC7,"Dr. Dre, Hittman",160973,,1999,"[Dr. Dre]
Hey, yo whassup?
My name is Dre
Can I blaze some Chonic witchu?
[girl]

Nigga what? FO' SHO'!

Roll that shit up!



[Dr. Dre]

Hell yeah, still ""Alwayz Into Somethin'""

Heart still in Compton

The comp can't oppose, dope Cali platinum classicals

Introduced you to my Doggs, that don't love hoes

and Firm Fiascoes - assholes

Fucked you up with my last video, tuxed up

doin a tango..

And cash, always in my grasp

Came up in the game wearin khakis not kangols, stranglin hoes

When asked about it in most interviews I just laugh

Now I vacate with hoes with a gang of ass

One feed me mangoes, the other lightin my hash

Rap tabloids write Dre's light in the ass (what?)

Came home uptight, ready to mash

like a gas pedal, get on that sixty-four Chevy level

AK-47 heavy metal

Who say Dre ain't ghetto? Just whistle like a tea kettle

I throw three at you, tell me if you see devils

cause we rebels over here, I smell Chronic in the air

that means we takin over this year

You hear?



[girl]Chronic, two-thousand, ""ONE! {*echoes*}"" --> KRS-One

[Dre]That means we takin over this year, ya hear?



[girl]

Light Speed, blazin Chronic through the galaxy

Hydro, doja, chocolate thai weed

Or we might be sippin on gin or Hennessey

Fuck that, where that new shit, The Chronic Iced Teas



[Hittman]

I hang among hustlers, I slang and hoo-bang Bronson

when bustaz roll through, can't fuck with my bold crew

We will hold you captive and bust

cause gangbangin is the active, activity

where I be livin B, there ain't no Liberty Statue

Hope you got your gat, don't let them catch you

slippin, without yours, it's warfare outdoors

Ambulance, violent uproars

Trash niggaz takin out like chores I meet whores on tours

Jeans hot as pepper so I sip, champagne on stormy shores

We on some hardcore, pornographic

Totin Austrian firearms that's made out of plastic

In these drastic surroundings, it be sounding like

Lebanon, makin fools ""RETREAT!"" like Megatron and Starscream

Oh yeah I scream-on-stars

to get loot and crossover like Kareem Abdul-Jabbar

Get out your car son, that's how I came to bougie niggaz

at bar one, it's either that or make front page stardom

I'm the Golden Child, chased by Sodom

?? gots my bulletproof it's hard to shoot me you hear?



(By the time you see him {*BLAM BLAM*})

That means it's real fuckin hard to shoot me, you hear?



[girl]

Light Speed, blazin Chronic through the galaxy

Hydro, doja, chocolate thai weed

Or we might be sippin on gin or Hennessey

Fuck that, where that new shit, The Chronic Iced Teas"
7iXF2W9vKmDoGAhlHdpyIa,Forgot About Dre,7q2B4M5EiBkqrlsNW8lB7N,2001,6DPYiyq5kWVQS4RGwxzPC7,"Dr. Dre, Eminem",222293,,1999,"[Dr. Dre]
Y'all know me, still the same O.G., but I been low key
Hated on by most these niggaz wit no cheese, no deals and no G's
No wheels and no keys, no boats no snowmobiles, and no ski's
Mad at me cause I can finally afford to provide my family wit groceries
Got a crib wit a studio and it's all full of tracks

to add to the wall full of plaques

Hangin up in the office in back of my house like trophies

Did y'all think I'ma let my dough freeze? Hoe please

You better bow down on both knees

Who you think taught you to smoke trees?

Who you think brought you the oldies?

Eazy-E's, Ice Cube's, and D.O.C's

The Snoop D-O-double-G's

and the group that said mother-""Fuck Tha Police""

Gave you a tape full of dope beats

to bump when you stroll through in your hood

And when your album sales wasn't doin too good

who's the Doctor they told you to go see?

Y'all better listen up closely

All you niggaz that said that I turned pop, or The Firm flopped 

Y'all are the reason that Dre ain't been gettin no sleep

so FUCK Y'ALL, all of y'all; if y'all don't like me, BLOW ME!

Y'all are gonna keep fuckin around wit me

and turn me back to the old me



Chorus: Eminem (repeat 2X)



Nowadays everybody wanna talk like they got somethin to say

but nothin comes out when they move their lips;

just a bunch of gibberish

And motherfuckers act like they forgot about Dre



[Eminem]

So what do you say to somebody you hate (What?)

Or anyone tryin to bring trouble your way?

Wanna resolve things in a bloodier way? (YUP)

Then just study a tape of N.W.A.!

One day I was walkin by, wit a Walkman on, when I caught a guy

give me an awkward eye (What you lookin at?)

And strangled him off in the parkin lot, wit his Karl Kani

I don't give a fuck if it's dark or not

I'm harder than me tryin to park a Dodge

when I'm drunk as fuck

Right next to a humungous truck in a two-car garage {*CRUNCH*}

Hoppin out wit two broken legs, tryin to walk it off

""Fuck you too bitch, call the cops!""

I'ma kill you and them loud ass motherfuckin barkin dogs

And when the cops came through

me and Dre stood next to a burnt down house

Wit a can full of gas and a hand full of matches

And still weren't found out (RIGHT HERE)

From here on out it's the Chronic 2

Startin today and tomorrow's the new

And I'm still loco enough

To choke you to death wit a Charleston Chew

{*Eminem's vocal turntable*}

Slim shady - hotter then a set of twin babies 

in a Mercedes Benz wit the windows up 

when the temp goes up to the mid 80's

Callin men ladies; sorry Doc but I been crazy

There's no way that you can save me

It's okay, go with him Hailey (Da-da?)



Chorus



[Dr. Dre]

If it was up to me, you muh'fuckers would stop comin up to me 

wit your hands out lookin up to me, like you want somethin free

When my last CD was out, you wasn't bumpin me

But now that I got this little company

Everybody wanna come to me like it was some disease

But you won't get a crumb from me

Cause I'm from the streets of (Compton, Compton)

I told em all - all them little gangstas 

Who you think helped mold 'em all?

Now you wanna run around talkin bout guns like I ain't got none

What you think I sold 'em all?

Cause I stay well off

Now all I get is hate mail all day sayin Dre fell off

What cause I been in the lab wit a pen and a pad

tryin to get this damn label off?

I ain't havin that; this is the millenium of Aftermath

It ain't gon' be nothin after that

So give me one more platinum plaque 

and fuck rap! You can have it back

So where's all the Madd Rappers at?

It's like a jungle in this habitat

But all you savage cats, know that I was strapped wit gats

when you were cuddlin a Cabbage Patch



Chorus



Chorus 1/2 (after music ends)"
4LwU4Vp6od3Sb08CsP99GC,The Next Episode,7q2B4M5EiBkqrlsNW8lB7N,2001,6DPYiyq5kWVQS4RGwxzPC7,"Dr. Dre, Snoop Dogg",161506,,1999,"La-da-da-da-dahh
It's the motherfuckin' one and only D-O-double-G
(Snoop Dogg!)
La-da-da-da-dahh
You know I'm mobbin' with the D-R-E
You know who's back up in this motherfucker?

What what what what

So blaze the weed up then

Blaze it up, blaze it up!

Just blaze that shit up, nigga!

Yeah, 'sup, Snoop?



Top Dogg, bite 'em all, nigga, burn the shit up

D-P-G-C, my nigga, turn that shit up

C-P-T, L-B-C, yeah, we hookin' back up

And when they bang this in the club, baby, you got to get up

Thug niggas, drug dealers, yeah, they givin' it up

Lowlife, yo' life, boy, we livin' it up

Takin' chances while we dancin' in the party for sure

Slip my ho a forty-fo' and she got in the back do'

Bitches lookin' at me strange, but you know I don't care

Step up in this motherfucker just a-swangin' my hair

Bitch, quit talkin', Crip walk, stay down with the set

Take a bullet with some dick and take this dope from this jet

Out of town, put it down for the Father of Rap

And if yo' ass get cracked, bitch, shut yo' trap

Come back, get back, that's the part of success

If you believe in the S, you'll be relievin' your stress



La-da-da-da-dahhh

It's the motherfuckin' D.R.E. (Dr. Dre, motherfucker)

La-da-da-da-dahhh

You know I'm mobbin' with the D-O-double-G



Straight off the fuckin' streets of C-P-T

King of the beats, you ride to 'em in your Fleet (Fleetwood)

Or Coupe DeVille rollin' on dubs

How you feelin' whoopty whoop, nigga what?

Dre and Snoop chronic'd out in the 'llac

With Doc in the back, sippin' on 'gnac

Clip in the strap, dippin' through hoods (what hoods?)

Compton, Long Beach, Inglewood

South Central out to the westside; it's California Love

This California bud got a nigga gang of pub

I'm on one, I might bail up in the Century Club

With my jeans on, and my team strong

Get my drink on and my smoke on

Then go home with somethin' to poke on

Loc, it's on for the two-triple-oh

Comin' real, it's the next episode



Hold up, hey

For my niggas who be thinkin' we soft, we don't play

We gonna rock it 'til the wheels fall off

Hold up, hey

For my niggas who be actin' too bold, take a seat

Hope you ready for the next episode

Hey, hey, hey, hey



Smoke weed every day"
