track_id,track_name,album_id,album_name,artist_id,artist_name,duration_ms,preview_url,release_year,lyrics
0UtnpKaReKUg2GquaSxCyD,Money Trees,748dZDqSZy6aPXKcI9H80u,"good kid, m.A.A.d city (Deluxe)",2YZyLoL8N0Wb9xBt1NhZWg,"Kendrick Lamar, Jay Rock",386906,,2012,"Me and my n*ggas tryna get it, ya bish
Hit this house then tell me is you with it, ya bish
Home invasion was persuasive
From nine to five I know it's vacant, ya bish
Dreams of living life like rappers do
Back when Compton rappers wasn't cool

I f*cked Sherene then went to tell my bros

Then Usher Raymond ""Let it Burn"" came on

Hot sauce all in my Top Ramen, ya bish

Parked the car, then we started rhyming, ya bish

The only thing we had to free - our mind

Then freeze that verse when we see dollar signs

You looking like an easy come up, ya bish

A silver spoon I know you come from, ya bish

And that's a lifestyle that we never knew

Go at a reverend for the revenue



It go Halle Berry or Hallelujah

Pick your poison, tell me what you do

Everybody gon' respect the shooter

But the one in front of the gun lives forever

And I been hustlin' all day, this a way, that a way

Through canals and alleyways, just to say

Money trees is the perfect place for shade and that's just how I feel

A dollar might just f*ck your main b*tch, that's just how I feel

A dollar might, say f*ck them n*ggas that you came with, that's just how I feel

A dollar might just make that lane switch, that's just how I feel

A dollar might, turn to a million and we all rich, that's just how I feel



Dreams of living life like rappers do

Bump that new E-40 at the school

You know big ballin' with my homies

Earl Stevens had us thinking rational

Back to reality, we poor, ya bish

Another casualty of war, ya bish

Two bullets in my uncle Tony head

He said one day I'd be on tour, ya bish

That Louie's Burger never be the same

A Louis belt will never ease that pain

But I'ma purchase when that day is jerkin'

Pull off at Church's with Pirelli's skirtin'

Gang signs out the window, ya bish

Hoping all of em offend you, ya bish

They say your hood is a pot of gold

And we gone crash it when nobody's home



It go Halle Berry or Hallelujah

Pick your poison, tell me what you do

Everybody gon' respect the shooter

But the one in front of the gun lives forever

And I been hustlin' all day, this a way, that a way

Through canals and alleyways, just to say

Money trees is the perfect place for shade and that's just how I feel

A dollar might just f*ck your main b*tch, that's just how I feel

A dollar might, say f*ck them n*ggas that you came with, that's just how I feel

A dollar might just make that lane switch, that's just how I feel

A dollar might, turn to a million and we all rich, that's just how I feel



Be the last one out to get this dough? No way

Love one of you bucket headed hoes? No way

Hit the streets, then we break the code? No way

Hit the brakes, when they on patrol? No way



Be the last one out to get this dough? No way

Love one of you bucket headed hoes? No way

Hit the streets, then we break the code? No way

Hit the brakes, when they on patrol? No way



Imagine Rock up in them projects

Where them n*ggas pick your pockets

Santa Claus don't miss them stockings

Liquor spilling, pistols popping

Baking soda, YOLA whipping

Ain't no turkey on Thanksgiving

My homeboy just domed a n*gga

I just hope the Lord forgive him

Pots with cocaine residue

Everyday I'm hustling

What else is a thug to do?

When you eat cheese from the government

Gotta provide for my daughter an' 'em

Get the f*ck up out my way, b*tch

Got that drum and I got them bass

Just like a parade, b*tch

Drop that work up in the bushes

Hope them boys don't see my stash

If they do tell the truth

This the last time you might see my ass

From the gardens where the grass ain't cut

Them serpents lurking blood

B*tches selling pussy, n*ggas selling drugs

But it's all good

Broken promises, steal your watch and tell you what time it is

Take your J's and tell you to kick it where a Footlocker is

In the streets with a heater under my dungarees

Dreams of me getting shaded under a money tree



It go Halle Berry or Hallelujah

Pick your poison, tell me what you do

Everybody gon' respect the shooter

But the one in front of the gun lives forever

And I been hustlin' all day, this a way, that a way

Through canals and alleyways, just to say

Money trees is the perfect place for shade and that's just how I feel





Kendrick, just bring my car back man.

I called in for another appointment.

I figured you weren't gonna be back here on time anyways.

Look, shit, shit, I just wanna get out the house man. 

This man, on one, he feeling good as a mother fucker.

Shit, I'm trynna get my thing going too. Just bring my car back.

Shit, he faded. He feeling good. Look, listen to him

Girl, Girl, I want your body, I want your body, cause of that big ol' fat ass.

Girl, Girl, I want your body, I want your body, cause of that big ol' fat ass

See he high as hell, and he ain't even tripping off them damn dominoes anymore.

Just bring the car back

Did somebody say dominoes?"
3MLOAIJNWWS8FQpvdaiKR7,Poetic Justice,748dZDqSZy6aPXKcI9H80u,"good kid, m.A.A.d city (Deluxe)",2YZyLoL8N0Wb9xBt1NhZWg,"Kendrick Lamar, Drake",300160,,2012,"Every second, every minute, man I swear that she can get it
Say if you a bad b*tch put your hands up high, hands up high, hands up high
Tell 'em dim the lights down right now, put me in the mood
I'm talking 'bout dark room, perfume
Go, go!


I recognize your fragrance (hol' up!)

You ain't never gotta say sh*t (woo!)

And I know your taste is

A little bit (mmm) high maintenance (ooh)

Everybody else basic

You live life on an everyday basis

With poetic justice, poetic justice

If I told you that a flower bloomed in a dark room, would you trust it?

I mean write poems in these songs, dedicated to you

And you're in the mood for empathy, there's blood in my pen

Better yet when your friends and them

I really wanna know you all

I really wanna show you off

F*ck that, pour up plenty of champagne

Cold nights when you curse this name

You called up your girlfriends and

Y'all curled in that little bitty range I heard that

She wanna go and party, she wanna go and party

N*gga don't approach her with that Atari

N*gga that ain't good game, homie, sorry

They say conversation, rule a nation, I can tell

But I can never right my wrongs

Unless I write it down for real, P.S



(Anytime)

You can get it, you can get it, you can get it, you can get it

And I know just know, just know, just know, just know, just what you want,

Poetic justice, put it in a song



(Anytime)

You can get it, you can get it, you can get it, you can get it

And I know just know, just know, just know, just know, just what you want,

Poetic justice, put it in a song



I really hope you play this

Cause ol' girl you test my patience

With all these seductive photographs and all these one off vacations

You've been takin'

Clearly a lot for me to take in

It don't make sense

Young East African Girl, you too busy f*cking with your other man

I was trying to put you on game, put you on a plane

Take you and your mama to the motherland

I could do it, maybe one day

When you figure out you're gonna need someone

When you figure out it's all right here in the city

And you don't run from where we come from

That sound like poetic justice, poetic justice

You were so new to this life but God damn you got adjusted

I mean I write poems in these songs, dedicated to the fun sex

Your natural hair and your soft skin, and your big ass in that sundress (ooh!)

Good God, what you doing that walk for?

When I see that thing move, I just wish we would fight less and we would talk more

And they say communication saves relations, I can tell

But I can never right my wrongs unless I write them down for real

P.S...



(Anytime)

You can get it, you can get it, you can get it, you can get it

And I know just know, just know, just know, just know, just what you want,

Poetic justice, put it in a song



(Anytime)

You can get it, you can get it, you can get it, you can get it

And I know just know, just know, just know, just know, just what you want,

Poetic justice, put it in a song



Every time I write these words they become a taboo

Making sure my punctuation curve

Every letter is true

Living my life in the margin and that metaphor was proof

I'm talking poetic justice, poetic justice

If I told you that a flower bloomed in a dark room, would you trust it?

I mean you need to hear this

Love is not just a verb, it's you looking in the mirror

Love is not just a verb, it's you looking for it maybe

Call me crazy, we can both be insane

A fatal attraction is common

And what we have common is pain

I mean you need to hear this

Love is not just a verb and I can see power steering

Sex drive when you swerve, I want that interference

It's coherent, I can hear it, mmhmm

That's your heartbeat

It either caught me or it called me, mmhmm

Breathe slow and you'll find gold mines in these lines

Sincerely, yours truly

And right before you go blind

P.S...



(Anytime)

You can get it, you can get it, you can get it, you can get it

And I know just know, just know, just know, just know, just what you want,

Poetic justice, put it in a song



I'm gon' ask you one more time homie, where is you from?

Or it is a problem?

Ay, you over here for Sherane homie?

Yo I don't care who this n*gga over here for, if he don't tell where he come, it's a wrap! I'm sorry.

Hol' up hol' up hol' up, we gon' do it like this, OK?

I'ma tell you where I'm from OK?

You gon' tell me where you from, OK? Or where your Grandma stay, where your mama stay, or where your daddy stay, OK?""

Enough with all this talkin'.

Matter of fact, get out the van homie.

Get out the car before I snatch you out that motherf*cker homie."
0PKJxo97zXT8oAwl2zFnPh,good kid,748dZDqSZy6aPXKcI9H80u,"good kid, m.A.A.d city (Deluxe)",2YZyLoL8N0Wb9xBt1NhZWg,Kendrick Lamar,214120,,2012,"Mass hallucination baby
Ill education baby
Wanna reconnect with your elations
This is your station baby

Look inside these walls and you'll see them having withdrawals

Of a prisoner on his way

Trapped inside your desire

To fire bullets that stray

Track attire just tell you I'm tired and ran away

I should ask a choir what do you require

To sing a song that acquire me to have faith

As the record spin I should pray

For the record I recognize that I'm easily prey

I got ate alive yesterday

I got animosity building

It's probably big as a building

Me jumping off of the roof

Is me just playing it safe

But what am I supposed to do

When the topic is red or blue

And you understand that I ain't

But know I'm accustomed to

Just a couple that look for trouble

And live in the street with rank

No better picture to paint than me walking from bible study

And called his homies because he had said he noticed my face

From a function that tooken place

They was wondering if I bang

Step on my neck and get blood on your Nike checks

I don't mind cause one day you'll respect

The good kid, m.A.A.d. city



Mass hallucination baby

Ill education baby

Wanna reconnect with your elations

This is your station baby



All I see is strobe lights

Blinding me in my hindsight

Finding me by myself

Promise me you can help

In all honesty I got time to be copastetic

Until you had finally made decision to hold me against my will

It was like a head on collision that folded me standing still

I can never pick out the difference

And grade a cop on the bill

Every time you clock in the morning

I feel you just want to kill

All my innocence while ignoring my purpose

To persevere as a better person

I know you heard this and probably in fear

But what am I supposed to do

With the blinking of red and blue

Flash from the top of your roof

And your dog has to say woof

And you ask ""lift up your shirt""

Cause you wonder if a tattoo

Of affiliation can make it a pleasure to put me through

Gang files, but that don't matter because the matter is racial profile

I heard them chatter: ""He's probably young but I know that he's down""

Step on his neck as hard as your bullet proof vest

He don't mind, he know we never respect

The good kid, m.A.A.d. city



Mass hallucination baby

Ill education baby

Wanna reconnect with your elations

This is your station baby



All I see in this room

20 Xanies and these 'shrooms

Grown-up candy for pain

Can we live in the same society

It's entirely stressful upon my brain

You hired me as a victim

I quietly hope for change

When violence is the rhythm

Inspired me to obtain

The silence in this room

With 20 Xanies and 'shrooms

Some grown-up candy I lost it

I feel it's nothing to lose

The streets sure to release the worst side of my best

Don't mind, cause now you ever in debt

To good kid, m.A.A.d. city



Mass hallucination baby

Ill education baby

Wanna reconnect with your elations

This is your station baby"
3qX1dqmDdmMvvfMVfsx4Bh,m.A.A.d city,748dZDqSZy6aPXKcI9H80u,"good kid, m.A.A.d city (Deluxe)",2YZyLoL8N0Wb9xBt1NhZWg,"Kendrick Lamar, MC Eiht",350120,,2012,
40wUM3LFZOlUcZfxEIZrYK,Swimming Pools (Drank) - Extended Version,748dZDqSZy6aPXKcI9H80u,"good kid, m.A.A.d city (Deluxe)",2YZyLoL8N0Wb9xBt1NhZWg,Kendrick Lamar,313786,,2012,
1Z2FvDFZSDQ23s4BDqpWqZ,"Sing About Me, I'm Dying Of Thirst",748dZDqSZy6aPXKcI9H80u,"good kid, m.A.A.d city (Deluxe)",2YZyLoL8N0Wb9xBt1NhZWg,Kendrick Lamar,723573,,2012,
73eGiraiU7JkIsmFyQyJAv,Real,748dZDqSZy6aPXKcI9H80u,"good kid, m.A.A.d city (Deluxe)",2YZyLoL8N0Wb9xBt1NhZWg,"Kendrick Lamar, Anna Wise",443413,,2012,"I do what I wanna do
I say what I wanna say
When I feel, and I...
Look in the mirror and know I'm there
With my hands in the air
I'm proud to say yea

I'm real, I'm real, I'm really really real

I'm real, I'm real, I'm really really real

I'm real, I'm real, I'm really really real

I'm real, I'm real, I'm really really real



I promise that I know you very well

Your eyes never lie even if they tell

Sweet lullabies that come with a smell

Of a dozen roses flippin' down the green hill

You living in a world that come with plan B

Cause plan A never relay a guarantee

And plan C never could say just what it was

And your plans only can pan around love

You love him, you love them, you love her

You love so much, you love when love hurts

You love red-bottom and gold they say queen

You love hand-bag on the waist of your jean

You love french tip and trip that pay for

You love bank slip that tell you we paid more

You love a good hand whenever the card dealt

But what love got to do with it when you don't love yourself



I do what I wanna do

I say what I wanna say

When I feel, and I...

Look in the mirror and know I'm there

With my hands in the air

I'm proud to say yea

I'm real, I'm real, I'm really really real

I'm real, I'm real, I'm really really real

I'm real, I'm real, I'm really really real

I'm real, I'm real, I'm really really real

Cause before you know it everything's gone



I promise that I know you very well

Your eyes never lie even if they fell

Out the sky and your optics turn stale

Where they mow that's green

I can see you fit the bill

Of living in a world that come with plan B

Cause plan A only can make another mistake

And you can't see success coming from plan C

When it all breaks you, you still say you're lovely

And love them and love when you love her

You love so much, you love when love hurts

You love fast cars and dead presidents old

You love fast women, you love keepin' control

Of everything that you love, you love beef

You love streets, you love runnin', duckin' police

You love your hood, might even love it to death

But what love got to do with it when you don't love yourself?



I do what I wanna do

I say what I wanna say

When I feel, and I...

Look in the mirror and know I'm there

With my hands in the air

I'm proud to say yea

I'm real, I'm real, I'm really really real

I'm real, I'm real, I'm really really real

I'm real, I'm real, I'm really really real

I'm real, I'm real, I'm really really real

Cause before you know it everything's gone



The reason why I know you very well

Cause we have the same eyes can't you tell

The days I tried to cover up and conceal

My pride, it only made it harder for me to deal

When living in a world that come with plan B

A scapegoat cause plan A don't come free

And plan C just an excuse like because

Or the word ""but"", but what if I got love

I love them, I love when I love her

I love so much, I love when love hurts

I love first verse cause you're the girl I attract

I love second verse cause you're the homie they packed

Burning like a stove top, they love cooking from scratch

I love what the both of you have to offer

In fact, I love it so much, I don't love anything else

But what love got to do with it when I don't love myself

To the point I should hate everything I do love

Should I hate living my life inside the club

Should I hate her for watching me for that reason

Should I hate him for telling me that I'm season

Should I hate them for telling me ball out

Should I hate street credibility I'm talkin' about

Hatin' all money, power, respect in my will

Or hatin' the fact none of that sh*t make me real



""I ain't trippin' off that Dominos anymore,

just calling, sorry to hear what happen to your homeboy,

but don't learn the hard way like I did homie.

Any n*gga can kill a man, that don't make you a real n*gga.

Realness is responsibility, realness is taking care of your motherf*cking family,

realness is God, n*gga""



I do what I wanna do

I say what I wanna say

When I feel, and I...

Look in the mirror and know I'm there

With my hands in the air

I'm proud to say yea

I'm real, I'm real, I'm really really real

I'm real, I'm real, I'm really really real

I'm real, I'm real, I'm really really real

I'm real, I'm real, I'm really really real



Cause before you know it everything's gone



""Alright that's all I wanted to tell you, 

ust make sure you call us back

when you get this message.

Here go your momma.""



""Boy you better have my jawn on full all this time you done had my damn car,

but look I ain't trippin'. 

ook, the neighbors say they seen you and your little friends

over there by the Food4Less,

and they was preaching to you over there telling you about the good book because right about now that's what ya'll need.

Oh, and Top Dawg called the house too.

I guess they want you and Dave to come to the studio.

But look, you take this music business serious,

and put out something me and your dad can step to.

Sh*t, you know we from Chicago, you know that's what we do.""





Sing my song, it's all for you Sing my song, it's all for you

Sing my song, it's all for you Sing my song, it's all for you

Sing my song, it's all for you Sing my song, it's all for you

Sing my song, it's all for you Sing my song, it's all for you

Sing my song, it's all for you Sing my song, it's all for you

Sing my song, it's all for you Sing my song, it's all for you

Sing my song, it's all for you Sing my song, it's all for you

Sing my song, it's all for you Sing my song, it's all for you



Sing my song, it's all for you Sing my song, it's all for you

""If I don't hear from you, by tomorrow...

I hope you come back, and learn from your mistakes.

Come back a man, tell your story to these black and brown kids in Compton.

Let 'em know you was just like them,

but you still rose from that dark place of violence,

becoming a positive person. But when you do make it, give back,

with your words of encouragement, and that's the best way to give back.

To your city...

And I love you Kendrick,

if I don't hear you knocking on the door you know

where I usually leave the key.

Alright? Talk to you later, bye."""
0O6cYePgIBlMQ0pAFate3q,Compton,748dZDqSZy6aPXKcI9H80u,"good kid, m.A.A.d city (Deluxe)",2YZyLoL8N0Wb9xBt1NhZWg,"Kendrick Lamar, Dr. Dre",248093,,2012,"Now everybody serenade the new faith of Kendrick Lamar
This is king Kendrick Lamar
King Kendrick and I meant it, my point intended is raw
Fix your lenses forensics would've told you Kendrick had killed it
Pretend it's a massacre and the masses upon us
And I mastered being the master and dodging your honor

And the chapter that read at 25 I would live dormant like 5 in the morning

Then ring your spot while Kendrick's performing

And if they take everything, know I got



Compton, compton, ain't no city quite like mine



(ay, dre what's happenin' wit' it my nigga!)

Still I'm mad, peel the plastic off it, you can feel the magic

Still I'm laughing at the critics talking, I can see 'em gagging

When I'm back in the back of my city, back in the back

With a batch of them bangin' dre beats with me, look where I'm at

It's the murder cap' and I'm captain at birth of this gangster rap

It's a wrap when I'm done and I come a long way from a hundred dollars a month

To a hundred mil' in a day, bitch I'm from



Compton, compton, ain't no city quite like mine



So come and visit the tire screeching, ambulance, policeman

Won't you spend a weekend on rosecrans nigga

Khaki creasing, crime increasing on rosecrans nigga

Kendrick conan nigga

Where you sword at, hand on the cross and swore that

I do it big as rasputia (?) kama sutra scream fuck your position

And make you hold that

I'm trying to stay grounded like four flats

But I know flats and piru crip tats



(will swarm on me like a beehive

Hop in the g ride

From the west to the east side

Know that's just how compton roll)



And that's a given

I pass the blunt then pass the torch of course that's my decision

I crash the porsce then you report that you see me in benzes

I must report that we import the narcotics you bought it

(then talked about it when crack hit the speakers, the music business

I blow up every time we throw up a record

Depending on what you expecting, I'm sure it's bigger than your religion

Perfected by niggas that manifested music to live in)



Compton, compton, ain't no city quite like mine



So tell that gangster throw his set high

Roll it up in a blunt, i'mma take you on the next high

I did exactly what I wanted that's what made them checks fly

In my direction, you never questioned when I said I

Would be a mogul before I visit 2pac and left-eye

Eazy and aaliyah when I see you we gon' test drive

A lambo in heaven but for now I'm on the redeye

Flying back to my city cuz I'll forever standby



Compton, compton, ain't no city quite like mine



Now we can all celebrate

We can all harvest the rap artists of nwa

America target our rap market, it's controversy and hate

Harsh realities we in made our music translate

To the coke dealers, the hood rich, and the broke niggas that play

With them gorillas that know killers that know where you stay

Roll that kush, crack that case, ten bottles of rozay

This was brought to you by dre

Now every motherfucker in here say:

""look who's responsible for taking compton international

I make 'em holla"""
5jHilrZDaP1vJMZfdN1He3,The Recipe - Bonus Track,748dZDqSZy6aPXKcI9H80u,"good kid, m.A.A.d city (Deluxe)",2YZyLoL8N0Wb9xBt1NhZWg,"Kendrick Lamar, Dr. Dre",352853,,2012,
6P6HGbOoWUynE2U7yLwLnY,Black Boy Fly - Bonus Track,748dZDqSZy6aPXKcI9H80u,"good kid, m.A.A.d city (Deluxe)",2YZyLoL8N0Wb9xBt1NhZWg,Kendrick Lamar,279146,,2012,
0NfYAsKygCYwPA2BgTZ1qg,Now Or Never - Bonus Track,748dZDqSZy6aPXKcI9H80u,"good kid, m.A.A.d city (Deluxe)",2YZyLoL8N0Wb9xBt1NhZWg,"Kendrick Lamar, Mary J. Blige",256213,,2012,
4wshBvO4qMrxJnPlfkeUWi,"Bitch, Don’t Kill My Vibe - Remix",748dZDqSZy6aPXKcI9H80u,"good kid, m.A.A.d city (Deluxe)",2YZyLoL8N0Wb9xBt1NhZWg,"Kendrick Lamar, JAY-Z",278586,,2012,
1IjxCFAyR1ysajk10iHsKh,"Bitch, Don’t Kill My Vibe - International Remix / Explicit Version",748dZDqSZy6aPXKcI9H80u,"good kid, m.A.A.d city (Deluxe)",2YZyLoL8N0Wb9xBt1NhZWg,"Kendrick Lamar, Emeli Sandé",305813,,2012,
3KHjXNQDEZ0Hb2hzGdxcx7,Sherane a.k.a Master Splinter’s Daughter,0Oq3mWfexhsjUh0aNNBB5u,"good kid, m.A.A.d city",2YZyLoL8N0Wb9xBt1NhZWg,Kendrick Lamar,273640,,2012,
0yhMmqax6HRAZxI7udEask,"Bitch, Don’t Kill My Vibe",0Oq3mWfexhsjUh0aNNBB5u,"good kid, m.A.A.d city",2YZyLoL8N0Wb9xBt1NhZWg,Kendrick Lamar,310720,,2012,
