track_id,track_name,album_id,album_name,artist_id,artist_name,duration_ms,preview_url,release_year,lyrics
4uDkagullY9IiBg6rIQsKR,Hold You Down,01MRGgNbfWrE291tQjw9ta,Camp,73sIBHcqh3Z3NyqHKZ7FOL,Childish Gambino,292453,,2011,"[Hook]
Ooh, I want it, yeah
Whenever you need my help
I'll hold you down, oh
Ooh, you want it, yeah
Motherfuck these niggas

Tryin' to hold me down, oh

Yeah, uh

Why in the fuck these niggas try and hold me down, ohh



[Verse 1]

You such a fuckin' lame

It's what they used to yell back in seventh grade

My momma said she'd get me that new jacket when the cost go down

Hit the office, stole some Tommy Hill from lost and found

Not bad for a family of foster child

Lookin' fly man, I'm flossin' now

But them niggas saw through me

Are you serious? What is this?

Took the jacket off third period, ellipsis

Listening to ""Sky is the Limit"" on my Walkman

Thinking if Biggie can make it through it, man then I can

Dope-boy swag

I always wanted that

But my persona was always more of that Arthur Ash

But no love for the son of a commuter

Who was a radio head and okay at them computers

At the post office

It's funny how you smoke niggas then you start coffins

All my people need throat lozenge

My fear is dead

Ambition drove the hearse

But niggas got my feelin' I ain't black enough to go to church

Culture shock at barber shops cause I ain't hood enough

We all look the same to the cops, ain't that good enough?

The black experience is blackened serious

Cause being black, my experience, is no one hearin' us

White kids get to wear whatever hat they want

When it comes to black kids one size fits all



[Hook]



[Break]

We the baddest nigga, we the baddest nigga

You hear me?

We the baddest nigga, we the baddest nigga

We the baddest nigga, we the baddest



[Verse 2]

The reason that they say I'm nothin' what they seen or heard's

The same reason Will Smith always opposite Latino girls

They only see you how they wanna see you

'Til you make them see you in some other way

I'm trippin' off the other day

Cause God knows what these white kids sayin'

Dude you're not not racist cause The Wire's in your Netflix cue

Subtle racism

It's hard to pin it cause you'd only understand

If you were me for just a minute

This one kid said somethin' that was really bad

He said I wasn't really black because I had a dad

I think that's kinda sad

Mostly cause a lot of black kids think they should agree with that

If you're a father, you should stick around if you could

Cause even if you're bad at it, you get Tiger Woods

MJ

We warriors, we all need senseis

Change everything that we've done so far

I don't mean makin' B.E.T. T.E.R

I mean just the way that we see each other

I won't stop until they say, ""James Franco is the white Donald Glover""

Yeah, these niggas wanted Cookie but instead I gave 'em Loch Ness

Sick Boi for life, my swag is in a hospice

Aimin' for the throne, Jay and Ye said to watch that

They ask me what I'm doin', I say I'm stealin' rock back

Nigga



[Hook x2]"
2jrP54CkSMNnnRPu4sTJFD,Kids,01MRGgNbfWrE291tQjw9ta,Camp,73sIBHcqh3Z3NyqHKZ7FOL,Childish Gambino,297933,,2011,
6sg6kWL8RjUcl7Kq7lxwEc,You See Me,01MRGgNbfWrE291tQjw9ta,Camp,73sIBHcqh3Z3NyqHKZ7FOL,Childish Gambino,195373,,2011,"[Hook]
I'm on my ballin' each and every day
Asian girls everywhere, UCLA
You see me babe? You see me babe?
Asian girls everywhere, UCLA

[Verse 1]

I'm on my ish, call it

I watch these haters take they shots like they were alcoholics

""What is he wearing? Somebody jack that fool's steeze""

If I'm a faggot spell it right, I got way more than two G's

Nigga I'm amazing, I'm a phenom

I'm assassin, I'mma kill y'all

Ma ma se, ma ma sa, ma ma coo sa

And this shit's closed down cause I ball too hard

And I'm cumming on her face, have I gone too far?

I don't know, who cares, I don't love that broad

And it's funny how these nigga's always act hard

I'm a black star in a black car with a black card

They wanna knock me out

They try a nigga

Realest motherfucker in the game, like Tron nigga

Forget these white girls

I need some variation

Especially if she very Asian

She got an ugly friend? Roll solo

Can I stay at your place? No hobo

Not my fault, man, these ladies love me

She's an overachiever cause all she do is succeed



[Hook]



[Verse 2]

Send me naked pics, I'mma Tumbl that

I'm the shit, been the shit, fuck a humble brag

Yeah I'm pushin' that, and her pussycat

I got swag out my ass so I'm usin' that

Texting with Olivia Munn, hopefully she'll give me some

Or some Rosie Jones, man

Hoes is hoes is hoes, man

Racks on racks on racks, man

All I got is tracks, man

Sorry for my accent, but I've been practicin'

Everywhere ya go niggas blastin' that Gambino

Niggas be like, ""You ain't know?""

Bitches be like, ""You ain't know?""

Met this fly Latino

Hope that she eighteen though

If she not, I'll say that I got deep throat in Heathrow



[Hook]



[Verse 3]

Told me I was shit, but that shit couldn't stop me

Nigga still hungry, black kobayashi

When I talk about you I hear a ""who?"" like Horton

I was born for this shit, you a rappin' abortion

Can we hear the N-word one day and not get upset?

Can we try something new and not be suspect?

I don't really know, we fucked up bad

You don't wanna see my dudes when they get mad

I got a bunch of jackanapes at the back of me

That'll lacerate anyone in the back of a matinee

And laugh while they masturbate all over your beaten body

Sick boy forever, that Suburban Illuminati

Naw nigga, yeah we never stop

No period like menopause

No period like, ""Oh shit!

Am I the only one you sleepin' with?""

Am I the only one you sleepin' with?"""
5EiLjOB57pHdNnkcrWh1m4,Sunrise,01MRGgNbfWrE291tQjw9ta,Camp,73sIBHcqh3Z3NyqHKZ7FOL,Childish Gambino,219840,,2011,"[Verse 1]
Yeah nigga, it's me again
I'm still around, I guess I win
You hear me in your sister's room like all the time
Gambino Girl forever on that bracelet that she bought online
To dudes who couldn't take it, might I say, ""hasta luega""

Cause I'm taking all your city like I'm Carmen San Diego

I'm smoking, I'm on fire

I am blazin', don't get hurt

To my white dudes it's a concert

To my black nerds this is church

From that NYU dorm to the Emirate

Everyone hated me, I'm more hip hop than you'll ever be

Im bustin', bustin' bustin', bustin' on these niggas man

And nothin, nothing nothin, nothin is the same again

You lookin dumb as hell man for ever sleeepin' on him

Your girl is not around, she busy sleepin on him

Will he fail?

Now that's the wrong conversation

Terry Gross on the mic, I'm the talk of the nation, uh



[Hook x2]

Hey, what it do bitch?

Why these other rappers do shit stupid?

While they be sleepin' I be onto that new shit

While they be sleepin' I be onto that new shit



[Verse 2]

New shit

You didn't know?

Black rock like a fuckin' LOST episode

Somethin' for these black kids to call they own

So when you skatin' in your driveway, you not alone

She stay down like that new coat that I bought her

And the fly rihanna girls be drinkin' my coconut water

And I'm lookin' at her butt

Thats that 20/20 hindsight

My shit be Jackson, Jordan, Bolton, Keaton, Tyson: 5 Mikes

Donald Glover, no relation

Always workin', no vacation

They couldn't feel me, novacation

Murder versus the only motive was motivation

Money equals freedom

I've wanted this since a three-year-old

I've seen it all, like I'm John Mann's penis hole

Bein' me, that's something that's so unusual

I've seen the future, and the future go



[Hook x2]



[Outro]

Can't you hear me baby?

Can't you hear me callin' out your name?

Can't you hear me baby?

Oh, can't you hear me callin' out your name?"
7g4kv8dGaR8mHjxL2WP9ej,That Power,01MRGgNbfWrE291tQjw9ta,Camp,73sIBHcqh3Z3NyqHKZ7FOL,Childish Gambino,462253,,2011,"[Hook]
All these haters
See you later
All that I could do
But you dont even feel me though
I know you got that power

That power

Oh, oh oh



[Verse 1]

So CG but a nigga stay real

Though I'm fly I'm ill I'm running shit

3-points, field goal

Rappers used to laugh like I tripped and fell

Cause I don't stunt a gold cross like I Christian Bale

Yeah, they starin' at me jealous cause I do shows bigger

But your looks don't help, like an old gold digger

Uncool, but lyrically I'm a stone cold killer

So it's 400 blows to these Truffaut niggas

Yeah, now that's the line of the century

Niggas missed it, too busy

They lyin' 'bout penitentiary

Man, you ain't been there

Nigga you been scared

And I'm still living single like Synclaire

Lovin' white dudes who call me white and then try to hate

When I wasn't white enough to use your pool when I was 8

Stone Mountain you raised me well

I'm stared at by Confederates but hard as hell

Tight jeans penny loafers, but I still drink a Bodine

Staying on my me shit, but hated on by both sides

I'm just a kid who blowing up with my father's name

And every black ""you're not black enough""

Is a white ""you're all the same""

DOOM Food like Rapp Snitch Knishes

Cuz its oreos, twinkies, coconuts, delicious

How many gold plaques you want inside your dining room?

I said I want a full house

They said, ""You got it dude!""



[Hook]



[Verse 2]

Holla, holla, holla, holla at yo boy

Like yo dad when he's pissed off

Got flow, I could make a cripple crip walk

Niggas' breath stank, all they do is shit talk

People want a real man, I made 'em wait this long

Maybe if he bombs, he'll quit and keep actin'

And save paper like your aunt does with McDonald napkins

How'd it happen? Honesty did it

See all of my competition at the bodies exhibit

Yeah I bodied the limits and I get at them fakers

Motherfuck if you hate it, cremated them haters

So, my studio be a funeral

Yeah, this is our year, oh you didn't know?

Uh, yeah I'm killin' you, step inside the lion's den

Man I'm hov if the 'O' was an 'I' instead

On stage with my family in front of me

I am what I am: everything I wanna be



[Hook]



[Outro]

This is on a bus back from camp. I'm thirteen and so are you. Before I left for camp I imagined it would be me and three or four other dudes I hadn't met yet, running around all summer, getting into trouble. It turned out it would be me and just one girl. That's you. And we're still at camp as long as we're on the bus and not at the pickup point where our parents would be waiting for us. We're still wearing our orange camp t-shirts. We still smell like pineneedles. I like you and you like me and I more-than-like you, but I don't know if you do or don't more-than-like me. You've never said, so I haven't been saying anything all summer, content to enjoy the small miracle of a girl choosing to talk to me and choosing to do so again the next day and so on. A girl who's smart and funny and who, if I say something dumb for a laugh, is willing to say something two or three times as dumb to make me laugh, but who also gets weird and wise sometimes in a way I could never be. A girl who reads books that no one's assigned to her, whose curly brown hair has a line running through it from where she put a tie to hold it up while it was still wet



Back in the real world we don't go to the same school, and unless one of our families moves to a dramatically different neighborhood, we won't go to the same high school. So, this is kind of it for us. Unless I say something. And it might especially be it for us if I actually do say something. The sun's gone down and the bus is quiet. A lot of kids are asleep. We're talking in whispers about a tree we saw at a rest stop that looks like a kid we know. And then I'm like, ?Can I tell you something?? And all of a sudden I'm telling you. And I keep telling you and it all comes out of me and it keeps coming and your face is there and gone and there and gone as we pass underneath the orange lamps that line the sides of the highway. And there's no expression on it. And I think just after a point I'm just talking to lengthen the time where we live in a world where you haven't said ?yes? or ?no? yet. And regrettably I end up using the word ?destiny.? I don't remember in what context. Doesn't matter. Before long I'm out of stuff to say and you smile and say, ?okay.? I don't know exactly what you mean by it, but it seems vaguely positive and I would leave in order not to spoil the moment, but there's nowhere to go because we're are on a bus. So I pretend like I'm asleep and before long, I really am



I wake up, the bus isn't moving anymore. The domed lights that line the center aisle are all on. I turn and you're not there. Then again a lot of kids aren't in their seats anymore. We're parked at the pick-up point, which is in the parking lot of a Methodist church. The bus is half empty. You might be in your dad's car by now, your bags and things piled high in the trunk. The girls in the back of the bus are shrieking and laughing and taking their sweet time disembarking as I swing my legs out into the aisle to get up off the bus, just as one of them reaches my row. It used to be our row, on our way off. It's Michelle, a girl who got suspended from third grade for a week after throwing rocks at my head. Adolescence is doing her a ton of favors body-wise. She stops and looks down at me. And her head is blasted from behind by the dome light, so I can't really see her face, but I can see her smile. And she says one word: ?destiny.? Then her and the girls clogging the aisles behind her all laugh and then she turns and leads them off the bus. I didn't know you were friends with them



I find my dad in the parking lot. He drives me back to our house and camp is over. So is summer, even though there's two weeks until school starts. This isn't a story about how girls are evil or how love is bad, this is a story about how I learned something and I'm not saying this thing is true or not, I'm just saying it's what I learned. I told you something. It was just for you and you told everybody. So I learned cut out the middle man, make it all for everybody, always. Everybody can't turn around and tell everybody, everybody already knows, I told them. But this means there isn't a place in my life for you or someone like you. Is it sad? Sure. But it's a sadness I chose. I wish I could say this was a story about how I got on the bus a boy and got off a man more cynical, hardened, and mature and shit. But that's not true. The truth is I got on the bus a boy. And I never got off the bus. I still haven't"
0gumzwaWIaTlHsIz18VEQe,Outside,6y08a862sRi9ILcYGkLljn,Camp (Deluxe Edition),73sIBHcqh3Z3NyqHKZ7FOL,Childish Gambino,271000,,2011,"[Verse 1]
I used to dream every night, now I never dream at all
Hopin' that it's cause I'm livin' everything I want
Used to wake up in a bed between my mom and aunt
Playing with this Land Before Time toy from Pizza Hut
My dad works nights

Putting on a stone face

He's saving up so we can get our own place

In the projects, man that sounds fancy to me

They called me fat nose, my mom say you handsome to me

Mrs. Glover ma'am, your son is so advanced

But he's acting up in class and keeps peeing in his pants

And I just wanna fit in, but nobody was helping me out

They talking hood shit and I ain't know what that was about

Cause hood shit and black shit is super different

So I'm talking hood shit and cool it now like New Edition

Mom and dad wouldn't listen

They left the Bronx so I wouldn't be that

All their friends in NY deal crack

It's weird, you think that they'd be proud of 'em

But when you leave the hood they think that you look down on 'em

The truth is we still struggle on a different plane

7 dollars an hour, WIC vouchers, it's all the same

Facebook messaging hopin' that could patch up shit

But all they get now is, ""Can your son read this script?""



[Hook]

There's a world we can visit if we go outside

Outside, outside

We can follow the road

There's a world we can visit if we go outside

Outside, outside

No one knows

There's a world we can visit if we go outside

Outside, outside

We can follow the road

There's a world we can visit if we go outside

Outside, outside

No one knows



[Verse 2]

Yeah

Dad lost his job

Mama worked at Mrs. Winner's

Gun pulled in her face

She still made dinner

?Donald watch the meter

So they don't turn the lights off""

Workin' two jobs so I can get into that white school

And I hate it there

They all make fun of my clothes and wanna touch my hair

And my uncle on that stuff that got my Grandma shook

Drug dealers roughed him up and stole his address book

He's supposed to pay 'em back

He owe 'em money but his bank account is zero

So my momma made us sleep with Phillips heads under the pillow

Like that would do somethin'

But she's got six kids, she's gotta do somethin'

She don't want me in a lifestyle like my cousin

And he mad cause his father ain't around

He lookin' at me now, like

""Why you so fuckin lucky?

I had a father too

But he ain't around so I'mma take it out on you""

We used to say ""I love you""

Now we only think that shit

It feels weird that you're the person I took sink baths with

Street took you over

I want my cousin back

The world sayin' what you are because you're young and black

Don't believe 'em

You're still that kid that kept the older boys from teasin'

For some reason



[Hook]



[Outro]

Can you hear me now?

Can you hear me now?

Oh, help us Lord

Oh, baby baby baby"
2dIzmC5a58WkXd6PNvjaeb,Fire Fly,6y08a862sRi9ILcYGkLljn,Camp (Deluxe Edition),73sIBHcqh3Z3NyqHKZ7FOL,Childish Gambino,203546,,2011,"[Hook]
Now when they see us on the streets
All they wanna do is take pics
And I'm like, okay (yeah, okay)
And when they hear us on the beat
All they wanna do is make hits

And I'm like, okay (yeah, okay)

And if you're feelin' like I'm feelin'

How the world should be: perfectly

Fire like I'm third degree, and suddenly

Shawty, we got so high

Fire Fly



[Verse 1]

Skateboardin' down at Washington Square

Lookin' for quarters

Maybe afford a falafel for dinner, ugh

I'm so broke man

Scholarship apology

Facebook messages from college kids who hollerin'

Girls like, ""we love you, we go to LSU

You gotta do a show so we can come and molest you""

This rap stuff is magic

I used to get called ""Oreo"" and ""Faggot""

I used to get more laughs when I got laughed at

Oh you got a mixtape? That's fantastic

But everybody thought it was jokes though

They half right, the joke is

I got flow so don't act like

You ain't sittin' there with your friends like, it can't be

I know Donald Glover, he weak man, he can't be

I'm still knocked down, but I up the ante

Me and hip-hop, that black Sid and Nancy



[Hook]



[Verse 2]

It's hard to make HOV the footsteps you followin'

Especially when your niggas look like Carlton

The pretty girls usin' skin so soft

Only be likin' black dudes with their hats broke off

Man you act too soft

Fuck you! I'm from the projects

My mom was just workin' to give me options

No live shows, cause I can't find sponsors

For the only black kid at a Sufjan concert

Yeah so, whatcha gonna do man?

You won't speak to the hood, man

If I was given one chance I think I could, man

These black kids want somethin' new, I swear it

Somethin' they wanna say but couldn't cause they embarrassed

All I do is make the stuff I wanna write

Reference things I wanna watch, reference girls I wanna bite

Now I'm firefly like a burning kite

And yousa fake fuck like a fleshlight

Even dudes who like me straight lookin' at me crazy

Like, how the hell he drop a EP and meet Jay-Z?

Girls used to tell me I ain't cool enough

Now text me pics sayin', ""You could tear this up""

I don't really like shades, big rims, or jewelry

But gettin' time of day from a model is new to me

Bein' me isn't as hard as it used to be

Now everyone sing the chorus man, you do it so beautifully



[Hook x2]"
6j3rLEA8KSsWUNoXvA37Mq,Bonfire,6y08a862sRi9ILcYGkLljn,Camp (Deluxe Edition),73sIBHcqh3Z3NyqHKZ7FOL,Childish Gambino,193173,,2011,"[Verse 1:]
Okay, it's Childish Gambino, homegirl drop it like the NASDAQ
Move white girls like there's coke up my asscrack
Move black girls cause, man, fuck it, I'll do either
I love pussy, I love bitches, dude, I should be runnin' PETA
In Adidas, with some short shorts, B-O-O all over me

My green is where it's supposed to be, your green is in my grocery

This Asian dude, I stole his girl, and now he got that Kogi beef

My dick is like an accent mark, it's all about the over Es

Hot like a parked car

I sound weird like nigga with hard R

Fly like the logo on my cousin's 440

Eatin' Oreos like these white girls that blow me

Vodka for my ladies, whiskey for a grown man

Hangin' in the islands, lookin' for Earl like Toejam

I made the beat retarded, so I'm callin' it a slow jam

Butcher and I know it, man, kill beef, go ham

These rappers are afraid of him

Cause I'm a beast, bitch, Gir, Invader Zim

Gambino is a call girl, fuck you, pay me

Brand new whip for these niggas like slavery

They told me I was awful man, that shit did not phase me

Tell me how I suck again, my memory is hazy

""You're my favorite rapper, now"" Yeah, dude, I better be

Or you can fuckin' kiss my ass, Human Centipede

You wanna see my girl? I ain't that dumb

You wanna see my girl? Check Maxim

""Man, why does every black actor gotta rap some? ""

I don't know, all I know is I'm the best one



[Hook:]

It's a bonfire, turn the lights out

I'm burnin' everything you muthafuckas talk about

It's a bonfire, turn the lights out

I'm burnin' everything you muthafuckas talk about



[Verse 2:]

You know these rapper dudes talk shit, start killin'

Fuck that, got goons like an archvillain

I'm from the South, ain't got no accent, don't know why

So this rap is child's play, I do my name like Princess Di

Yeah, they say they want the realness, rap about my real life

Told me I should just quit: ""first of all, you talk white!

Second off, you talk like you haven't given up yet""

Rap's stepfather, yeah, you hate me but you will respect

I put in work, ask Ludwig

Put my soul on the track like shoes did

Played this for my cousin, now he can't even think straight

Black and white music? Now, nigga, that's a mixtape

Shoutout to my players, they represent the realness

Shoutout to Gambino, girls, my dick is in the building

I know you hate me nerdy your little fuckin' boy be on ya

Like girls who dirty, but with' niggas they be sayin' ""Owww""

Sorry for who coddled you

Chillin' with a Filipino, at your local Jollibee

Yeah, I'm in her ass like sodomy

So if you see my finger under the table, don't bother me

I don't talk soft, that's that other guy

I'm sayin' ""What the fuck is up? "" like I ain't seen the sky

And shit I'm doin' this year? Insanity

Made the beat then murdered it, Casey Anthony

These rappers don't know what to do

Cause all I did was act me like a Looney Tune

I'll give you all of me until there's nothing left

I swear this summer will be summer Camp, bitch!"
