track_id,track_name,album_id,album_name,artist_id,artist_name,duration_ms,preview_url,release_year,lyrics
78sUOio7Q63zyraK2auLla,Final Church,692R05mxz7V6eOFoj5PMlQ,Atavista,73sIBHcqh3Z3NyqHKZ7FOL,Childish Gambino,226453,,2024,"Woo-uh, uh, uh
Yeah, yeah, come on
What's good? (Come on)
Young Decatur, comin' straight out the hood (That's right)
I'm just tryna put the spirit in your Yeezy Boosts (Yeezy Boosts)

Get your cup, it runneth over once I got the juice

Every day is Sunday mornin', woo, you hella late (You hella late)

See the colors of my father when I meditate

I'ma give it to you, mama, I can't even lie

Amber-colored lotus flowers when I touch the sky

I ain't even high, uh



There is love in every moment

Under the sun, boy

I did what I wanted to

There is love in every moment

Under the sun, boy

You do what you wanna do



Ooh, my beard long, damn, I look like Jesus (Uh)

And my shirt is off, ooh, I feel like Fela (Uh)

On my mama, boy, you silly, tryna please a hater

Do you feel me? (Nah, nah) Ya'll don't hear me (Nah, nah)

Said I feel good, (Feel good) look good (Look good)

East Atlanta, (Gresham Park) Hollywood (Hollywood)

Never said it even though I prolly should (Woah)

I said I love me, l said I love me, ah, yeah



There is love in every moment

Under the sun, girl

I did what I wanted to

Ooh, ooh

There is love in every moment

Under the sun, girl

You do what you wanna do

Uh-huh



When you looking at the devil

But you lookin' in the mirror

What you gon' say? (Wait a minute)

Uh, uh, when your money getting long

But you know you're doin' wrong

What you gon' say? (Wait a minute)

Uh, uh, when you know your mama dyin'

And you runnin' out of time

What you gonna say? (Wait a minute)

Uh, when you feel alone

Know you are not alone (Wait a minute)

Ah, yeah



There is love in every moment

Under the sun, boy

I did what I wanted to, yeah, yeah

Now I just power forward

Under the sun, in every moment

I did what I wanted to



Everything that you're feeling right now (Ooh)

Let it out, let it out (Ooh, ayy)

Alright, you ready?

Okay, now, one, two, one, two, three

Now do your dance, mama

Ayy, ayy, ayy

Ayy, ayy, ayy, uh

Ayy, uh, yeah, uh

What? Feel it

What? Dance, lil' mama

Ayy, ayy, uh

Get loose

Uh, uh, uh, ayy, ayy

Yeah, yeah, yeah

Oh

Do what you wanna do

Oh, yeah, yeah, yeah

No, no, no, no, no, baby

Oh, no, no

Do what you wanna do"
0NkkbKSzQ50mAoSUbQpgLw,Me and Your Mama,4JCybsNZUXWrK2Jpyn12Ni,"""Awaken, My Love!""",73sIBHcqh3Z3NyqHKZ7FOL,Childish Gambino,379226,,2016,"I'm in love when we are smokin' that la-la-la-la-la
I'm in love when we are smokin' that la-la-la-la-la
I'm in love when we are smokin' that la-la-la-la-la
I'm in love when we are smokin' that la-la-la-la-la
I'm in love when we are smokin' that la-la-la-la-la
I'm in love when we are smokin' that la-la-la-la-la

I'm in love when we are smokin' that la-la-la-la-la

I'm in love when we are smokin' that la-la-la-la-la



Do what you want!

I'm telling you

Let me into your heart!



Can't stand it, backhanded!

They wanna see us fallin' apart!

You know that I love you!

So let me into your heart!



Let me into your heart

Do you really love me?

I'm gon' get you, girl, ahhhh!



This is the end of us!

Sleeping with the moon and the stars!

I know where you've been, you can see the sun!



Let me into your heart!

Oh, this ain't no bullshit!

I really love you, girl!



Girl you really got a hold on me

So this isn't just puppy love

Girl you really got a hold on me

So this isn't just puppy love



I'm in love when we are smokin' that

Oh my God, I

Let me into

Girl you really got a hold, woo!"
4l5ioHe897vm5VZa242bvK,Have Some Love,4JCybsNZUXWrK2Jpyn12Ni,"""Awaken, My Love!""",73sIBHcqh3Z3NyqHKZ7FOL,Childish Gambino,224253,,2016,"Have a word for your brother
Have some time for one another
Really love one another
It's so hard to find
Have a word for your brother
Have some time for one another

Really love one another

It's so hard to find



You got the power, you got the power

Of every hour, of every hour

I come to getcha and I know where you are

I come to getcha and I know where you are

It's getting hot, it's like a sauna

Then every night, in Arizona

They come to getcha when they grope in your mind

They think you creepy, getting down in your mind

Come to getcha, come to getcha

It doesn't matter, you making magic

I got the business to make a mind

I got the business to make a mind

And if you feel it, if you feel in your toes

And you act nothing like nobody knows

But if you want it, you got to want it



Have a word for your brother

Have some time for one another

Really love one another

It's so hard to find

Have a word for your brother

Have some time for one another

Really love one another

It's so hard to find, have a word



Come on baby, oh

Darling no, no, no, no, no, no, no

That's right baby, that's right

I see wherever, wherever, wherever you are

(Wherever, wherever, wherever you are)

I see wherever, wherever, wherever you are

(Wherever, wherever, wherever you are)

Wherever, wherever, wherever you are

(Wherever, wherever, wherever you are)

Do no wrong now

That's right baby



There's a big wide world out there, I need to get in

We have got to bring this thing together

And I hope and I pray, we will find it someday

We have to got to really stay together, so



Have a word for your brother

Have some time for one another

Really love one another

It's so hard to find

Have a word for your brother

Have some time for one another

Really love one another

It's so hard to find"
1BO2XRaBKzRxdFTA9Uu4fP,Boogieman,4JCybsNZUXWrK2Jpyn12Ni,"""Awaken, My Love!""",73sIBHcqh3Z3NyqHKZ7FOL,Childish Gambino,216840,,2016,"With a gun in your hand, I'm the boogieman
I'm gonna come and get you
If you point a gun at my rising sun
Though we're not the one
But in the bounds of your mind

We have done the cry



Boogieman

You've got to help us, can you? Yes you can

Boogieman

You've got to help us, can you? Yes you can





With a gun in your hand, I'm the boogieman

I'm gonna come and get you



Every boy and girl all around the world

Knows my niggas' words

But if he's scared of me, how can we be free? Yes



Boogieman, yes

You've got to help us, can you? Yes you can, oh

Boogieman

You've got to help us, can you? Yes you can, oh"
6tyS9WO74s7Q1fvyNaiQxN,Zombies,4JCybsNZUXWrK2Jpyn12Ni,"""Awaken, My Love!""",73sIBHcqh3Z3NyqHKZ7FOL,Childish Gambino,281813,,2016,"All I see is zombies
Walking all around us
You can hear them coming (they come to take your life)
You can hear them breathing, breathing down your spine
All I see is zombies

Hear them screaming at her

They can smell your money

And they want your soul

Here they come behind you

Try to stay alive



We're coming out to get you

We're oh, so glad we met you

We're eating you for profit

There is no way to stop it



You will find there is no safe place to hide

(That's right, that's right)



All I see is zombies

Feeding all around us

All they eat are people (and you won't survive)

They don't know what happened

They just stay alive



We're coming out to get you

We're oh, so glad we met you

We're eating you for profit

There is no way to stop it



You will find there is no safe place to hide

(That's right, that's right)



We're coming out to get you

We're oh so glad we met you

We're eating you for profit

There is no way to stop it



Do you feel alive, yeah?

Do you feel alive, yeah?

Do-do-do-do-do

Do you feel alive?"
64HVhNulgXVUhlDh2wQPiW,Riot,4JCybsNZUXWrK2Jpyn12Ni,"""Awaken, My Love!""",73sIBHcqh3Z3NyqHKZ7FOL,Childish Gambino,125120,,2016,"I can feel it
Deep inside my body
I've been watching all this all night
I got to move it
This pressure brewing
This world don't feel alright



Everyone, everyone!

Get down, baby, get down, baby

Fly, fly, fly, high

Everyone, everyone!

Get down, baby, get down, baby

Fly, fly, fly, sun



No good fighting

World, we're out of captains

Everyone just wants a better life

They tried to kill us

Love to say they feel us

But they won't take my pride



Everyone, everyone!

Get down, baby, get down, baby

Fly, fly, fly, high

Everyone, everyone!

Get down, baby, get down, baby

Fly, fly, fly, sun

Everyone

Get down, baby

Fly, fly, fly, high

Everyone

Get down, baby

Fly, fly, fly, sun"
3vQ4T78TTMOjQXGfXVKQJo,Redbone,4JCybsNZUXWrK2Jpyn12Ni,"""Awaken, My Love!""",73sIBHcqh3Z3NyqHKZ7FOL,Childish Gambino,326933,,2016,"Daylight, I wake up feeling like you won't play right
I usually know but now, that shit don't feel right
It made me put away my pride
So long, you made a nigga wait for some, so long
You make it hoverboard like that, but no wrong
I'm wishing I could make this mine, oh



If you want it, yeah

You can have it, oh, oh, oh

If you need it, oooh

We can make it, oh

If you want it

You can have it



But stay woke

Niggas creepin'

They gon' find you

Gon' catch you sleepin'

Oooh, now stay woke

Niggas creepin'

Now don't you close your eyes



Too late

You wanna make it right, but now it's too late

My peanut butter chocolate cake with Kool-Aid

I'm trying not to waste my time



If you want it, oh

You can have it, you can have it

If you need it

You better believe in something

We can make it

If you want it

You can have it, aaaaah!



But stay woke

Niggas creepin'

They gon' find you

Gon' catch you sleepin'

Put your hands up on me

Now stay woke

Niggas creepin'

Now don't you close your eyes

But stay woke, ooooh

Niggas creepin'

They gon' find you

Gon' catch you sleepin'

Ooh, now stay woke

Niggas creepin'

Now don't you close your eyes



Baby get so scandalous, oh

How'd it get so scandalous?

Oh, oh

Baby you

How'd it get...

How'd it get so scandalous?

Ooh we get so scandalous

But stay woke

But stay woke"
4DIEa7hkjMrXZrFduR8Yhy,California,4JCybsNZUXWrK2Jpyn12Ni,"""Awaken, My Love!""",73sIBHcqh3Z3NyqHKZ7FOL,Childish Gambino,165266,,2016,"She want to move to California
She musta fucking lost her mind
She want to move to California
It's hard to get you every time
She make a movie with her friends

Put it up in a minute

Everybody say it now, ain't no loop at the minute

Everybody say how, how you do it, you did it?

I'ma show you what it done but, enough for a finish

Pay attention, you listen

You keep losing your mind

How you want to loop this shit but looking like a Vine?



But they don't pay for no privilege

Now she broke in Koreatown

In the condo you rented

But they get your percentage



In California, ooh

She musta fucking lost her mind, yeah

He want to move to California

He want to hang with DC Fly



All the people on the roam and the follower people

Like I'm watching a ""ha ha"", make a girlfriend giggle

Let's make official official, make a Serena Vista

Supernova, new residual, making money a little

Make the smoker illegal

Make the living illegal

Make the laughing illegal

Make it snap for a people

When you make a movie now

Know you making no difference

It's a tickle on the mind before me finish the sentence

Couple people on the Vine but don't pay for the privilege



Now you broke in Koreatown, in the condo you rented

But they get your percentage

Oh you broke in Koreatown in that condo you rented

But they get your percentage



In California

She musta fucking lost her mind, yeah

He want to move to California

He want to hang with DC Fly"
1YtL1zAWrSxpZUOqfmPbc5,Terrified,4JCybsNZUXWrK2Jpyn12Ni,"""Awaken, My Love!""",73sIBHcqh3Z3NyqHKZ7FOL,Childish Gambino,255466,,2016,"There's a bottom to the top of the moment
You won't always be around
Catch a nigga coming quickly behind ya
People want you underground
Do you misbehave?
Haunt you to your grave

I'm going to eat you alive

Please don't find me rude

But I don't eat fast food

So don't run to me, baby

Uh, are not



Just, high, oh!

You know that you're the one that's terrified, oh!

Just, high, oh!

You know that you're the one that's terrified, oh!



La, la, la, la, la

La, la, la, la, la



I'm spinning, I'm spinning, I'm spinning you up

I'm spinning, I'm spinning, I'm spinning you up

I'm spinning, I'm spinning, I'm spinning you up

I'm spinning, I'm spinning, I'm spinning you up

I'm spinning, I'm spinning, I'm spinning you up

I'm spinning, I'm spinning, I'm spinning you up

I'm spinning, I'm spinning, I'm spinning you up

I'm spinning, I'm spinning, I'm spinning you up

I'm spinning, I'm spinning, I'm spinning you up



Just, high, oh!

You know that you're the one that's terrified, oh!

Just, high, oh!

You know that you're the one that's terrified, oh!



No, no, no, no, no, no, no

Please

Oh! oh!

No, no, no, oh

Oh you can't run from me

You can't hide from me"
3icv5yfawQSwRPwVvBdHas,Baby Boy,4JCybsNZUXWrK2Jpyn12Ni,"""Awaken, My Love!""",73sIBHcqh3Z3NyqHKZ7FOL,Childish Gambino,382093,,2016,"Little hands, little feet
Tiny heart, tiny beat
Oh, thinkin' about the time we spent falling in love (in love)
I don't wanna leave you
I don't want him to see you
But oh, when mama cries and daddy's lies

Oh my, please don't take him away, no, no, no

Don't take him away



Oh, cause I had my doubts, oh!

Don't take my baby boy

Don't take my pride and joy

I hope I stay close

I hope I stay close



All the pain, all the tears

Many nights, many years

This love for me is fading

You waited, but I never came home to you

I've never lied about us

We were never supposed to be together

When you see me with some other one and they know your son

Oh, please don't take him away

You said you're wrong but you knew



Oh, cause I had my doubts, oh!

Don't take my baby boy

Don't take my pride and joy

I hope I stay close

I hope I stay close



There was a time before you, and there will be a time after you

With these vibes or not

Walk tall little one

Walk tall, walk tall

Let me hold you

Let me hold you"
2EBhNNIqdbejkNqqOnok4c,The Night Me and Your Mama Met,4JCybsNZUXWrK2Jpyn12Ni,"""Awaken, My Love!""",73sIBHcqh3Z3NyqHKZ7FOL,Childish Gambino,214080,,2016,[Instrumental + Harmonization]
0LZguZAhdvKzUC9Qlt67EM,Stand Tall,4JCybsNZUXWrK2Jpyn12Ni,"""Awaken, My Love!""",73sIBHcqh3Z3NyqHKZ7FOL,Childish Gambino,370773,,2016,"When the sun is rising over streets so barren
Since the evening, colors flash before my eyes
I feel like a child, so young and new in '92, I listen
To what my father said
Keep all your dreams, keep standing tall

If you are strong you cannot fall

There is a voice inside us all

So smile when you can

When you can



How this used how this used to feel and free

Now these broken souls are alI I see

Fists have fallen to our side

We may cry alone, I feel we know where all of this is headed

But my mama said



Keep all your dreams, keep standing tall (oh I, nah, nah, nah)

If you are strong you cannot fall (if you are strong)

There is a voice inside us all

So smile when you can

When you can





If you cannot, oh!

There is more to you and me

There is more than they can see

I'm on your side

Woo! oh!

There is more out there

And somebody cares 'bout you

I do



Keep on your dreams, keep standing tall

If you are strong you cannot fall

Keep on your dreams, keep on standing tall

If you are strong you cannot fall

Keep on your dreams, keep on standing tall

If you are strong you cannot fall

Keep on your dreams, keep on standing tall

If you are strong you cannot fall

There is more out there

Keep on your dreams, keep on standing tall

If you are strong you cannot fall



Oh!

Good morning

When you're gone to yourself

Oh! Oh!

Woo!

Yeah!

(Keep on your dreams, keep standing tall

If you are strong you cannot fall)

Oh!

Oh!

(Keep on your dreams, keep standing tall

If you are strong you cannot fall

Thanks for doing that)

Oh!

Oh!"
2VrkwoZrSpGG9I865zqZQi,Sober,7DtpLngwHYD5j0lZlMFuwU,Kauai,73sIBHcqh3Z3NyqHKZ7FOL,Childish Gambino,252013,,2014,"And now that's it's over, I'll never be sober
I couldn't believe, but now I'm so high
And now that's it's over, I'll never be sober
I couldn't believe, but now I'm so high
Now I'm so high
Now I'm so high

Now I'm so high



Girl, what's your problem

Cause I know it's hard sometimes, baby just give it some time

Oh honey now girl, we can solve them

If you just give me some time I can open up your mind

If you le-le-let it shine, you can free-ee-ee your mind

Cause I know



And now that's it's over, I'll never be sober

I couldn't believe, but now I'm so high

And now that's it's over, I'll never be sober

I couldn't believe, but now I'm so high

Now I'm so high

Now I'm so high

Now I'm so high



Girl, if it's done right

Well you know it's got to be, something wonderful to me

Oh honey now girl, give it one night

If you just give it a chance, loving you is not my plan

Cause I know one day you'll see

All the things that we can be



And now that's it's over, I'll never be sober

(I want to be the only one)

I couldn't believe, but now I'm so high

And now that's it's over, I'll never be sober

I couldn't believe, but now I'm so high

But now I'm so



And now that's it's over, I'll never be sober

I couldn't believe, but now I'm so high

Now I'm so high

Now I'm so high

Now I'm so high"
4BaZDllfIcJM62yjQyHcOE,Pop Thieves (Make It Feel Good),7DtpLngwHYD5j0lZlMFuwU,Kauai,73sIBHcqh3Z3NyqHKZ7FOL,"Childish Gambino, Jaden Smith",309480,,2014,"Now that we have found this love, baby
I can't explain my feel, oh
Now that we have found this love, baby
I've never felt this real, oh
Loving you is all I know, baby
You make me feel so high, oh no

I just wanna feel your love, baby

You know I'm down to ride, oh no no



When your song is on and your hand's in mine

And I'm holding you tight, make it feel good

Let me hold it down, I'm so glad we found

It's whatever you like, make it feel good



Make it feel good, make it feel good, alright

Make it feel good, make it feel good

Make it feel good, make it feel good, alright

Make it feel good, make it feel good



Now that we have found this love, baby

These haters can't say shit, oh

I know sometimes it's hard when I'm so far

I know you miss this di-love

Let's go somewhere far away, baby

Where we don't need no phone, oh

Cause now that we have found this love, baby

You'll never feel alone, oh oh



When your song is on and your hand's in mine

And I'm holding you tight, make it feel good

Let me hold it down, I'm so glad we found

It's whatever you like, make it feel good



Make it feel good, make it feel good, alright

Make it feel good, make it feel good

Make it feel good, make it feel good, alright

Make it feel good, make it feel good



All my friends are telling me, oh

You need to slow it down, yeah

But I'm so tired of wasting all this time

I need your love right now

Give it to me right now, oh yeah

All that I want now, oh yeah, yeah, yeah

All that I want now, oh yeah, yeah, yeah

All that I want now, yeah

Oh, give it to me now

Give it to me now, oh

Oh yeah, give it to me right



Make you feel good, make you feel good, alright

Make you feel good, make you feel good

Make you feel good, make you feel good, alright

Make you feel good, make you feel good



I used to walk on the beach at night. I remember.

The best time was when, well, me and you, we got all our friends and we got a tent.

We slept in it. Not the whole night, but just enough time.

Magic happened, nothing was born luckily. It's up to me, but then we left.

The times have changed. The pleasures that I feel.

They say you never say never, it's real.

Electric eels in the water, we should probably not go deep.

I like to stare at you and look at you when you sleep. 

'd like to write a poem for you, leave it for you in your room.

Under the moon, romance. Hold on, brother"
40DNN6CjgNEouHH0RsygcZ,Retro (Rough),7DtpLngwHYD5j0lZlMFuwU,Kauai,73sIBHcqh3Z3NyqHKZ7FOL,Childish Gambino,202666,,2014,
17LwoPsrxQwzjlk9wiYhYL,The Palisades,7DtpLngwHYD5j0lZlMFuwU,Kauai,73sIBHcqh3Z3NyqHKZ7FOL,"Childish Gambino, Christian Rich",190906,,2014,"Oh no no, yeah
I know the secret we share
Look what this feeling has done to me
There's something deep in the air
Just hope your hands lift me comfortably


I don't know why but every time I see you smiling

I'm tired of running tired of playing tired of hiding

If we could be together would that make you happy?

And If it would, tell your girlfriend to get at me

(I'm just playing tho)



Love 

don't really happen

Love

don't really happen



I think there's something for us

Lying around as the world comes down

If you understand what I'm saying

You won't end up in the lost and found, nope



I don't know why but every time I see you dancing

(I see you dancing)

I'm tired of running tired of playing late romancing

( I don't want to)

If we could be together would that make you happy?

(I don't fuck with that)

And If it would, tell your girlfriend to get at me



Love don't really happen

Love don't really happen

Love don't really happen

Love don't really happen



Now why can't everyday be like this

Smoke a J at the beach like this

Hang with bae at the beach like this

Conversations with Kish like this

Never thought it could be like this

Be the man like I am like this

Dance around shake your hips like this

Mess around make a hit like this



Like this, like this, no

Always be like this, no

Like this

Like this

Like this, no

Always be like this, no

Like this

Always be like this

Like this

Like this

Like this"
4cdLxUB6dSRNuNulB5qO8S,Poke,7DtpLngwHYD5j0lZlMFuwU,Kauai,73sIBHcqh3Z3NyqHKZ7FOL,"Childish Gambino, Steve Glover",216093,,2014,"I just wanna roll with a cutie one
I ain't tryna catch no feels
We can get along sometimes
We ain't gotta be sincere
You ain't gotta laugh so small
Breathing all down my back

They ain't never had what we had

They ain't never felt like that

Cause them summer days

Never fade away

They just stay the same

In my mind, my mind

And them summer days

Never fade away

They just stay the same

In my mind, no no



It's those summer days

Never fade away

It just stays the same

In my mind, no no

It's those summer days

Never fade away

Never fear the change

In my mind, no no



Ok, Royalty is red hot

Shots from a redbone

Talking bout her skin tone her color beats headphones

Baby I'm just living right, and you can say I'm dead wrong

But can you disagree with that , versace on me yeah

Gold on the V-neck I'm passing every G check

Didn't fuck her for a month and never had a regret

It was just nice to have you chilling up in Key West

And we was just chill, I didn't really need sex

But really is we fucking yo

Never serious so I make everything a fucking joke

She be pushing buttons and she push it till that button broke

Then we smoke a blunt and all the drama it go up in smoke

See she just graduated got a new job

Took that nose ring out her nose and went and bought a new Saab

Got that boyfriend that she living with and don't smoke no more

But yo it's cool I liked her when I knew her back before like



It's those summer days

Never fade away

It just stays the same

In my mind, no no

It's those summer days

Never fade away

Never fear the change

In my mind, no no"
