track_id,track_name,album_id,album_name,artist_id,artist_name,duration_ms,preview_url,release_year,lyrics
6WgxXdBZrtdQFGBcxQxpiv,The Message,7q2B4M5EiBkqrlsNW8lB7N,2001,6DPYiyq5kWVQS4RGwxzPC7,"Dr. Dre, Mary J. Blige, Rell",304026,,1999,"[Dr. Dre]
This one is for my brother, Tyree, R.I.P.
.. {*Mary J. Blige sings in the background*} ..
A message to God
.. {*Mary J. Blige sings in the background*} ..

[Dr. Dre]

Since you finishin em early, what posessed you to start him?

We made a vow - later we'll regret til death do us part

Lord, I thought we was made for each other

You shouldn't connect those, made to be taken away from each other

Now what I'm supposed to do? I'm only half the man that I was

I'll never last, cause my better half is up there with you

You knew what you was doin when you made us; so with all due respect

you coulda forgave him, you didn't have to take him

He can take the game with him, cause he defines the word

The one who puts the G in it, who you think put me in it?

I'm feelin like my whole world is blinded - wonderin why

Cryin, pourin out my heart, pourin out liquor behind it

We fought like brothers, somethin we never should do

We coulda used time spent arguin tellin the truth

He had talent too - I had plans on watchin him grow

Don't know what hurts more - seein him leave, or watchin him go



[Mary J. Blige]

Listen listen listen.. (listen) whoahh (listen)

Listen listen listen.. (better listen) whoahh-oahhh-oahhh

Listen listen listen.. {*harmonizing*}

Listen.. mmm-mmm-mmm



[Rell] + {Mary}

If you wanna know why.. {why I live my life}

The way that I do.. {cause I got to get this money}

So don't worry about me.. {cause I know my way around}

I'm just hustlin everyday, runnin this race, makin this paper



[Dr. Dre]

Youse a soldier, you're probably packin heat up there

Met up with homies from the street, and got deep up there

If you only knew the way I felt before they ruined the crew

I thought I learned from Eazy, now I'm goin through it with you

We lost a thug, a son, and a father

I spoke to your son, the other day, and told him Uncle Dre got him

The Lord must be accidentally pulling your file

cause I'm still paging you, 911, straight in denial

Prayin you get it, but no man can choose the card he was dealt

You either quit, or you gon' play it like you get it

I done been through all emotions, from in shock, to keepin a poker face

to straight breakin down and showin all emotions

I'm anxious to believe in real G's don't cry

If that's the truth, then I'm realizin I ain't no gangsta

It's just not me, but you know I'ma always ride wit you

I miss you, sometimes I wish I just died wit you



[Mary J. Blige]

Listen listen listen.. (listen) whoahh (listen)

Listen listen listen.. whoahh-oahhh-oahhh

Listen listen listen.. {*harmonizing*}

Listen.. eyy-eyy-eyy-yeah-yeahh



[Rell] + {Mary}

If you wanna know why.. {why I live my life}

The way that I do.. {cause I got to get this money}

So don't worry about me.. {don't worry, don't worry worry}

I'm just hustlin everyday, runnin this race, makin this paper



[Mary J. Blige]

yeah, yeah, ahhh-oooh-oahahahhhhh.. listen..

mmmmmmmmmhmhmhmmmmmm..

if you don't know why I.. you gotta listen up right now

lis-ten, lis-ten, lis-ten, lis-ten..

oooooooooh... oahahoooohhh ooooha ohhhhh

lis-ten, lis-ten

ahhhowooooo yeah yeah yeah yeah yeah, yeah yeah yeah

yeah-ehh-yeah, yeah-ooeooooh

yahhooooohahhooooh listen

lis-ten, children lis-ten

I'm tryin to tell you somethin good

Don't get caught up in the hood

Yeahhh-hah, yeahhh-hah, aooooooh

if you don't know why..

you gotta find out the reason why..

brother.. brother.."
4rmK0BSBLMiwNJ6iwWXJm1,Outro,7q2B4M5EiBkqrlsNW8lB7N,2001,6DPYiyq5kWVQS4RGwxzPC7,Thomas Chong,25746,,1999,
0LskV3ejYLWa6Ew2d4tcf4,The Chronic (Intro),2V5rhszUpCudPcb01zevOt,The Chronic,6DPYiyq5kWVQS4RGwxzPC7,"Dr. Dre, Snoop Dogg",117093,,1992,"This is dedicated ta da niggaz dat been down from day one
Welcome to Death Row
Like we always do about this time
Ha ha ha yeah
9-2's
Death Row Records

Creepin' while ya sleepin'

Niggaz wit attitudes

Naw low

Niggaz on a muthafickin' mission

What up niggaz and niggetz

That crazy-ass nigga'z back

In da muthafuckin' hizzales

The notorious Comptin G

D.R.E.

Here's a solo tip

Fuck da muthafoes

What up Dre

Yeuh

Drop da cronic plates on yo ass be-ach

Westcoast flavor

Niggaz dat talk shit

Get delt wit real quick

So if you wanna take a trip to da row

Let a nigga like Snoop Doggy Dogg know

Protected by niggaz wit big dicks, A.K.'s, and 187 skills

So if it's mushy testers

We can handle it in da streets nigga

Fuck makin' records

Yeah

G's up hoes down

If dat bitch can't swim

She bound da drizzound

Peace to my nigga Drizzae

Another platinum hit nigga

Peace to da D.O.C.

Still make it funky enough

And Death Row records is in full muthafuckin' afizzel

Oh Yeah

P.S. Fuck Mr. Warkentatoo

A.K.A. Jerry and Easy

Sincirly yours

Deez muthafuckin' millhouse

I don't love Easy

I don't love Jerry

I don't love niggaz records

Frankly I don't love Dogg and Dr. Dizzle

But you know what I whant you da do for me

Very easy

Check this shit out right here

I want y'all ta put deez brizzoes

In ya jizzoes

And walk um like a strizzoe

Tell me what ya sizzoe

Yeah

Y'all know what

Fuck all y'all

Fuuck y'all

And Dr.

He's Death Row nigga

You better ask somebody

You really better ask somebody

Yeah nigga

You'ze a penguin lookin' muthafucka!





(Thanks to Thevil for these lyrics)"
21NA5Zggba7pyACm25h6k4,Fuck Wit Dre Day (And Everybody's Celebratin'),2V5rhszUpCudPcb01zevOt,The Chronic,6DPYiyq5kWVQS4RGwxzPC7,"Dr. Dre, Snoop Dogg, RBX, Jewell",291053,,1992,"Yeah, hell yeah, knowhatI'msayin, yeah
[Verse One: Dr. Dre]
Mista Busta, where the fuck ya at?
Can't scrap a lick, so I know ya got your gat
Your dick on hard, from fuckin your road dogs

The hood you threw up with, niggaz you grew up with

Don't even respect your ass

That's why it's time for the doctor, to check your ass, nigga

Used to be my homey, used to be my ace

Now I wanna slap the taste out yo mouth

Make you bow down to the row

Fuckin me, now I'm fuckin you, little ho

Oh, don't think I forgot, let you slide

Let me ride, just another homicide

Yeah it's me so I'ma talk on

Stompin on the 'Eazy'est streets that you can walk on

So strap on your Compton hat, your locs

And watch your back cause you might get smoked, loc

And pass the bud, and stay low-key

B.G. cause you lost all your homey's love

Now call it what you want to

You fucked wit me, now it's a must that I fuck wit you



[Break One: Dre]

Yeah, that's what the fuck I'm talkin about

We have your motherfuckin record company surrounded

Put down the candy and let the little boy go

You knowhatI'msayin, punk motherfucker

(**We want Eazy, we want Eazy**)



[Verse Two: Snoop Doggy Dogg]

Bow wow wow yippy yo yippy yay

Doggy Dogg's in the motherfuckin house

Bow wow wow yippy yo yippy yay

Death Row's in the motherfuckin house

Bow wow wow yippy yo yippy yay

The sounds of a dog brings me to another day

Play, with my bone would ya Timmy

It seems like you're good for makin jokes about your jimmy

But here's a jimmy joke about your mama that you might not like

I heard she was the 'Frisco dyke

But fuck your mama, I'm talkin about you and me

Toe to toe, Tim M-U-T

Your bark was loud, but your bite wasn't vicious

And them rhymes you were kickin were quite bootylicious

You get with Doggy Dogg oh is he crazy?

With ya mama and your daddy hollin' Bay-Bee

So won't they let you know

That if you fuck with Dre nigga you're fuckin wit Death Row

And I ain't even slangin them thangs

I'm hollin' one-eight-seven with my dick in yo mouth, beotch



[Break Two]

Yeah nigga, Compton and Long Beach together on this motherfucker

So you wanna pop that shit get yo motherfuckin crranium cracked nigga

Step on up. Now, we ain't no motherfuckin joke so remember the name

Mighty, mighty D-R. Yeahhh, MOTHERFUCKER!



[Verse Three: Dre and Snoop]

Now understand this my nigga Dre can't be touched

Luke's bendin over, so Luke's gettin fucked, busta

Musta, thought I was sleazy

Or though I was a mark cause I used to hang with Eazy

Animosity, made ya speak but ya spoke

Ay yo Dre, whattup, check this nigga off loc

If it ain't another ho that I gots ta fuck with

Gap teeth in ya mouth so my dick's gots to fit

With my nuts on ya tonsils

While ya onstage rappin at your wack-ass concerts

And I'ma snatch your ass from the backside

To show you how Death Row pull off that whoride

Now you might not understand me

Cause I'ma rob you in Compton and blast you in Miami

Then we gon creep to South Central

On a Street Knowledge mission, as I steps in the temple

Spot him, got him, as I pulls out my strap

Got my chrome to the side of his White Sox hat

You tryin to check my homey, you better check yo self

Cause when you diss Dre you diss yourself, MOTHERFUCKER



[Outro]

Yeah, nine-deuce

Dr. Dre, dropin chronic once again

It don't stop, Punishing punk motherfuckers real quick like

Doggy Dogg in the motherfuckin house

Long Beach in the motherfuckin house

Compton style nigga, straight up, really doe

Breakin all you suckaz off somethin real proper like

YouknowhatI'msayin?

All these sucka ass niggaz can eat a fat dick

Yeah, Eazy-E Eazy-E Eazy-E can eat a big fat dick

Tim Dog can eat a big fat dick

Luke, can eat a fat dick

Yeah"
36yUCSB9OaMz0RMUQDOSpT,Let Me Ride,2V5rhszUpCudPcb01zevOt,The Chronic,6DPYiyq5kWVQS4RGwxzPC7,"Dr. Dre, Snoop Dogg, RBX, Jewell",260333,,1992,"Verse One
Creepin' down the back street on Deez
I got my glock cocked cuz niggaz want these
Now soon as I said it, seems I got sweated
By some nigga with a tech 9 tryin' to take mine

ya wanna make noise, make noise

I make a phone call my niggaz comin' like the Gotti boys

bodies bein' found on Greenleaf

with their fuckin heads cut off, motherfucker i'm Dre

so listen to the play-by-play, day-by-day

rollin' in my '4 with 16 switches

And got sounds for the bitches, clockin' all the riches

Got the hollow points for the snitches

So would you just walk on by, cuz I'm too hard to lift

and no this ain't Aerosmith

It's the motherfuckin D-R-E, from the CPT

on a ryhmin' spree, a straight G

Hop back as i pop my top ya trip

I let the hollow points commence to POP POP POP

yeah, cuz if it don't stop

I have to put my shit in reverse go back and take anothers stop

Cause I'm (Rollin in my six-fo')

with all the niggaz sayin



Chorus:



Swing down, sweet chariot stop and, let me ride

hell yeah

Swing down, sweet chariot stop and, let me ride

with all the niggaz sayin

Swing down, sweet chariot stop and, let me ride

Hell yeah

Swing down, sweet chariot stop and, let me ride



Verse Two



just another motherfuckin day for Dre so I begin like this

No medallions, dreadlocks, or black fists it's just

that gangster glare, with gangster raps

that gangster shit, that makes the gang of snaps, uhh

word to the motherfuckin streets

and word to these hyped ass lyrics and dope beats, that I

hit ya with that I, get ya with

as I groove in my four on deez, hittin the switches

bitches relax while I get my proper swerve on

bumpin like a motherfucker ready to get my serve on

but before I hit the dope spot

I gotta get the chronic, the Reme Martin and my soda pop

Now I'm smellin like indo-nesia

bus stop full of fly bitches and skeezers

on my dick, cause my four on hit

pancake front and back, side to side and all that shit

So when I crawl I comes correct

Now, if your bitch in my shit, it's your bitch you check nigga

Now let the Chevrolet slide

As I dip a nigga trip to the south side, yeah

(Rollin in my six-fo') with all the bitches sayin



Chorus



Verse Three



Check this out

The sun went down when I hit Slausson

on my way to the strip, now I'm just flossin

Checkin my rearview, cause niggaz they will do

jack moves, black fools cause I smack fools

Try to set me up for a two-eleven

Fuck around and get caught up in a one-eight-seven

but I don't represent no gangbang

Some niggaz like lynchin but I just watch them hang

so on, and so-on, why don't you let me roll on

I remember back in the dayz when I used to have to get my stroll on

Didn't nobody wanna speak; now everybody

peepin out they windows when they hear me beatin up the streets

Is it Dre? Is it Dre?

That's what they say, every single motherfuckin day, yo

But I ain't trippin I'm just kickin it

While my deez keep spinnin and these hoes keep grinnin I'll be

(Rollin in my six-fo') With everybody sayin



Chorus: to end"
4hk5l9HA43xFO0fFOh2hTt,The Day The Niggaz Took Over,2V5rhszUpCudPcb01zevOt,The Chronic,6DPYiyq5kWVQS4RGwxzPC7,"Dr. Dre, Daz, Snoop Dogg, RBX",273066,,1992,"(I'ma say this and I'ma end mine
If you ain't down, for the Africans here
in the United States, period point blank..
If you ain't down for the ones that suffered in South Africa 
from apartheid and shit
Devil you need to step your punk ass to the side

and let us brothers, and us Africans, step in

and start puttin some FOOT, in that ass!!)



""Break 'em off somethin"" (repeat 8X)



Chorus: Snoop Doggy Dogg (repeat 2X)



I got my finger on the trigger so niggaz wonder why

But livin in the city it's do-or-die



[Daz]

Dem wonder why me violent and no really understand

For de reason why me take me law, in me own, hand

Me not out for peace and me not Rodney King

De gun goes - click, me gun goes - bang

Dem riot in Compton and dem riot in Long Beach

Dem riot in L.A. cause dem no really wanna see

niggaz start to loot and police start to shoot

Lock us down at seven o'clock, barricades us like Beirut

Me don't show no love cause it's us against dem

Dem never ever love me cause it's sport to break dem

and kill, at my own risk, if I may

to lay, to spray, with my AK, and put it to rest



Interlude: (*female reporter*)



(Yes we have

There have been riots, ahh uh, rioting

Well I don't wanna say rioting 

but there's been looting downtown

But right now Bree, what I want to show you is

they have started fires down at the end of the street)



[All]How many niggaz are ready to loot?

[Snoop] Yeah, so what you wanna do?

[Dre] What you wanna do?

[All] I said how many niggaz are ready to loot?



""Got myself a Uzi and my brother a 9"" --> KRS-One



(That's what they told us today

In other words, you still a slave

No matter how much money you got, you still ain't shit)



[Dr. Dre]

Sittin in my living room, calm and collected 

Feelin that gotta-get-mine perspective

cause what I just heard, broke me in half

and half the niggaz I know, plus the niggaz on the Row is bailin

Laugh now but cry much later

Ya see when niggaz get together 

they get mad cause they can't fade us

Like my niggaz from South Central, Los Angeles

They found that they couldn't handle us

Bloods, Crips on the same squad

with the Ese's help and nigga it's time to rob and mob

(And break the white man off somthin lovely, biddy-bye-bye

I don't love dem so dem can't love me)

Yo, straight puttin it down gettin my scoot on

It's jump in off in Compton so I gots to get my loot on

and come up on me some furniture or somethin

Got a VCR, in the back of my car

that I ganked from the Slausson Swap Meet

And motherfuckers better not try to stop me

Cause they will see that I can't be stopped

cause I'ma cock my Glock and pop til they all drop



Interlude: (*female reporter, then male reporter*)



(Yes on the videotape we seem to have the

ahh, people in the crowd throwing things at the officers)



(And swinging at them as well, as a result

A young woman there, you see took a swing

at at an officer with some object in her hand)



[All]How many niggaz are ready to move?

[Snoop] Yeah, so what you wanna do?

[Dre] What you wanna do?

[All] I said how many niggaz are ready to move?



""Got myself a Uzi and my brother a 9"" --> KRS-One



Chorus



[RBX]

One-Time trigger happy, no nigga love

One-eighty-seven time, time to grab the glove

Can't get prints on a nine I throw away

or get prints on my Uzi when it spray

POP POP, POP, another motherfucker drop

And I get relief like, ""plop plop fizz""

Smash, I crashed his head like a window

I ain't Nintendo, I'm high off the indo

Creepin, with the quickness, to the cut

Bust, one to his head, while he munches on a donut

and crack-up, so now he best to back up

I guess I gots to pack up, filling, the clip up

I zip up-town, but motherfuckin cops are all around

Helicopters flyin, these motherfuckers tryin

to catch me and stretch me on Death Row

But hell no, suppose black refuse to go??



Interlude: (*male reporter*)



(This is now coverin a very, very wide area of Los Angeles

where these fires have been, aah, ignited

I mean, from here to the, aah

to the South end of South Central is a long way



""Break 'em off somethin"" (repeat 8X)



[Daz]

The outcome of this is destruction, so them all fall

Niggaz don't give a fuck, so them bust and them fall

The, description of three blacks

shows no justice, so, pick up it's your right

If you riot again, me, turn the other cheek

We, be too many, me got, me nine to my side

So me bust, flick, cause he don't give a fuck

and me don't give a fuck

And all my problems end with that BUCK BUCK



[Snoop Doogy Dogg]

Blak blam, blam til dem fall

Listen to the shots from my nigga Doggy Dogg, biddy-bye

Dr. Dre, him bust gun shots

Diggity Daz and RBX, dem bust gun shots

Come again!"
5Tbpp3OLLClPJF8t1DmrFD,"Nuthin' But A ""G"" Thang",2V5rhszUpCudPcb01zevOt,The Chronic,6DPYiyq5kWVQS4RGwxzPC7,"Dr. Dre, Snoop Dogg",237573,,1992,"[Snoop Doggy Dogg]
One, two, three and to the fo'
Snoop Doggy Dogg and Dr. Dre is at the do'
Ready to make an entrance, so back on up
(cause you know we're bout to rip shit up)
Gimme the microphone first, so I can bust like a bubble

Compton and Long Beach together, now you know you in trouble

Ain't nuttin but a G thang, baaaaabay!

Two loc'ed out niggaz so we're craaaaazay!

Death Row is the label that paaaaays me!

Unfadeable, so please don't try to fade this (Hell yeah!)

But uhh, back to the lecture at hand

Perfection is perfected, so I'ma let em understand

from a young G's perspective

And before me dig out a bitch I have to find a contraceptive

You never know she could be earnin her man

and learnin her man -- and at the same time burnin her man

Now you know I ain't with that shit, Lieutenant

Ain't no pussy good enough to get burnt while I'm up in it

(YEAH!) And that's realer than Real-Deal Holyfield

And now you hookers and hoes know how I feel

Well if it's good enough to get broke off a proper chunk

I'll take a small piece of some of that funky stuff



[Dr. Dre and Snoop]

It's like this and like that and like this and uh

It's like that and like this and like that and uh

It's like this and like that and like this and uh

[S]Dre, creep to the mic like a phantom



[Dr. Dre]

Well I'm peepin, and I'm creepin, and I'm creep-in

But I damn near got caught, cause my beeper kept beepin

Now it's time for me to make my impression felt

So sit back, relax, and strap on your seatbelt

You never been on a ride like this befo'

with a producer who can rap and control the maestro

At the same time with the dope rhyme that I kick

You know, and I know, I flow some ol funky shit

to add to my collection, the selection

symbolizes dope, take a toke, but don't choke

If you do, you'll have no clue

on what me and my homey Snoop Dogg came to do



[Dr. Dre and Snoop]

It's like this and like that and like this and uh

It's like that and like this and like that and uh

It's like this

[D]And who gives a fuck about those?

[S]So just chill, til the next episode



{*funky sample break*}



[Snoop Doggy Dogg]

Fallin back on that ass, with a hellafied gangsta lean

Gettin funky on the mic like a old batch of collard greens

It's the capital S, oh yes I'm fresh, N double-O P

D O double-G Y, D O double-G, ya see

Showin much flex when it's time to wreck a mic

Pimpin hoes and clockin a grip like my name was Dolomite

Yeah, and it don't quit

I think they in the mood for some motherfuckin G shit

(Hell yeah!) So Dre (Whattup Dogg?)

Gotta give em what they want (What's that, G?)

We gotta break em off somethin (Hell yeah!)

And it's gotta be bumpin (City of Compton!)



[Dr. Dre]

It's where it takes place so when asked, yo' attention

Mobbin like a muh'fucker, but I ain't lynchin

Droppin the funky shit that's makin the sucka niggaz mumble

When I'm on the mic, it's like a cookie, they all crumble

Try to get close, and your ass'll get smacked

My motherfuckin homie Doggy Dogg has got my back

Never let me slip, cause if I slip, then I'm slippin

But if I got my Nina, then you know I'm straight trippin

And I'ma continue to put the rap down, put the mack down

And if you bitches talk shit, I'll have to put the smack down

Yeah, and you don't stop

I told you I'm just like a clock when I tick and I tock

But I'm never off, always on, to the break of dawn

C-O-M-P-T-O-N, and the city they call Long Beach

Puttin the shit together

Like my nigga D.O.C., ""No One Can Do it Better""



[Dr. Dre and Snoop]

Like this, that and this and uh

It's like that and like this and like that and uh

It's like this

[D]And who gives a fuck about those?

[S]So just chill, til the next episode



{*funky sample break*} -> repeat 3X"
1SZqIkhIYVM4H2gDUfOqtk,Deeez Nuuuts,2V5rhszUpCudPcb01zevOt,The Chronic,6DPYiyq5kWVQS4RGwxzPC7,"Dr. Dre, Warren G, Snoop Dogg, Daz, Nate Dogg",306653,,1992,"{*dial tone, then numbers being dialed*}
[Warren G]
Let me call this old bitch, see what this bitch doin
{*mumbling*} Call this bitch, raggedy-ass, shit man

[Some Gal] Hello?

[Warren G] Whassup?!

[Some Gal] Nothin, whatchu doin?

[Warren G] Nuttin, just kickin it

[Some Gal] Are y'all done?

[Warren G] Nah, whatchu gon' do today?

[Some Gal] Umm.. pick up my stuff from the cleaners

[Some Gal] Might go get my nails done

[Warren G] Seriously

[Some Gal] Why whassup?

[Warren G] Ay did did did whats-a-name done get at you yesterday?

[Some Gal] Who?

[Warren G] {*singing*} Deeez nuuuts!

[Some Gal] Aw shut up nigga!



[comedy skit]

""I wanna ask you one question

If I had some nuts, hangin on the walls, what did I have honey?""

I said, ""Darling you'd have some walnuts.""

She said, ""Well.. daddy if I had some nuts

on my chest, would those be chestnuts?""

I said, ""Hell yes!""

She said, ""Well daddy if I had nuts under my chin

would those be chin-nuts?""

I said, ""Hell no bitch you'd have a dick in your mouth!"" {*echoes*}



Chiggie check

[Andre] Microphone, check one

Chiggie check

[Andre] Microphone, check two

Chiggie check

[Andre] Microphone, check three

[Snoop] Check game from the no-torious Compton G



[Dr. Dre]

Back with some shit that gots to bump 

As you pull up in the park you pops the trunk

Just to floss it like a motherfuker, clownin an' shit

Got the Dana's on your hooptie and your fly-ass bitch

Throw off, go off, show off, I take that hoe

If she proper, I'ma pop her, the hole hopper

It's back on the track

With big money, big nuts, and a big fat chronic sack



[Snoop]

So Daz, step up on they ass

And give these motherfuckers a blast from the past



[Daz]

Diggidy Daz out of the cut with some shit that I wrote

With my nigga D-R-E, so you know I must be dope

But uh, rat-tat-tat-tat that ass

Startin static with Dre, make way for the AK

that I bring as I slang like cavi

Not from Kris Kross but they call me Mac Daddy

Had he, not known about the city I'm from

Long Beach, tic tac, grab your gat, watch your back

Here I come, stompin in my kahki suit

B.G. from the hood, kinfolk Eastwood

God damn, I ripped up, flipped up, and skipped up

on top of things as they swing towards my ding-a-ling



[Snoop]

But could you raise up off his nuts?

Cause Dr. Drizze's about to rizzip shit up



Chiggie check

[Andre] Microphone, check one

Chiggie check

[Andre] Microphone, check two

Chiggie check

[Andre] Microphone, check three

[Snoop] You're tuned to the sounds of the D-R-E



[Dr. Dre]

Now check me out, it's back to the old school

Where the niggaz get they strap on, don't nobody cap on

Slap on some D-R-E

Or some funky ass shit by the D-O-double-G-Y D-O-double-G

Real G's who drop ki's

Protect these, N-U-T's, so nigga please

Peep out my manuscript

You'll see that it's a must I drop gangsta shit (BE-OTCH!)

So recognize game from the gangsta

Thangs will remain the same until I change 'em



[Snoop]

It's real easy to see

So you can check sounds from Nate D-O-double-G



[Nate Dogg]

I can't be faded

I'm a nigga from the motherfuckin street...

I can't be faded

I'm a nigga from the motherfuckin street...

I can't be faded

I'm a nigga from the motherfuckin street...

I can't be faded

I'm a nigga from the motherfuckin street

I heard you wanna fuck with Dre

You picked the wrong motherfuckin day

Here we go, toe to toe, flow for flow

Let me know if you think you can fade Death Row

I heard you wanna fuck with Dre

You picked the wrong, motherfuckin day

Here we go, toe to toe, flow for flow

Let me know if you think you can fade Death Row



I can't be faded

I'm a nigga from the motherfuckin street...

I can't be faded

I'm a nigga from the motherfuckin street..."
