track_id,track_name,album_id,album_name,artist_id,artist_name,duration_ms,preview_url,release_year,lyrics
1uY1X8YeBixs1FdQ3fQ7d4,Auntie Diaries,79ONNoS4M9tfIA1mYLBYVX,Mr. Morale & The Big Steppers,2YZyLoL8N0Wb9xBt1NhZWg,Kendrick Lamar,281069,,2022,"Heart plays in waves, the mind can't figure out
Heart plays in waves, the mind can't figure out
Heart plays in waves, the mind can't figure out
Heart plays in waves, the mind can't figure out
This is how we conceptualize human beings

My auntie is a man now

I think I'm old enough to understand now

Drinking Paul Masson with her hat turned backwards

Motorola pager off like, ""Yes, Jackie""

Blue Air Max's, gold chains and curl kits

'93 Nissan wax job, the earliest

Big social, big personality, vocal

Played underground verbatim and stayed local

My auntie is a man now

I watch him and his girl hold their hands down

Tip of the avenues street lights made his

Thinking, ""I want me a bad bitch when I get big""

They walk the corner like California king

Cold hand all up her skirt, cars whistling down the road

See, my auntie is a man now, slight bravado

Scratching the likes from lotto

Hoping that she pull up tomorrow

So I can hang out in the front seat

Six by nines keeping the music up under me

My auntie is a man now

Asked my momma why my uncles don't like him that much

And at the parties why they always wanna fight him that much

She said ""Ain't no telling

Niggas always been jealous because he had more women

More money and more attention made more envy

Calling him anything but than broke was less offending""



My auntie is a man now

I think I'm old enough to understand now

Drinking Paul Masson with her hat turned backwards

Back when it was comedic relief to say ""Faggot""

Faggot, faggot faggot, we ain't know no better

Elementary kids with no filter however

My auntie became a man and I took pride in it

She wasn't gay, she ate pussy, and that was the difference

That's what I told my friends in second grade

She picking up from school, they stare at her in the face

They couldn't comprehend what I grew accustomed

We pull off bumpin' quick like it was nothing

My auntie is a man now, what a relationship

I grew up fast, I needed no one to babysit

He gave me some cash then gave me some gang

Cherry freshener on the dash, I never complained

She even cut my hair at the pad, was loving my fade

The first person I seen write a rap

That's when my life had changed

House full of demo, smoke stuck on the window

Cameras on the microphone, all women and men though

My auntie was a man now, we cool with it

The history had trickled down and made us ig'nant

My favorite cousin said he's returning the favor

And following my auntie with the same behavior



Demetrius is Mary-Ann now

He's more confident to live his plan now

But the family in disbelief this time

Convincing themselves ""He ain't living discreet, he's fine""

They said they never seen it in him, but I seen it

The Barbie dolls played off the reflection of Venus

He built a wall so tall you couldn't climb over

He didn't laugh as hard when the kids start joking

""Faggot, faggot, faggot"" We ain't know no better

Middle school kids with no filter, however

I had to be very mindful of my good cousin

I knew exactly who he was but I still loved him



Demetrius is Mary-Ann now

I mean he's really Mary-Ann, even took things further

Changed his gender before Bruce Jenner was certain

Living his truth even if it meant see a surgeon

We didn't talk for a while, he seemed more distant

Wasn't comfortable around me, everything was offensive

But I recall we both had a sick sense of humor

Made raw, but time changes all



Demetrius is Mary-Ann now

Remember church, Easter Sunday?

I sat in the pew, you had stronger faith

More spiritual when these dudes were living life straight

Which I found ironic 'cause the pastor didn't see him the same

He said my cousin was going through some things

He promised the world we living in was an act on abomination

And Demetrius was to blame

I knew you was conflicted by the feelings a preacher made

Wondering if God still call you a decent man

Still you found the courage to be subservient just to anoint

Until he singled you out to prove his point, saying



Demetrius is Mary-Ann now

Church, his auntie is a man now, it hurt

He the most 'cause his belief was close to his words

Forcing me to stand now

I said ""Mr. Preacher man, should we love thy neighbor?

The laws of the land or the heart, what's greater?

I recognize the study she was taught since birth

But that don't justify the feelings that my cousin preserved""

The building was thinking out loud, bad angel

That's when you looked at me and smiled, said ""Thank you""

The day I chose humanity over religion

The family got closer, it was all forgiven

I said them F-bombs, I ain't know any better

Mistakenly I didn't think you'd know any different

See, I was taught words was nothing more than a sound

If everything was pronounced without any intentions

If every second you challenge the shit I was kicking

Reminded me about a show I did out the city

That time I brung a fan on stage to rap

But disapproved the word that she couldn't say with me

You said ""Kendrick, ain't no room for contradiction

To truly understand love, switch position

'Faggot, faggot, faggot,' we can say it together

But only if you let a white girl say 'Nigga'"""
6CmpZfKUQ2KerzBFZ3QKFr,Mr. Morale,79ONNoS4M9tfIA1mYLBYVX,Mr. Morale & The Big Steppers,2YZyLoL8N0Wb9xBt1NhZWg,"Kendrick Lamar, Tanna Leone",210841,,2022,"I was born on February 24th, 1970
The day I was delivered they said I would build a legacy
Picture me with influence that last generations
I was made out of love to keep you happy and educated
The first three letters of the alphabet my name
I made you laugh, I made you dance, I made you sing

I been around the world and back, you recorded my almanac

So dearly way before the fact me and pops was estranged

My father was a public figure, bigger than life

Lived as a winner, on stages alike

Rivers of people surely united, just to see our bond

Time carried on, that was a common thread

My perfect father had many flaws

Still they moved they legs and shook they heads in unison

He had more children, I was the oldest

We always played with each other 'fore they ruined 'em

He told me his personal secrets, childhood catching on beatings

Sexually touched and abused, never seen life in a school

The price of being iconic was demonic and screwed

I stood on stage and had to watch my father on the news

Stress on the head of my spirit, I was lost and confused

I knew both sides of the story, but still, I couldn't choose

See, it was more than humiliation and bein' sued

They crucified my affiliation for points to prove

And now my purpose for livin' makes no difference to you

My total existence was for makin' a smiling move

They said that I'll live forever

But the moment he died, more accusations arrived

I had to die too



I remember takin' my first breath August 28th, 1963

The whole nation had saved the day, I made it on TV

My come out was a standing ova', the crowd in disbelief

How could a group of words be so great?

Designed to make you think

Races and faces embracin' my conscience in letter form

How gracious was I speakin' on changes once outside the norm?

The person responsible, my creator

He never conformed or used hatred to form mass retaliation

Watch him perform with conviction

Two hundred and fifty thousand souls left they homes to listen

I gather his thoughts in abundance made to complete the mission

His life became heroic, then tables turned

My creator stripped from being a poet because he yearned

Other women, infidelity stricken, I can't say he was perfect

It made me nervous, they tear him down and forget me

I prayed that I survived in the midst of the controversy

How many lives'll fall on deaf ears if I'm not worthy?

I won't justify his personal problems, that's not my job

I was only born to make sure your children can play outside

And I imagine the other demons he hid before he died

If they came to surface this dream probably won't be alive

Because of you



I was born in paranoia, it's poison for us

We can't create with joyous ambition, we're out of luck

The critics formed a new coalition and huddled up

The non-creators are now elated and out of touch

Why can't you gladly appreciate the influence we give?

Stop starin' at me disgusted, my substance made sure you'd lived

You want the head of the messenger and the history from him

Which eventually takes away from the good you accustom

Think of a life without the likes of imagination that's prosperin'

The bodies that you consider genius, you like to box 'em in

The great debaters and thinkers, they gave you a voice

Why can't you prosecute the crimes and not the thoughts I employ?

Because your better judgement will always look down on me

But if I recollect how we connect, you'll account on me

I got a theory that most of y'all won't allow to see

It goes like this, talent doesn't choose morality

See, if Daniel Hale was a killer, would you not want a heart?

If Carl Benz was a racist, would you stop driving cars?

I can't help we jump in these bodies and you called them a God

Just know the Earth is just a rock without the voices of art

Sincerely yours"
346SJSEbB6pNZMpwovxDiu,Mother I Sober (feat. Beth Gibbons of Portishead),79ONNoS4M9tfIA1mYLBYVX,Mr. Morale & The Big Steppers,2YZyLoL8N0Wb9xBt1NhZWg,"Kendrick Lamar, Beth Gibbons",406528,,2022,"I'm sensitive, I feel everything, I feel everybody
One man standin' on two words, heal everybody
Transformation, then reciprocation, karma must return
Heal myself, secrets that I hide, buried in these words
Death threats, ego must die, but I let it purge
Pacify broken, pieces of me, it was all a blur

Mother cried, put they hands on her, it was family ties

I heard it all, I should've grabbed a gun, but I was only five

I still feel weighin' on my heart, my first tough decision

In the shadows clingin' to my soul as my only critic

Where's my faith? Told you I was Christian, but just not today

I transformed, prayin' to the trees, God is taken shape

My mother's mother followed me for years in her afterlife

Starin' at me on back of some buses, I wake up at night

Loved her dearly, traded in my tears for a Range Rover

Transformation, you ain't felt grief 'til you felt it sober



I wish I was somebody

Anybody but myself

Ooh, I wish I was somebody

Anybody but myself



I remember lookin' in the mirror knowin' I was gifted

Only child, me for seven years, everything for Christmas

Family ties, they accused my cousin

""Did he touch you Kendrick?""

Never lied, but no one believed me when I said ""He didn't""

Frozen moments, still holdin' on it

Hard to trust myself, I started rhymin'

Copin' mechanisms to lift up myself

Talked to my lawyer, told me not to be so hard on myself

He has an aurora, I hope to achieve

If I find some help, congratulations, made it to be famous

Still I feel uneasy, water watchin', live my life in nature

Only thing relieves me

Spirit guide whisper in my ear tell me that she sees me

""Did he touch you?"" I said ""No"" again, still they didn't believe me

Mothers brother said he got revenge for my mothers face

Black and blue, the image of my queen that I can't erase

'Til this day can't look her in the eyes pain is takin' over

Blame myself, you never felt guilt 'til you felt it sober



I wish I was somebody

Anybody but myself

Ooh, I wish I was somebody

Anybody but myself



I was never high, I was never drunk

Never out my mind, I need control

They handed me some smoke, but still I declined

I did it sober sittin' with myself

I went through all emotions, no dependents

Except for the one, let me bring you closer, intoxicated

There's a lustful nature that I failed to mention

Insecurities that I project, sleepin' with other women

Whitney's hurt, the pure soul I know, I found her in the kitchen

Askin' God ""Where did I lose myself? And can it be forgiven?""

Broke me down, she looked me in my eyes

""Is there an addiction?"" I said ""No"", but this time I lied

I knew that I can't fix it, pure soul, even in her pain

Know she cared for me, gave me a number

Said she recommended some therapy

I asked my momma why she didn't believe me when I told her ""No""

I never knew she was violated in Chicago, I'm sympathetic

Told me that she feared it happened to me, for my protection

Though it never happened, she wouldn't agree

Now I'm affected, twenty years later trauma has resurfaced

Amplified as I write this song, I shiver 'cause I'm nervous

I was five, questioning myself, 'lone for many years

Nothing's wrong, just results on how them questions made me feel

I made it home, seven years on tour, chasin' manhood

But Whitney's gone by time you hear this song, she did all she could

All these women gave me super powers, what I thought I lacked

I pray our children don't inherit me and my feelings

I attract a conversation, not bein' addressed in black families

The devastation hauntin' generations and humanity

They raped our mothers, then they raped our sisters

Then they made us watch, then made us rape each other

Psychotic torture between our lives we ain't recovered

Still livin' as victims in the public eyes who pledge allegiance

Every other brother has been compromised

I know the secrets, every other rapper sexually abused

I see 'em daily burin' the pain in chains and tattoos

So listen close before you start to pass judgement on how we move

Learn how we cope, whenever his uncle had to walk him from school

His ankle grows deep in misogyny

This is posttraumatic black families and a sodomy, today is still active

So I set free myself from all the guilt that I thought I made

So I set free my mother all the hurt that she titled shame

So I set free my cousin, khaotic for my mothers pain

I hope Hykeem made you proud, 'cause you ain't die in vein

So I set free the power of Whitney, may she heal us all

So I set free out children, may good karma keep them with God

So I set free the hearts filled with hatred, keep our bodies sacred

As I set free all you abusers, this is transformation



I wish I was somebody

Anybody but myself

Ooh, I wish I was somebody

Anybody but myself



You did it, I'm proud of you

You broke a generational curse

Say ""Thank you dad""

Thank you daddy, thank you mommy, thank you brother

Mr. Morale"
5xoYormSTltk6F9SlQV6mm,Mirror,79ONNoS4M9tfIA1mYLBYVX,Mr. Morale & The Big Steppers,2YZyLoL8N0Wb9xBt1NhZWg,Kendrick Lamar,256006,,2022,"I choose me
The pressure's taking over me, it's beginning to loom
Better if I spare your feelings and tell you the truth
Lately, I redirected my point of view
You won't grow waitin' on me

I can't live in the Matrix, huh

Rather for sure than your graces, huh

This time I won't trade places, huh

Not about who's right, who's wrong, huh

Evolve, the only thing known, huh

Ask me when I'm coming home, huh

Bleed twice again, I'm gone



I choose me, I'm sorry

I choose me, I'm sorry

I choose me, I'm sorry

I choose me, I'm sorry

I choose me, I'm sorry

I choose me, I'm sorry



She woke up in the morning for the daily news

I was all low in the morning due to family feuds

Baby, I told you a story and I'll lay down all the rules

Still, you wasn't gon' wait on me



I choose me, I'm sorry

I choose me, I'm sorry

I choose me, I'm sorry

I choose me, I'm sorry

I choose me, I'm sorry

I choose me, I'm sorry



'Cause all of us toxic

Girl, I'm not relevant to givin' on profit

Personal gain off my pain, it's nonsense

Darlin' my demons is off the leash for a moshpit

Baby, I just had a baby, she need me

Workin' on myself, the counselin' is not easy

Don't you point a finger, just to point a finger

'Cause critical thinkin' is a deal-breaker

Faith in one man is a ship sinking

Do yourself a favor and get a mirror

The mirror grieving

Then point it at me so the reflection can mirror freedom

She told me she need me the most, I didn't believe her

She even called me names on the post, the world can see it

Jokes and gaslightin'

Mad at me 'cause she didn't get my vote, she say I'm triffiln'

Disregardin' the way that I cope with my own vices

Maybe, it's time to break it off

Runaway from the culture to follow my heart



I realized, true love's not savin' face, but, unconditional

When will you let me go?

I trust your fine independence

If not, then all is forgiven

Sorry our things saved the world my friend

I was too busy buildin' my redempt'



I choose me, I'm sorry

I choose me, I'm sorry

I choose me, I'm sorry

I choose me, I'm sorry

I choose me, I'm sorry

I choose me, I'm sorry

I choose me, I'm sorry

I choose me, I'm sorry

I choose me, I'm sorry

I choose me, I'm sorry

I choose me, I'm sorry

I choose me, I'm sorry"
5qbhVL3vB7HwWvb0042B7y,The Heart Part 5,79ONNoS4M9tfIA1mYLBYVX,Mr. Morale & The Big Steppers,2YZyLoL8N0Wb9xBt1NhZWg,Kendrick Lamar,332228,,2022,"As I get a little older, I realize life is perspective
And my perspective may differ from yours
I wanna say thank you to everyone that's been down with me
All my fans, all my beautiful fans
Anyone who's ever gave me a listen, all my people

I come from a generation of pain, where murder is minor

Rebellious and Margielas'll chip you for designer

Belt buckles and clout, overzealous if prone to violence

Make the wrong turn, be it will or the wheel alignment

Residue burned, mist of the inner-city

Miscommunication to keep homi' detective busy

No protection is risky

Desensitized, I vandalized pain, covered up and camouflaged

Get used to hearin' arsenal rain

Analyze, risk your life, take the charge

Homies done fucked your baby mama once you hit the yard, that's culture

Twenty-three hour lockdown, then somebody called

Said your lil' nephew was shot down, the culture's involved

I done seen niggas do seventeen, hit the halfway house

Get out and get his brains blown out, lookin' to buy some weed

Car wash is played out, new GoFundMe accounts'll proceed

A brand-new victim'll shatter those dreams, the culture



(I want, I want, I want, I want)

But I want you to want me too (I want, I want, I want, I want)

I want the hood to want me back (I want, I want, I want, I want)

I want the hood

Look what I done for you (Look what I done for you)

Look what I done for you



I said I do this for my culture

To let y'all know what a nigga look like in a bulletproof Rover

In my mama's sofa was a doo-doo popper

Hair trigger, walk up closer, ain't no Photoshoppin'

Friends bipolar, grab you by your pockets

No option if you froze up, always play the offense

Niggas goin' to work and sellin' work, late for work

Workin' late, prayin' for work, but he on paperwork

That's the culture, point the finger, promote ya

Remote location, witness protection, they gon' hold ya

The streets got me fucked up, y'all can miss me

I wanna represent for us

New revolution was up and movin'

I'm in Argentina wiping my tears full of confusion

Water in between us, another peer's been executed

History repeats again

Make amends, then find a nigga with the same skin to do it

But that's the culture, crack a bottle

Hard to deal with the pain when you're sober

By tomorrow, we forget the remains, we start over

That's the problem

Our foundation was trained to accept whatever follows

Dehumanized, insensitive

Scrutinize the way we live for you and I

Enemies shook my hand, I can promise I'll meet you

In the land where no equal is your equal

Never say I ain't told ya, nah

In the land where hurt people hurt more people

Fuck callin' it culture



(I want, I want, I want, I want)

But I want you to want me too (I want, I want, I want, I want)

I want the hood to want me back (I want, I want, I want, I want)

I want the hood

Look what I done for you (Look what I done for you)

Look what I done for you



Take the drums out

(Heavy breathing)



Celebrate new life when it come back around

The purpose is in the lessons we learnin' now

Sacrifice personal gain over everything

Just to see the next generation better than ours

I wasn't perfect, the skin I was in had truly suffered

Temptation, impatience, everything that the body nurtures

I felt the good, I felt the bad, and I felt the worry

But all-in-all, my productivity had stayed urging

Face your fears, always knew that I would make it here

Where the energy is magnified and persevered

Consciousness is synchronized and crystal-clear

Euphoria is glorified and made His

Reflectin' on my life and what I done

Paid dues, made rules, change outta love

Them same views made schools change curriculums

But didn't change me starin' down the barrel of that gun

Should I feel resentful I didn't see my full potential?

Should I feel regret about the good that I was into?

Everything is everything, this ain't coincidental

I woke up that morning with more heart to give you

As I bleed through the speakers, feel my presence

To my brother, to my kids, I'm in Heaven

To my mother, to my sis, I'm in Heaven

To my father, to my wife, I am serious, this is Heaven

To my friends, make sure you countin' them blessings

To my fans, make sure you make them investments

And to the killer that sped up my demise

I forgive you, just know your soul's in question

I seen the pain in your pupil when that trigger had squeezed

And though you did me gruesome, I was surely relieved

I completed my mission, wasn't ready to leave

But fulfilled my days, my Creator was pleased

I can't stress how I love y'all

I don't need to be in flesh just to hug y'all

The memories recollect just because y'all

Celebrate me with respect

The unity we protect is above all

And Sam, I'll be watchin' over you

Make sure my kids watch all my interviews

Make sure you live all the dreams we produced

Keep that genius in your brain on the move

And to my neighborhood, let the good prevail

Make sure them babies and them leaders outta jail

Look for salvation when troubles get real

'Cause you can't help the world until you help yourself

And I can't blame the hood the day that I was killed

Y'all had to see it, that's the only way to feel

And though my physical won't reap the benefits

The energy that carry on emits still

I want you"
5qN4HFkapdAOV94XPryVof,Black Panther,3pLdWdkj83EYfDN6H2N8MR,Black Panther The Album Music From And Inspired By,2YZyLoL8N0Wb9xBt1NhZWg,Kendrick Lamar,130613,,2018,"Wait
King of my city, king of my country, king of my homeland
King of the filthy, king of the fallen, we living again
King of the shooters, looters, boosters, and ghettos poppin'
King of the past, present, future, my ancestors watching

King of the culture, king of the soldiers, king of the bloodshed

King of the wisdom, king of the ocean, king of the respect

King of the opps that miss it and dreamers that go and get it

King of the winners, district and geniuses with conviction

King of the fighters, king of the fathers, king of the belated

King of the answer, king of the problem, king of the forsaken

King of the empathy, you resent me, king of remorse

King of my enemies, may they father feed, I rejoice

King of the skyscrapers, dodging haters, broke religion

Nine faces, go against 'em, I erased 'em with precision

I embrace them with collision

Kings did it, king vision, Black Panther, King Kendrick

All hail the king, I dropped a million tears

I know several responsibilities put me here

I don't pedal backwards but I live old-fashioned

And the lens that I'm looking through

Won't prescribe me the right glasses, masses are now free

Ashes I'm dumping out, 'bout to spread 'cross all seas

Sisters and brother in unison, not because of me

Because we don't glue with the opposition, we glue with peace

And I'm still gon' fuck up your organization if any beef

What do you stand for?

Are you an activist? What are your city plans for?

Are you an accident, are you just in the way?

Your native tongue contradicting what your body language say

Are you a king or you joking, are you a king or you posing?

Are you a king or you smoking bud rocks to keep you open?

Because the king don't cry, king don't die

King don't lie, king give heart, king get by, king don't fall

Kingdom come, when I come, you know why

King, king, king, king

I am T'Challa!"
